paragraph	sentence	mid	title	start	end	notable_types
In January 2006, Disney bought Pixar in a deal that put Pixar chiefs Edwin Catmull and John Lasseter in charge of all Disney Animation. Shortly thereafter, Circle 7 Animation was shut down and its version of Toy Story 3 was cancelled. The character designs went into the Disney archives. The following month, Disney CEO Robert Iger confirmed that Disney was in the process of transferring the production to Pixar. John Lasseter, Andrew Stanton, Pete Docter, and Lee Unkrich visited the house where they first pitched Toy Story and came up with the story for the film over a weekend. Stanton then wrote a treatment. On February 8, 2007, Catmull announced Toy Story 2's co-director, Lee Unkrich, as the sole director of the film instead of John Lasseter (who was busy directing Cars 2), and Michael Arndt as screenwriter. The release date was moved to 2010. Unkrich said that he felt pressure to avoid creating "the first dud" for Pixar, since as of 2010 all of Pixar's films had been critical and commercial successes.	In January 2006, Disney bought Pixar in a deal that put Pixar chiefs Edwin Catmull and John Lasseter in charge of all Disney Animation.	/m/017h4c	Edwin_Catmull	69	82	/award/award_winner,/computer/computer_scientist,/education/academic,/film/actor,/film/director,/film/editor,/film/person_or_entity_appearing_in_film,/film/producer,/influence/influence_node,/organization/organization_founder,/people/person
In 2006, Pixar executives Edwin Catmull and John Lasseter assumed the studio as President and Chief Creative Officer, respectively. Since the release of Meet the Robinsons the following year, the studio has had a new logo to make themselves separate from Pixar. The logo features the iconic image of Mickey Mouse in the classic short, Steamboat Willie. Their 53rd feature, Frozen, is currently in post-production and set for release on November 27, 2013. Their 54th, Big Hero 6, is currently in development and set for release on November 7, 2014.	In 2006, Pixar executives Edwin Catmull and John Lasseter assumed the studio as President and Chief Creative Officer, respectively.	/m/017h4c	Edwin_Catmull	26	39	/award/award_winner,/computer/computer_scientist,/education/academic,/film/actor,/film/director,/film/editor,/film/person_or_entity_appearing_in_film,/film/producer,/influence/influence_node,/organization/organization_founder,/people/person
The transition to CGI was not enough to renew interest in Disney animation, as Walt Disney Feature Animation features were routinely outperformed by those of corporate partner Pixar, who The Walt Disney Company had originally contracted to create CGI films. In response to this, Disney purchased Pixar in 2006. On March 21, 2006, Circle 7 was shut down, and 80% of the studios employees was transferred to Walt Disney Feature Animation. Walt Disney Feature Animation was renamed Walt Disney Animation Studios, and as part of the acquisition, Pixar and Walt Disney Animation Studios continue to maintain separate studios and release their films under separate banners, with former Pixar executives Edwin Catmull and John Lasseter serving as both studios' president and Chief Creative Officer, respectively.	Walt Disney Feature Animation was renamed Walt Disney Animation Studios, and as part of the acquisition, Pixar and Walt Disney Animation Studios continue to maintain separate studios and release their films under separate banners, with former Pixar executives Edwin Catmull and John Lasseter serving as both studios' president and Chief Creative Officer, respectively.	/m/017h4c	Edwin_Catmull	260	273	/award/award_winner,/computer/computer_scientist,/education/academic,/film/actor,/film/director,/film/editor,/film/person_or_entity_appearing_in_film,/film/producer,/influence/influence_node,/organization/organization_founder,/people/person
The Catmull–Clark algorithm is used in computer graphics to create smooth surfaces by subdivision surface modeling. It was devised by Edwin Catmull and Jim Clark in 1978 as a generalization of bi-cubic uniform B-spline surfaces to arbitrary topology. In 2005, Edwin Catmull received an Academy Award for Technical Achievement together with Tony DeRose and Jos Stam for their invention and application of subdivision surfaces.	It was devised by Edwin Catmull and Jim Clark in 1978 as a generalization of bi-cubic uniform B-spline surfaces to arbitrary topology.	/m/017h4c	Edwin_Catmull	18	31	/award/award_winner,/computer/computer_scientist,/education/academic,/film/actor,/film/director,/film/editor,/film/person_or_entity_appearing_in_film,/film/producer,/influence/influence_node,/organization/organization_founder,/people/person
The Catmull–Clark algorithm is used in computer graphics to create smooth surfaces by subdivision surface modeling. It was devised by Edwin Catmull and Jim Clark in 1978 as a generalization of bi-cubic uniform B-spline surfaces to arbitrary topology. In 2005, Edwin Catmull received an Academy Award for Technical Achievement together with Tony DeRose and Jos Stam for their invention and application of subdivision surfaces.	In 2005, Edwin Catmull received an Academy Award for Technical Achievement together with Tony DeRose and Jos Stam for their invention and application of subdivision surfaces.	/m/017h4c	Edwin_Catmull	9	22	/award/award_winner,/computer/computer_scientist,/education/academic,/film/actor,/film/director,/film/editor,/film/person_or_entity_appearing_in_film,/film/producer,/influence/influence_node,/organization/organization_founder,/people/person
In 1965, the University of Utah recruited him back to start their own computer science department. When he was building up the University of Utah department in 1968 he managed to convince Ivan Sutherland (who had funded Evans' DARPA research) to come to Utah, accepting the condition that they start a computer graphics company together. Evans retired from the company in 1994. Students at Utah included Alan Kay, Edwin Catmull, James H. Clark, John Warnock, and Alan Ashton.	Students at Utah included Alan Kay, Edwin Catmull, James H. Clark, John Warnock, and Alan Ashton.	/m/017h4c	Edwin_Catmull	36	49	/award/award_winner,/computer/computer_scientist,/education/academic,/film/actor,/film/director,/film/editor,/film/person_or_entity_appearing_in_film,/film/producer,/influence/influence_node,/organization/organization_founder,/people/person
Alan Ashton
Duane Call
Edwin Catmull
James H. Clark
Henri Gouraud
Alan Kay
Bui Tuong Phong	Alan Ashton
Duane Call
Edwin Catmull
James H. Clark
Henri Gouraud
Alan Kay
Bui Tuong Phong	/m/017h4c	Edwin_Catmull	23	36	/award/award_winner,/computer/computer_scientist,/education/academic,/film/actor,/film/director,/film/editor,/film/person_or_entity_appearing_in_film,/film/producer,/influence/influence_node,/organization/organization_founder,/people/person
In 2007, Pixar executives Edwin Catmull and John Lasseter assumed the studio as President and Chief Creative Officer, respectively. Since the release of Tinker Bell the following year, the studio began to focus on the production of spin-offs of both Disney and Pixar films, rather than direct-to-video sequels. Their 61st feature, Planes, is currently in production and set for release on August 9, 2013.	In 2007, Pixar executives Edwin Catmull and John Lasseter assumed the studio as President and Chief Creative Officer, respectively.	/m/017h4c	Edwin_Catmull	26	39	/award/award_winner,/computer/computer_scientist,/education/academic,/film/actor,/film/director,/film/editor,/film/person_or_entity_appearing_in_film,/film/producer,/influence/influence_node,/organization/organization_founder,/people/person
Precursor work in texture mapping had been established by Edwin Catmull, with refinements for curved surfaces by James Blinn, in 1974.  Blinn went on to further refine his work, developing environment mapping by 1976.	Precursor work in texture mapping had been established by Edwin Catmull, with refinements for curved surfaces by James Blinn, in 1974.	/m/017h4c	Edwin_Catmull	58	71	/award/award_winner,/computer/computer_scientist,/education/academic,/film/actor,/film/director,/film/editor,/film/person_or_entity_appearing_in_film,/film/producer,/influence/influence_node,/organization/organization_founder,/people/person
Alvy Ray Smith (born 8 September 1943) is a noted pioneer in computer graphics. He is cofounder, with Edwin Catmull, of the animation studio Pixar, financed by Steve Jobs.	He is cofounder, with Edwin Catmull, of the animation studio Pixar, financed by Steve Jobs.	/m/017h4c	Edwin_Catmull	22	35	/award/award_winner,/computer/computer_scientist,/education/academic,/film/actor,/film/director,/film/editor,/film/person_or_entity_appearing_in_film,/film/producer,/influence/influence_node,/organization/organization_founder,/people/person
With Ed Catmull, Smith was a founding member of the Lucasfilm Computer Division, which developed computer graphics software, including early renderer technology. While there, as Director of the Computer Graphics Project, he created and directed the "Genesis Demo" in The Wrath of Khan, and conceived and directed the short animated film The Adventures of Andre and Wally B., starring the animator John Lasseter for the first time.	With Ed Catmull, Smith was a founding member of the Lucasfilm Computer Division, which developed computer graphics software, including early renderer technology.	/m/017h4c	Edwin_Catmull	5	15	/award/award_winner,/computer/computer_scientist,/education/academic,/film/actor,/film/director,/film/editor,/film/person_or_entity_appearing_in_film,/film/producer,/influence/influence_node,/organization/organization_founder,/people/person
He and Ed Catmull co-founded Pixar on 3 Feb. 1986. After the spinout from Lucasfilm of Pixar, funded by Steve Jobs, he served on the Board of Directors and was Executive Vice President. According to the Steve Jobs biography iCon by Jeffrey S. Young and William L. Simon, Alvy Ray quit Pixar after a heated argument with Jobs over use of a whiteboard. See also Isaacson. Despite being the co-founder of Pixar, Young and Simon claim that the company has largely overlooked his part in company history since his departure. For example, there is no mention of Smith on the Pixar website.	He and Ed Catmull co-founded Pixar on 3 Feb. 1986.	/m/017h4c	Edwin_Catmull	7	17	/award/award_winner,/computer/computer_scientist,/education/academic,/film/actor,/film/director,/film/editor,/film/person_or_entity_appearing_in_film,/film/producer,/influence/influence_node,/organization/organization_founder,/people/person
Futureworld was the first major feature film to use 3D computer-generated imagery (CGI). CGI was used for an animated hand and face. The animated hand was a digitized version of Edwin Catmull's left hand, taken from his 1971 experimental short subject A Computer Animated Hand. The film also used 2D digital compositing to materialize characters over a background.	The animated hand was a digitized version of Edwin Catmull's left hand, taken from his 1971 experimental short subject A Computer Animated Hand.	/m/017h4c	Edwin_Catmull	45	60	/award/award_winner,/computer/computer_scientist,/education/academic,/film/actor,/film/director,/film/editor,/film/person_or_entity_appearing_in_film,/film/producer,/influence/influence_node,/organization/organization_founder,/people/person
Jim Blinn first introduced the idea of normal mapping in a 1978 SIGGRAPH paper. Blinn pointed out that the earlier idea of unlit texture mapping proposed by Edwin Catmull was unrealistic for simulating rough surfaces. Instead of mapping a texture onto an object to simulate roughness, Blinn proposed a method of calculating the degree of lighting a point on a surface should receive based on an established "perturbation" of the normals across the surface.	Blinn pointed out that the earlier idea of unlit texture mapping proposed by Edwin Catmull was unrealistic for simulating rough surfaces.	/m/017h4c	Edwin_Catmull	77	90	/award/award_winner,/computer/computer_scientist,/education/academic,/film/actor,/film/director,/film/editor,/film/person_or_entity_appearing_in_film,/film/producer,/influence/influence_node,/organization/organization_founder,/people/person
Ingebretsen worked with Pixar co-founder Ed Catmull in 1972 to produce one of the first digital films, a 20-second portrait of a human hand.	Ingebretsen worked with Pixar co-founder Ed Catmull in 1972 to produce one of the first digital films, a 20-second portrait of a human hand.	/m/017h4c	Edwin_Catmull	41	51	/award/award_winner,/computer/computer_scientist,/education/academic,/film/actor,/film/director,/film/editor,/film/person_or_entity_appearing_in_film,/film/producer,/influence/influence_node,/organization/organization_founder,/people/person
However, after Disney's acquisition of Pixar in early 2006, the studio has rekindled interest towards 2-D animation thanks to new leaders John Lasseter and Edwin Catmull. A new 2-D animated feature, The Princess and the Frog was released in 2009, with Musker and Clements directing and Randy Newman handling the music. The film returns to the Broadway-style musical of Aladdin, The Little Mermaid and other successful Disney animated films of the late '80s and early '90s.	However, after Disney's acquisition of Pixar in early 2006, the studio has rekindled interest towards 2-D animation thanks to new leaders John Lasseter and Edwin Catmull.	/m/017h4c	Edwin_Catmull	156	169	/award/award_winner,/computer/computer_scientist,/education/academic,/film/actor,/film/director,/film/editor,/film/person_or_entity_appearing_in_film,/film/producer,/influence/influence_node,/organization/organization_founder,/people/person
Disney had once announced that 2004's Home on the Range would be their feature animation studio's last traditionally animated production. After the company's acquisition of Pixar in early 2006, Ed Catmull and John Lasseter, the new president and chief creative officer of Disney Animation Studios, reversed this decision and reinstated hand-drawn animation at the studio. Many animators who had either been laid off or had left the studio when the traditional animation units were dissolved in 2003 were located and re-hired for the project.	After the company's acquisition of Pixar in early 2006, Ed Catmull and John Lasseter, the new president and chief creative officer of Disney Animation Studios, reversed this decision and reinstated hand-drawn animation at the studio.	/m/017h4c	Edwin_Catmull	56	66	/award/award_winner,/computer/computer_scientist,/education/academic,/film/actor,/film/director,/film/editor,/film/person_or_entity_appearing_in_film,/film/producer,/influence/influence_node,/organization/organization_founder,/people/person
However, after Disney's acquisition of Pixar in early 2006, the studio has rekindled interest towards 2-D animation thanks to new leaders John Lasseter and Edwin Catmull. A new 2-D animated feature, The Princess and the Frog, was released in 2009, with Musker and Clements directing and Randy Newman handling the music. The film returns to the Broadway-style musical, like Aladdin, The Little Mermaid and other successful Disney animated films of the late 1980s and early 1990s.	However, after Disney's acquisition of Pixar in early 2006, the studio has rekindled interest towards 2-D animation thanks to new leaders John Lasseter and Edwin Catmull.	/m/017h4c	Edwin_Catmull	156	169	/award/award_winner,/computer/computer_scientist,/education/academic,/film/actor,/film/director,/film/editor,/film/person_or_entity_appearing_in_film,/film/producer,/influence/influence_node,/organization/organization_founder,/people/person
Also dedicating its homepage to Jobs was Pixar, with a photo of Jobs, John Lasseter and Edwin Catmull, and the eulogy they wrote:	Also dedicating its homepage to Jobs was Pixar, with a photo of Jobs, John Lasseter and Edwin Catmull, and the eulogy they wrote:	/m/017h4c	Edwin_Catmull	88	101	/award/award_winner,/computer/computer_scientist,/education/academic,/film/actor,/film/director,/film/editor,/film/person_or_entity_appearing_in_film,/film/producer,/influence/influence_node,/organization/organization_founder,/people/person
In 1997, Foley was recognized by ACM SIGGRAPH with the prestigious Steven A. Coons Award. The receipt of this biannual award places Foley among the company of computer graphics pioneers such as Jim Blinn, Edwin Catmull and Ivan Sutherland.	The receipt of this biannual award places Foley among the company of computer graphics pioneers such as Jim Blinn, Edwin Catmull and Ivan Sutherland.	/m/017h4c	Edwin_Catmull	115	128	/award/award_winner,/computer/computer_scientist,/education/academic,/film/actor,/film/director,/film/editor,/film/person_or_entity_appearing_in_film,/film/producer,/influence/influence_node,/organization/organization_founder,/people/person
The CGL's roster was a digital dream team. Prominent members included future Pixar Animation Studios President Edwin Catmull and co-founder Alvy Ray Smith; Walt Disney Feature Animation Chief Scientist Lance Joseph Williams; DreamWorks animator Hank Grebe; Computer Media Artist Rebecca Allen and Netscape and Silicon Graphics founder Jim Clark.	Prominent members included future Pixar Animation Studios President Edwin Catmull and co-founder Alvy Ray Smith; Walt Disney Feature Animation Chief Scientist Lance Joseph Williams; DreamWorks animator Hank Grebe; Computer Media Artist Rebecca Allen and Netscape and Silicon Graphics founder Jim Clark.	/m/017h4c	Edwin_Catmull	68	81	/award/award_winner,/computer/computer_scientist,/education/academic,/film/actor,/film/director,/film/editor,/film/person_or_entity_appearing_in_film,/film/producer,/influence/influence_node,/organization/organization_founder,/people/person
William Fetter was credited with coining the term computer graphics in 1961 to describe his work at Boeing. One of the first displays of computer animation was Futureworld (1976), which included an animation of a human face and a hand—produced by Ed Catmull and Fred Parke at the University of California.	One of the first displays of computer animation was Futureworld (1976), which included an animation of a human face and a hand—produced by Ed Catmull and Fred Parke at the University of California.	/m/017h4c	Edwin_Catmull	139	149	/award/award_winner,/computer/computer_scientist,/education/academic,/film/actor,/film/director,/film/editor,/film/person_or_entity_appearing_in_film,/film/producer,/influence/influence_node,/organization/organization_founder,/people/person
Schure found the progress on the new Tubby was very slow, hindered by the tedious frame-by-frame process occasionally encountered in the hand-drawn art. In response, he turned to an interest in the then-young field of computer graphics, and recruited several consultants and scientists from NYIT so that the project could go on. Two of the later crew members were Edwin Catmull and Alvy Ray Smith, the future founders of Pixar Studios.	Two of the later crew members were Edwin Catmull and Alvy Ray Smith, the future founders of Pixar Studios.	/m/017h4c	Edwin_Catmull	35	48	/award/award_winner,/computer/computer_scientist,/education/academic,/film/actor,/film/director,/film/editor,/film/person_or_entity_appearing_in_film,/film/producer,/influence/influence_node,/organization/organization_founder,/people/person
One of the first displays of computer animation was Futureworld (1976), which included an animation of a human face and hand — produced by Ed Catmull and Fred Parke at the University of Utah.	One of the first displays of computer animation was Futureworld (1976), which included an animation of a human face and hand — produced by Ed Catmull and Fred Parke at the University of Utah.	/m/017h4c	Edwin_Catmull	139	149	/award/award_winner,/computer/computer_scientist,/education/academic,/film/actor,/film/director,/film/editor,/film/person_or_entity_appearing_in_film,/film/producer,/influence/influence_node,/organization/organization_founder,/people/person
Many of the most important early breakthroughs in computer graphics research occurred at the University of Utah in the 1970s. A student by the name of Edwin Catmull started at the University of Utah in 1970 and signed up for Sutherland's computer graphics class. Catmull had just come from The Boeing Company and had been working on his degree in physics. Growing up on Disney, Catmull loved animation yet quickly discovered that he did not have the talent for drawing. Now Catmull (along with many others) saw computers as the natural progression of animation and they wanted to be part of the revolution. The first animation that Catmull saw was his own. He created an animation of his hand opening and closing. It became one of his goals to produce a feature length motion picture using computer graphics. In the same class, Fred Parke created an animation of his wife's face. Because of Evan's and Sutherland's presence, UU was gaining quite a reputation as the place to be for computer graphics research so Catmull went there to learn 3D animation.	A student by the name of Edwin Catmull started at the University of Utah in 1970 and signed up for Sutherland's computer graphics class.	/m/017h4c	Edwin_Catmull	25	38	/award/award_winner,/computer/computer_scientist,/education/academic,/film/actor,/film/director,/film/editor,/film/person_or_entity_appearing_in_film,/film/producer,/influence/influence_node,/organization/organization_founder,/people/person
Schure was also an early and decisive champion of computer animation. For almost five years, NYIT gave research funding and a home to the brain trust that would evolve into Pixar Animation Studios. In November, 1974, Schure hired recent University of Utah doctoral graduate Edwin Catmull to direct NYIT's fledgling computer graphics lab. (Later, in the 1980s, Catmull would team with John Lasseter to form Pixar.) The core technical team included computer animation pioneers Edwin Catmull, Alvy Ray Smith, David DiFrancesco, Ralph Guggenheim, Jim Blinn, and Jim Clark.	In November, 1974, Schure hired recent University of Utah doctoral graduate Edwin Catmull to direct NYIT's fledgling computer graphics lab.	/m/017h4c	Edwin_Catmull	76	89	/award/award_winner,/computer/computer_scientist,/education/academic,/film/actor,/film/director,/film/editor,/film/person_or_entity_appearing_in_film,/film/producer,/influence/influence_node,/organization/organization_founder,/people/person
Schure was also an early and decisive champion of computer animation. For almost five years, NYIT gave research funding and a home to the brain trust that would evolve into Pixar Animation Studios. In November, 1974, Schure hired recent University of Utah doctoral graduate Edwin Catmull to direct NYIT's fledgling computer graphics lab. (Later, in the 1980s, Catmull would team with John Lasseter to form Pixar.) The core technical team included computer animation pioneers Edwin Catmull, Alvy Ray Smith, David DiFrancesco, Ralph Guggenheim, Jim Blinn, and Jim Clark.	) The core technical team included computer animation pioneers Edwin Catmull, Alvy Ray Smith, David DiFrancesco, Ralph Guggenheim, Jim Blinn, and Jim Clark.	/m/017h4c	Edwin_Catmull	63	76	/award/award_winner,/computer/computer_scientist,/education/academic,/film/actor,/film/director,/film/editor,/film/person_or_entity_appearing_in_film,/film/producer,/influence/influence_node,/organization/organization_founder,/people/person
Schure was also an early and decisive champion of computer animation. For almost five years, NYIT gave research funding and a home to the brain trust that would evolve into Pixar Animation Studios. In November, 1974, Schure hired recent University of Utah doctoral graduate Edwin Catmull to direct NYIT's fledgling computer graphics lab. (Later, in the 1980s, Catmull would team with John Lasseter to form Pixar.) The core technical team included computer animation pioneers Edwin Catmull, Alvy Ray Smith, David DiFrancesco, Ralph Guggenheim, Jim Blinn, and Jim Clark.	In November, 1974, Schure hired recent University of Utah doctoral graduate Edwin Catmull to direct NYIT's fledgling computer graphics lab.	/m/017h4c	Edwin_Catmull	76	89	/award/award_winner,/computer/computer_scientist,/education/academic,/film/actor,/film/director,/film/editor,/film/person_or_entity_appearing_in_film,/film/producer,/influence/influence_node,/organization/organization_founder,/people/person
Schure was also an early and decisive champion of computer animation. For almost five years, NYIT gave research funding and a home to the brain trust that would evolve into Pixar Animation Studios. In November, 1974, Schure hired recent University of Utah doctoral graduate Edwin Catmull to direct NYIT's fledgling computer graphics lab. (Later, in the 1980s, Catmull would team with John Lasseter to form Pixar.) The core technical team included computer animation pioneers Edwin Catmull, Alvy Ray Smith, David DiFrancesco, Ralph Guggenheim, Jim Blinn, and Jim Clark.	) The core technical team included computer animation pioneers Edwin Catmull, Alvy Ray Smith, David DiFrancesco, Ralph Guggenheim, Jim Blinn, and Jim Clark.	/m/017h4c	Edwin_Catmull	63	76	/award/award_winner,/computer/computer_scientist,/education/academic,/film/actor,/film/director,/film/editor,/film/person_or_entity_appearing_in_film,/film/producer,/influence/influence_node,/organization/organization_founder,/people/person
