paragraph	sentence	mid	title	start	end	notable_types
In 2005, Tim Harris, Simon Marlow, Simon Peyton Jones, and Maurice Herlihy described an STM system built on Concurrent Haskell that enables arbitrary atomic operations to be composed into larger atomic operations, a useful concept impossible with lock-based programming. To quote the authors:	In 2005, Tim Harris, Simon Marlow, Simon Peyton Jones, and Maurice Herlihy described an STM system built on Concurrent Haskell that enables arbitrary atomic operations to be composed into larger atomic operations, a useful concept impossible with lock-based programming.	/m/09q82j	Simon_Peyton_Jones	35	53	/book/author,/computer/computer_scientist,/computer/programming_language_designer,/computer/software_developer,/education/academic,/people/person
Wadler was editor of the Journal of Functional Programming from 1990–2004. He received the Most Influential POPL Paper Award in 2003 for the 1993 POPL Symposium paper Imperative Functional Programming, jointly with Simon Peyton Jones. In 2005, he became a Fellow of the Royal Society of Edinburgh. In 2007, he was inducted as a Fellow of the Association for Computing Machinery.	He received the Most Influential POPL Paper Award in 2003 for the 1993 POPL Symposium paper Imperative Functional Programming, jointly with Simon Peyton Jones.	/m/09q82j	Simon_Peyton_Jones	140	158	/book/author,/computer/computer_scientist,/computer/programming_language_designer,/computer/software_developer,/education/academic,/people/person
Jan-Willem Maessen, in 2002, and Simon Peyton Jones, in 2003, discussed problems associated with lazy evaluation while also acknowledging the theoretical motivation for it, in addition to purely practical considerations such as improved performance. They note that, in addition to adding some performance overhead, lazy evaluation makes it more difficult for programmers to reason about the performance of their code (particularly its space usage).	Jan-Willem Maessen, in 2002, and Simon Peyton Jones, in 2003, discussed problems associated with lazy evaluation while also acknowledging the theoretical motivation for it, in addition to purely practical considerations such as improved performance.	/m/09q82j	Simon_Peyton_Jones	33	51	/book/author,/computer/computer_scientist,/computer/programming_language_designer,/computer/software_developer,/education/academic,/people/person
SPITBOL (Speedy Implementation of SNOBOL) is a compiled implementation of the SNOBOL4 language. Originally targeted for the IBM System/360 and System/370 family of computers, it has now been ported to most major microprocessors including the SPARC. It was created by Robert Dewar and Ken Belcher, who were then at the Illinois Institute of Technology.	It was created by Robert Dewar and Ken Belcher, who were then at the Illinois Institute of Technology.	/m/0gtv9dk	Robert_Dewar	18	30	/people/person
He is the father of Robert Dewar.	He is the father of Robert Dewar.	/m/0gtv9dk	Robert_Dewar	20	32	/people/person
Mandy is a female first name, a diminutive of "Amanda". The name means 'She who must be loved', also more commonly interpreted as "fit to be loved", "worthy of love", or "loveable". It is derived from Latin and is usually used as a shortened form of the name "Amanda" (as in the case of Amanda "Mandy" Chessell, British computer scientist and Fellow of the Royal Society), although it is also given as an independent name in its own right (as in the case of Mandy Grunwald, American senior political strategist to the US Democratic Party). Its usage as a popular female first name can be traced back to at least the beginning of the 20th century, with the song "Mandy" by Irving Berlin in 1919, and the Joyce Lankester Brisley's children's books of Milly-Molly-Mandy in the 1920s.	It is derived from Latin and is usually used as a shortened form of the name "Amanda" (as in the case of Amanda "Mandy" Chessell, British computer scientist and Fellow of the Royal Society), although it is also given as an independent name in its own right (as in the case of Mandy Grunwald, American senior political strategist to the US Democratic Party).	/m/02pqk69	Amanda_Chessell	105	128	/computer/computer_scientist,/education/academic,/influence/influence_node,/people/person
Michael A. Jackson originally developed JSP in the 1970s. He documented the system in his 1975 book Principles of Program Design. Jackson's aim was to make COBOL batch file processing programs easier to modify and maintain, but the method can be used to design programs for any programming language that has structured control constructs, languages such as C, Java and Perl. Despite its age, JSP is still in use and is supported by diagramming tools such as Microsoft's Visio and CASE tools such as Jackson Workbench	Michael A. Jackson originally developed JSP in the 1970s.	/m/01fjy6	Michael_A._Jackson	0	18	/computer/computer_scientist,/people/person
Jackson system development (JSD) is a linear software development methodology developed by Michael A. Jackson and John Cameron in the 1980s.	Jackson system development (JSD) is a linear software development methodology developed by Michael A. Jackson and John Cameron in the 1980s.	/m/01fjy6	Michael_A._Jackson	91	109	/computer/computer_scientist,/people/person
Peter G. Neumann has kept a contemporary list of software problems and disasters. The software crisis has been fading from view, because it is psychologically extremely difficult to remain in crisis mode for a protracted period (more than 20 years). Nevertheless, software - especially real-time embedded software - remains risky and is pervasive, and it is crucial not to give in to complacency. Over the last 10-15 years Michael A. Jackson has written extensively about the nature of software engineering, has identified the main source of its difficulties as lack of specialization, and has suggested that his problem frames provide the basis for a "normal practice" of software engineering, a prerequisite if software engineering is to become an engineering science. {Michael Jackson, "Engineering and Software Engineering" in S Nanz ed, The Future of Software Engineering, Springer Verlag 2010; Michael Jackson, Problem Frames: Analyzing and Structuring Software Development Problems; Addison-Wesley, 2001}.	Over the last 10-15 years Michael A. Jackson has written extensively about the nature of software engineering, has identified the main source of its difficulties as lack of specialization, and has suggested that his problem frames provide the basis for a "normal practice" of software engineering, a prerequisite if software engineering is to become an engineering science.	/m/01fjy6	Michael_A._Jackson	26	44	/computer/computer_scientist,/people/person
In recent years, a series of evening seminars have been held, mainly at the BCS London office. Speakers have included leading computer scientists, mainly from the UK but some from abroad, including Samson Abramsky FRS, Jean-Raymond Abrial (France/Switzerland), Dines Bjørner (Denmark), Robin Bloomfield, Richard Bornat, Egon Börger (Italy), Jan Broenink (Netherlands), Michael Butler, Muffy Caulder, Jack Copeland (New Zealand), Mike Gordon FRS, Anthony Hall, Mark Harman, Martin Henson, Jane Hillston, Mike Hinchey, Sir Tony Hoare FRS, Mike Holcombe, Michael Jackson, Cliff Jones, Marta Kwiatkowska, Tom Maibaum, Ursula Martin, Peter Mosses, Ben Moszkowski, Peter O'Hearn, Steve Reeves (New Zealand), John Reynolds (USA), Peter Ryan, Steve Schneider, John Tucker, Phil Wadler, among others. In 2010, a book of chapters based on some of these talks was published. Talks are held annually with Formal Methods Europe and the London Mathematical Society (at the LMS headquarters in central London). There is also an Annual Peter Landin Semantics Seminar held each December in memory of the computer scientist Peter Landin (1930–2009).	Speakers have included leading computer scientists, mainly from the UK but some from abroad, including Samson Abramsky FRS, Jean-Raymond Abrial (France/Switzerland), Dines Bjørner (Denmark), Robin Bloomfield, Richard Bornat, Egon Börger (Italy), Jan Broenink (Netherlands), Michael Butler, Muffy Caulder, Jack Copeland (New Zealand), Mike Gordon FRS, Anthony Hall, Mark Harman, Martin Henson, Jane Hillston, Mike Hinchey, Sir Tony Hoare FRS, Mike Holcombe, Michael Jackson, Cliff Jones, Marta Kwiatkowska, Tom Maibaum, Ursula Martin, Peter Mosses, Ben Moszkowski, Peter O'Hearn, Steve Reeves (New Zealand), John Reynolds (USA), Peter Ryan, Steve Schneider, John Tucker, Phil Wadler, among others.	/m/01fjy6	Michael_A._Jackson	457	472	/computer/computer_scientist,/people/person
In the early to mid-1970s, the various generic work steps of system development methodologies were replaced with work steps based on various structured analysis or structured design techniques. SDM, SDM2, SDM/70 and Spectrum more notably evolved into system development methodologies that were based on the works of Steven Ward, Tom Demarco, Larry Constantine, Ken Orr, Ed Yourdon, Michael A. Jackson and others as well as data modeling techniques developed by Thomas Bachmann and Peter Chen. SDM is a top-down model. Starting from the system as a whole, its description becomes more detailed as the design progresses. The method was marketed as a proprietary method that all company developers were required to use to ensure quality in customer projects. This method shows several similarities with the proprietary methods of CAP Gemini's most important competitors in 1990. A similar waterfall method that was later used against the company itself in court proceedings in 2002 was CMG:Commander.	SDM, SDM2, SDM/70 and Spectrum more notably evolved into system development methodologies that were based on the works of Steven Ward, Tom Demarco, Larry Constantine, Ken Orr, Ed Yourdon, Michael A. Jackson and others as well as data modeling techniques developed by Thomas Bachmann and Peter Chen.	/m/01fjy6	Michael_A._Jackson	188	206	/computer/computer_scientist,/people/person
Problem analysis or the problem frames approach is an approach to software requirements analysis. It was developed by British software consultant Michael A. Jackson in the 1990s.	It was developed by British software consultant Michael A. Jackson in the 1990s.	/m/01fjy6	Michael_A._Jackson	48	66	/computer/computer_scientist,/people/person
Jackson is the son of software engineering researcher Michael A. Jackson, developer of Jackson Structured Programming (JSP), Jackson System Development (JSD), and the Problem Frames Approach.	Jackson is the son of software engineering researcher Michael A. Jackson, developer of Jackson Structured Programming (JSP), Jackson System Development (JSD), and the Problem Frames Approach.	/m/01fjy6	Michael_A._Jackson	54	72	/computer/computer_scientist,/people/person
What Engineers Know and How they Know It: Analytical Studies from Aeronautical History (The Johns Hopkins University Press, 1990) (ISBN 0-8018-4588-2) is a historical reflection on engineering practice in US aeronautics from 1908 to 1953 written by an accomplished practitioner and instructor. This period represents the dawn of aviation which was fraught with uncertainties and numerous paths to many possible worlds. The book captures two main conclusions from this period. The first order conclusion of this book is about "what engineers know." Five case studies from the history of aeronautical engineering are used to argue engineering often demands its own scientific discoveries. Thus, engineering should be understood as a knowledge-generating activity that includes applied science but is not limited to applied science. The second order conclusion of this book pertains to "how engineers know" by using the same case studies to reveal patterns in the nature of all engineering. These patterns form an “epistemology” of engineering that may point the way to an “engineering method” as something distinct from scientific method. Walter Vincenti ends the work with a general "variation-selection model" for understanding the direction of technological innovation in human history. The book is filled with numerous additional observations and stories told by a practitioner and instructor. This may be why Dr. Michael A. Jackson, author of Structured Design and Problem Frames, once concluded a keynote address to engineers with the statement, "Read Vincenti's book. Read it carefully. Read it one hundred times."	This may be why Dr. Michael A. Jackson, author of Structured Design and Problem Frames, once concluded a keynote address to engineers with the statement, "Read Vincenti's book.	/m/01fjy6	Michael_A._Jackson	16	38	/computer/computer_scientist,/people/person
The RESG's patron is Professor Michael A. Jackson, the creator of JSP and JSD, and the inventor of the Problem Frames approach to requirements.	The RESG's patron is Professor Michael A. Jackson, the creator of JSP and JSD, and the inventor of the Problem Frames approach to requirements.	/m/01fjy6	Michael_A._Jackson	31	49	/computer/computer_scientist,/people/person
The current president, Satish K. Tripathi, has continued his vocal support of UB 2020 and has been actively engaging in campus-wide discussion on the proposed tuition increases introduced by the bill.	The current president, Satish K. Tripathi, has continued his vocal support of UB 2020 and has been actively engaging in campus-wide discussion on the proposed tuition increases introduced by the bill.	/m/0gtwtwx	Satish_K._Tripathi	23	41	/business/board_member,/government/politician,/people/person
Buffalo is a public university and is one of four university centers of the 64 campuses in the State University of New York (SUNY) which enrolled 467,845 students and employed 33,455 faculty in 2011. SUNY is governed by a 17 member Board of Trustees, 15 of whom are appointed by the Governor of New York and the remaining two members being elected from the Student Assembly and University Faculty Senate. Carl McCall is the Chairman of the SUNY Board of Trustees and Nancy L. Zimpher is the Chancellor of the SUNY system. Satish K. Tripathi was appointed by the SUNY Board of Trustees as the 15th president of the University at Buffalo in April 2011 after previously serving a six-year tenure as the UB provost and executive vice president for academic affairs. He receives compensation of $385,000, $115,000, and $150,000 annually from each of the university, SUNY Research Foundation, and the UB Foundation respectively. The University at Buffalo Foundation (UB Foundation) was chartered in 1962 as an independent non-profit corporation and is controlled by a privately appointed board of trustees. It serves as a vehicle to raise private funds for the university, develop real estate, and manage endowment investments on behalf of the university. The foundation managed a $685.2 million endowment for FY2011.	Satish K. Tripathi was appointed by the SUNY Board of Trustees as the 15th president of the University at Buffalo in April 2011 after previously serving a six-year tenure as the UB provost and executive vice president for academic affairs.	/m/0gtwtwx	Satish_K._Tripathi	0	18	/business/board_member,/government/politician,/people/person
In general, for any c > 0, where d is the number of dimensions in the Euclidean space, there is a polynomial-time algorithm that finds a tour of length at most (1 + 1/c) times the optimal for geometric instances of TSP in  time; this is called a polynomial-time approximation scheme (PTAS). Sanjeev Arora and Joseph S. B. Mitchell were awarded the Gödel Prize in 2010 for their concurrent discovery of a PTAS for the Euclidean TSP.	Sanjeev Arora and Joseph S. B. Mitchell were awarded the Gödel Prize in 2010 for their concurrent discovery of a PTAS for the Euclidean TSP.	/m/0cm9_cw	Joseph_S._B._Mitchell	18	39	/education/academic,/people/person
His Ph.D. thesis on probabilistically checkable proofs received the ACM Doctoral Dissertation Award in 1995. He was awarded the Gödel Prize for his work on the PCP theorem in 2001 and again in 2010 for the discovery (concurrently with Joseph S. B. Mitchell) of a polynomial time approximation scheme for the euclidean travelling salesman problem. In 2008 he was inducted as a Fellow of the Association for Computing Machinery. In 2011 he was awarded the ACM Infosys Foundation Award, given to mid-career researchers in Computer Science. Arora has been awarded the Fulkerson Prize for 2012 for his work on improving the approximation ratio for graph separators and related problems (jointly with Satish Rao and Umesh Vazirani).	He was awarded the Gödel Prize for his work on the PCP theorem in 2001 and again in 2010 for the discovery (concurrently with Joseph S. B. Mitchell) of a polynomial time approximation scheme for the euclidean travelling salesman problem.	/m/0cm9_cw	Joseph_S._B._Mitchell	126	147	/education/academic,/people/person
In "The Information Architecture of Cities" Salingaros also defined the useful notion of "fractal loading", later picked up by Richard Veryard, Phil Jones, and others in Computer Science.	In "The Information Architecture of Cities" Salingaros also defined the useful notion of "fractal loading", later picked up by Richard Veryard, Phil Jones, and others in Computer Science.	/m/057sccq	Richard_Veryard	127	142	/people/person
Some of his students were Tim Hunt, John Paul Morrison, and Richard Veryard.	Some of his students were Tim Hunt, John Paul Morrison, and Richard Veryard.	/m/057sccq	Richard_Veryard	60	75	/people/person
MAD (Michigan Algorithm Decoder) is a programming language and compiler for the IBM 704 and later the IBM 709, IBM 7090, IBM 7040, UNIVAC 1107, UNIVAC 1108, Philco 210-211, and eventually the IBM S/370 mainframe computers. Developed in 1959 at the University of Michigan by Bernard Galler, Bruce Arden and Robert M. Graham, MAD is a variant of the International Algebraic Language (IAL). It was widely used to teach programming at colleges and universities during the 1960s and played a minor role in the development of CTSS, Multics, and the Michigan Terminal System computer operating systems.	Developed in 1959 at the University of Michigan by Bernard Galler, Bruce Arden and Robert M. Graham, MAD is a variant of the International Algebraic Language (IAL).	/m/03vtxr	Robert_M._Graham	83	99	/computer/computer_scientist,/people/person
Scheduler Activations was proposed by Anderson, Bershad, Lazowska, and Levy in Scheduler Activations: Effective Kernel Support for the User-Level Management of Parallelism in 1991. It was implemented in the NetBSD kernel by Nathan Williams but has since been abandoned in favor of 1:1 threading. FreeBSD had a similar threading implementation called Kernel Scheduled Entities which is also being retired in favor of 1:1 threading. Scheduler activations were also implemented as a patch for the Linux kernel by Vincent Danjean: Linux Activations, the user-level part being done in the Marcel thread library.	Scheduler Activations was proposed by Anderson, Bershad, Lazowska, and Levy in Scheduler Activations: Effective Kernel Support for the User-Level Management of Parallelism in 1991.	/m/03d8h7h	Hank_Levy_(computer_scientist)	71	75	/book/author,/computer/computer_scientist,/organization/organization_founder,/people/person
Lazowska has mentored a number of students, including Hank Levy (University of Washington), Yi-Bing Lin (National Chiao Tung University), Ed Felten (Princeton University), and Christophe Bisciglia (successively Google, Cloudera, and WibiData).	Lazowska has mentored a number of students, including Hank Levy (University of Washington), Yi-Bing Lin (National Chiao Tung University), Ed Felten (Princeton University), and Christophe Bisciglia (successively Google, Cloudera, and WibiData).	/m/03d8h7h	Hank_Levy_(computer_scientist)	54	63	/book/author,/computer/computer_scientist,/organization/organization_founder,/people/person
Emerald is a distributed, object-oriented programming language developed in the 1980s by Andrew P. Black, Norman C. Hutchinson, Eric Jul, and Henry M. Levy, in the Department of Computer Science at the University of Washington.	Emerald is a distributed, object-oriented programming language developed in the 1980s by Andrew P. Black, Norman C. Hutchinson, Eric Jul, and Henry M. Levy, in the Department of Computer Science at the University of Washington.	/m/03d8h7h	Hank_Levy_(computer_scientist)	142	155	/book/author,/computer/computer_scientist,/organization/organization_founder,/people/person
The President of the ACM for 2012–2014 is Vint Cerf, an American computer scientist, who is recognized as one of "the fathers of the Internet". He is the successor of Alain Chesnais (2010–2012), a French citizen living in Toronto where he runs his company named Visual Transitions and Wendy Hall of the University of Southampton.	The President of the ACM for 2012–2014 is Vint Cerf, an American computer scientist, who is recognized as one of "the fathers of the Internet".	/m/07z23	Vint_Cerf	42	51	/award/award_winner,/business/board_member,/computer/computer_scientist,/education/academic,/film/person_or_entity_appearing_in_film,/influence/influence_node,/law/inventor,/people/person,/user/narphorium/people/nndb_person
The National Science Foundation took over operations of the ARPANET and Internet from the Department of Defense, and initiated NSFNet, a new backbone for the network. A part of the NSFNet AUP forbade commercial traffic. In 1988, Vint Cerf arranged for an interconnection of MCI Mail with NSFNET on an experimental basis. The following year Compuserve email interconnected with NSFNET. Within a few years the commercial traffic restriction was removed from NSFNETs AUP, and NSFNET was privatised.	In 1988, Vint Cerf arranged for an interconnection of MCI Mail with NSFNET on an experimental basis.	/m/07z23	Vint_Cerf	9	18	/award/award_winner,/business/board_member,/computer/computer_scientist,/education/academic,/film/person_or_entity_appearing_in_film,/influence/influence_node,/law/inventor,/people/person,/user/narphorium/people/nndb_person
This network technology is supposed to ultimately enable missions that involve multiple spacecraft where reliable inter-vessel communication might take precedence over vessel-to-earth downlinks. According to a February 2011 statement by Google's Vint Cerf, the so-called "Bundle protocols" have been uploaded to NASA's EPOXI mission spacecraft (which is in orbit around the Sun) and communication with Earth has been tested at a distance of approximately 80 light seconds.	According to a February 2011 statement by Google's Vint Cerf, the so-called "Bundle protocols" have been uploaded to NASA's EPOXI mission spacecraft (which is in orbit around the Sun) and communication with Earth has been tested at a distance of approximately 80 light seconds.	/m/07z23	Vint_Cerf	51	60	/award/award_winner,/business/board_member,/computer/computer_scientist,/education/academic,/film/person_or_entity_appearing_in_film,/influence/influence_node,/law/inventor,/people/person,/user/narphorium/people/nndb_person
Historically, IP was the connectionless datagram service in the original Transmission Control Program introduced by Vint Cerf and Bob Kahn in 1974; the other being the connection-oriented Transmission Control Protocol (TCP). The Internet protocol suite is therefore often referred to as TCP/IP.	Historically, IP was the connectionless datagram service in the original Transmission Control Program introduced by Vint Cerf and Bob Kahn in 1974; the other being the connection-oriented Transmission Control Protocol (TCP).	/m/07z23	Vint_Cerf	116	125	/award/award_winner,/business/board_member,/computer/computer_scientist,/education/academic,/film/person_or_entity_appearing_in_film,/influence/influence_node,/law/inventor,/people/person,/user/narphorium/people/nndb_person
