paragraph	sentence	mid	title	start	end	notable_types
M. Night Shyamalan - Machalpur - Macherla - Machhiwara - Machhlishahr - Machilipatnam - Madambakkam - Madanpur - Madanrting - Madaram - Madathukulam - Madavaram - Maddur - Madhav National Park - Madhavnagar - Madhavrao Scindia - Madhoganj - Madhogarh - Madhugiri - Madhupur - Madhuri Dixit - Madhusudanpur - Madhya Bharat - Madhya Pradesh - Madhya Pradesh cricket team - Madhya Pradesh High Court - Madhya Pradesh Stock Exchange - Madhya Pradesh Vikas Congress - Madhu Sudan - Madippakkam - Madras (cloth) - Madras (city) - Madras bashai - Madras Presidency - Madukkarai - Madurai - Madurai District - Maduranthakam - Magadha - Magadhi language - Magadi - Magam - Mahabalipuram - Mahaban - Mahabharata - Mahadevapura - Mahadji Sindhia - Mahadula - Mahakali River - Mahalingpur - Prasanta Chandra Mahalanobis - Maham - Mahanadi River - Mahananda River - Maharaja - Maharajganj - Mahar - Maharashtra - Maharashtra Housing and Development Authority - Mahatma Gandhi - Mahbubnagar - Mahemdavad - Maheshtala - Mahi Kantha - Mahi River - Mahiari - Mahilpur - Mahira - Mahmud of Ghazni - Mahnar Bazar - Mahoba - Maholi - Mahona - Mahrajganj - Mahroni - Mahu Kalan - Mahua Dabra Haripura - Mahua Kheraganj - Mahudha - Mahuri - Mahuva - Mahuvar - Mahwa - Maibong - Maidan (Karnataka) - Maidan (Kolkata) - Mainaguri - Maindargi - Mairang - Mairwa - Maithili language - Maithon - Maitraka - Majgaon - Majhara Pipar Ehatmali - Majhauli Raj - Majholi - Majitha - Majuli - Makarba - Makardaha - Makhdumpur - Makhu - Makronia - Maksi - Maktampur - Makum - Makundapur - Malabar region - Malabar Coast - Malabar Coast moist forests - Malabar District - Malabar Hill - Malabars - Malaj Khand - Malankara Syrian Orthodox Church - Malappuram - Malappuram District - Malavalli - Malayalam calendar - Malayalam cinema - Malayalam language - Malayalam literature - Malhargarh - Malihabad - Malkangiri - Malkangiri District - Malkapur - Malkera - Malibu Hindu Temple - Mallamooppampatti - Mallankinaru - Mallar - Mallasamudram - Mallawan - Mallur, Ariyalur - Mallur, Karnataka - Mallur, Salem - Malluru - Malnad - Malwa - Maloud - Malout - Malpura - Malwan - Mamit - Manachanallur - Manadur - Manalmedu - Manalurpet - Manamadurai - Manapakkam - Manapparai - Manas National Park - Manavalakurichi - Manawar - Mancherial - Mandaikadu - Mandala - Mandalgarh - Mandamarri - Mandapam - Mandapeta - Mandarbani - Mandav - Mandawar - Mandi Dabwali - Mandideep - Mandla - Mandla District - Mandovi River - Mandsaur - Mandsaur District - Mandu - Mandya - Mandya District - Manegaon - Maneka Gandhi - Maner - Mangalampet - Mangaldoi - Mangalore - Mangalvedhe - Mangawan - Manglaur - Manglaya Sadak - Mango - Mangrol - Mangrulpir - Manihari - Manikpur - Manikpur Sarhat - Manimutharu - Manipur - Maniyar - Manjhanpur - Manjula Ghattamaneni - Manjula Vijayakumar - Manmohan Singh - Manmohan Waris - Manoj Das- Manipal Institute of Technology - Manjlegaon - Mankachar - Mankapur - Manohar Thana - Mansar - Mansinhapur - Mant Khas - Manugur - Manwath - Mappilaiurani - Maradu - Maraimalainagar - Marakkanam - Maramangalathupatti - Marandahalli - Marathakkara - Marathi language - Marathi television - Marathwada - Marehra - Marhaura - Mariahu - Mariani - Markayankottai - Maruadih Railway Settlement - Marudur - Maruti Udyog - Marwar - Marwar Junction - Marwari language - Marwaris - Masaurhi - Maslandapur - Master of Computer Applications - Masulipatnam - Mathura - Maswasi - Mataundh - Mathabhanga - Mathigiri - Mathura District - Mattan - Mau Aima - Maudaha - Mauganj - Maunath Bhanjan - Maur - Maurawan - Mauryan dynasty - Mausimaa Temple - Mavilayi - Mavoor - Mawana - Mawlai - Mawsynram - Mayang Imphal - Mayiladuthurai - Mayurbhanj - Mecheri - Media of India - Meenakshi - Meena Kumari - Meenas - Meerpet - Meerut - Meerut District - Meerut Division - Meghahatuburu Forest village - Meghalaya - Meghalaya subtropical forests - Meghna River - Meghnagar - Meghraj - Mehara Gaon - Mehatpur Basdehra - Mehdawal - Meher Baba - Mehgaon - Mehmand - Mehnagar - Mekliganj - Melacheval - Melachokkanathapuram - Melagaram - Melamadai - Melamaiyur - Melathiruppanthuruthi - Melattur, Kerala - Melpattampakkam - Melvisharam - Memnagar - Memon people -Memunda- Mendu - Merta City - Metrication in India - Mettupalayam - Mewar - Mewat - Mhasla - Mhaswad - Mhow - Mhowgaon - Middle kingdoms of India - Midnight's Children - Mihijam - Mihona - Milak - Military of India - Minjur - Mira-Bhayandar - Mira Nair - Miranpur - Mirganj - Mirpur Turk -miryalaguda Mirza Ghalib - Mirzapur-cum-Vindhyachal - Misrikh-cum-Neemsar - Miss India - Mithapur - Mithe Pur - Mithila - Mitra (Vedic) - Mizoram - Modakurichi - Mogra Badshahpur - Mogravadi - Mohali - Mohammadabad - Mohammadi - Mohanpur - Mohanpur Mohammadpur - Mohanur - Mohgaon - Mohiniaattam - Mohiuddinagar - Mohiuddinpur - Mohpa - Mohpada Alias Wasambe - Mokameh - Molakalmuru - Molar Band - Monoharpur - Monsoon - Moolakaraipatti - Moonak - Moovarasampettai - Mopperipalayam - Moragudi - Moran Town - Moranhat - Morar Cantonment - Morarji Desai - Morena, India - Morena District - Morshi - Mother India - Mother Teresa - Motipur - Mount Abu - Mount Everest - Mowa - Mowad - Mowgli - Mrigala - Mudalgi - Mudbidri - Muddebihal - Mudgal - Mudigere - Mudkhed - Mudukulathur - Mudushedde - Mughal architecture - Mughal Empire - Mughalsarai Railway Settlement - Mugma - Muhajir (Pakistan) - Muhajir Urdu - Muhamma - Muhammad Ali Jinnah - Muhammad of Ghor - Muhammadabad - Mukandgarh - Mukasipidariyur - Mukerian - Mukhiguda - Mukkudal - Mukrampur Khema - Muktsar - Mulagumudu - Mulanur - Mulavukad - Mulayam Singh Yadav - Mulgund - Mulk Raj Anand - Mulki - Mullanpur Dakha - Mullanpur- Garibdas - Multai - Mulur - Mumbai - Mumbai Police - Mumbai Suburban District - Mumbai University Institute of Chemical Technology - Mumtaz Mahal - Munda languages - Mundargi - Mundera Bazar - Munderi - Mundgod - Mundi - Mundia - Mundka - Mundra - Mundwa - Mungaoli - Mungeli - Muni Ki Reti - Munirabad Project Area - Munnur - Munsiyari - Murli Manohar Joshi - Muradnagar - Muragachha - Murbad - Murgathaul - Murgud - Murliganj - Murtijapur - Muruganpalayam - Murum - Murwara (Katni) - Musabani - Musafirkhana - Musi River - Music of India - Musiri - Muslim - Mussoori - Mustafabad - Muthupet - Muthur - Muttayyapuram - Muzaffarid dynasty - Mysore - Mysore District - Mysore Division - Mysore (region) - Mysore Kingdom - Mysore state	M. Night Shyamalan - Machalpur - Macherla - Machhiwara - Machhlishahr - Machilipatnam - Madambakkam - Madanpur - Madanrting - Madaram - Madathukulam - Madavaram - Maddur - Madhav National Park - Madhavnagar - Madhavrao Scindia - Madhoganj - Madhogarh - Madhugiri - Madhupur - Madhuri Dixit - Madhusudanpur - Madhya Bharat - Madhya Pradesh - Madhya Pradesh cricket team - Madhya Pradesh High Court - Madhya Pradesh Stock Exchange - Madhya Pradesh Vikas Congress - Madhu Sudan - Madippakkam - Madras (cloth) - Madras (city) - Madras bashai - Madras Presidency - Madukkarai - Madurai - Madurai District - Maduranthakam - Magadha - Magadhi language - Magadi - Magam - Mahabalipuram - Mahaban - Mahabharata - Mahadevapura - Mahadji Sindhia - Mahadula - Mahakali River - Mahalingpur - Prasanta Chandra Mahalanobis - Maham - Mahanadi River - Mahananda River - Maharaja - Maharajganj - Mahar - Maharashtra - Maharashtra Housing and Development Authority - Mahatma Gandhi - Mahbubnagar - Mahemdavad - Maheshtala - Mahi Kantha - Mahi River - Mahiari - Mahilpur - Mahira - Mahmud of Ghazni - Mahnar Bazar - Mahoba - Maholi - Mahona - Mahrajganj - Mahroni - Mahu Kalan - Mahua Dabra Haripura - Mahua Kheraganj - Mahudha - Mahuri - Mahuva - Mahuvar - Mahwa - Maibong - Maidan (Karnataka) - Maidan (Kolkata) - Mainaguri - Maindargi - Mairang - Mairwa - Maithili language - Maithon - Maitraka - Majgaon - Majhara Pipar Ehatmali - Majhauli Raj - Majholi - Majitha - Majuli - Makarba - Makardaha - Makhdumpur - Makhu - Makronia - Maksi - Maktampur - Makum - Makundapur - Malabar region - Malabar Coast - Malabar Coast moist forests - Malabar District - Malabar Hill - Malabars - Malaj Khand - Malankara Syrian Orthodox Church - Malappuram - Malappuram District - Malavalli - Malayalam calendar - Malayalam cinema - Malayalam language - Malayalam literature - Malhargarh - Malihabad - Malkangiri - Malkangiri District - Malkapur - Malkera - Malibu Hindu Temple - Mallamooppampatti - Mallankinaru - Mallar - Mallasamudram - Mallawan - Mallur, Ariyalur - Mallur, Karnataka - Mallur, Salem - Malluru - Malnad - Malwa - Maloud - Malout - Malpura - Malwan - Mamit - Manachanallur - Manadur - Manalmedu - Manalurpet - Manamadurai - Manapakkam - Manapparai - Manas National Park - Manavalakurichi - Manawar - Mancherial - Mandaikadu - Mandala - Mandalgarh - Mandamarri - Mandapam - Mandapeta - Mandarbani - Mandav - Mandawar - Mandi Dabwali - Mandideep - Mandla - Mandla District - Mandovi River - Mandsaur - Mandsaur District - Mandu - Mandya - Mandya District - Manegaon - Maneka Gandhi - Maner - Mangalampet - Mangaldoi - Mangalore - Mangalvedhe - Mangawan - Manglaur - Manglaya Sadak - Mango - Mangrol - Mangrulpir - Manihari - Manikpur - Manikpur Sarhat - Manimutharu - Manipur - Maniyar - Manjhanpur - Manjula Ghattamaneni - Manjula Vijayakumar - Manmohan Singh - Manmohan Waris - Manoj Das- Manipal Institute of Technology - Manjlegaon - Mankachar - Mankapur - Manohar Thana - Mansar - Mansinhapur - Mant Khas - Manugur - Manwath - Mappilaiurani - Maradu - Maraimalainagar - Marakkanam - Maramangalathupatti - Marandahalli - Marathakkara - Marathi language - Marathi television - Marathwada - Marehra - Marhaura - Mariahu - Mariani - Markayankottai - Maruadih Railway Settlement - Marudur - Maruti Udyog - Marwar - Marwar Junction - Marwari language - Marwaris - Masaurhi - Maslandapur - Master of Computer Applications - Masulipatnam - Mathura - Maswasi - Mataundh - Mathabhanga - Mathigiri - Mathura District - Mattan - Mau Aima - Maudaha - Mauganj - Maunath Bhanjan - Maur - Maurawan - Mauryan dynasty - Mausimaa Temple - Mavilayi - Mavoor - Mawana - Mawlai - Mawsynram - Mayang Imphal - Mayiladuthurai - Mayurbhanj - Mecheri - Media of India - Meenakshi - Meena Kumari - Meenas - Meerpet - Meerut - Meerut District - Meerut Division - Meghahatuburu Forest village - Meghalaya - Meghalaya subtropical forests - Meghna River - Meghnagar - Meghraj - Mehara Gaon - Mehatpur Basdehra - Mehdawal - Meher Baba - Mehgaon - Mehmand - Mehnagar - Mekliganj - Melacheval - Melachokkanathapuram - Melagaram - Melamadai - Melamaiyur - Melathiruppanthuruthi - Melattur, Kerala - Melpattampakkam - Melvisharam - Memnagar - Memon people -Memunda- Mendu - Merta City - Metrication in India - Mettupalayam - Mewar - Mewat - Mhasla - Mhaswad - Mhow - Mhowgaon - Middle kingdoms of India - Midnight's Children - Mihijam - Mihona - Milak - Military of India - Minjur - Mira-Bhayandar - Mira Nair - Miranpur - Mirganj - Mirpur Turk -miryalaguda Mirza Ghalib - Mirzapur-cum-Vindhyachal - Misrikh-cum-Neemsar - Miss India - Mithapur - Mithe Pur - Mithila - Mitra (Vedic) - Mizoram - Modakurichi - Mogra Badshahpur - Mogravadi - Mohali - Mohammadabad - Mohammadi - Mohanpur - Mohanpur Mohammadpur - Mohanur - Mohgaon - Mohiniaattam - Mohiuddinagar - Mohiuddinpur - Mohpa - Mohpada Alias Wasambe - Mokameh - Molakalmuru - Molar Band - Monoharpur - Monsoon - Moolakaraipatti - Moonak - Moovarasampettai - Mopperipalayam - Moragudi - Moran Town - Moranhat - Morar Cantonment - Morarji Desai - Morena, India - Morena District - Morshi - Mother India - Mother Teresa - Motipur - Mount Abu - Mount Everest - Mowa - Mowad - Mowgli - Mrigala - Mudalgi - Mudbidri - Muddebihal - Mudgal - Mudigere - Mudkhed - Mudukulathur - Mudushedde - Mughal architecture - Mughal Empire - Mughalsarai Railway Settlement - Mugma - Muhajir (Pakistan) - Muhajir Urdu - Muhamma - Muhammad Ali Jinnah - Muhammad of Ghor - Muhammadabad - Mukandgarh - Mukasipidariyur - Mukerian - Mukhiguda - Mukkudal - Mukrampur Khema - Muktsar - Mulagumudu - Mulanur - Mulavukad - Mulayam Singh Yadav - Mulgund - Mulk Raj Anand - Mulki - Mullanpur Dakha - Mullanpur- Garibdas - Multai - Mulur - Mumbai - Mumbai Police - Mumbai Suburban District - Mumbai University Institute of Chemical Technology - Mumtaz Mahal - Munda languages - Mundargi - Mundera Bazar - Munderi - Mundgod - Mundi - Mundia - Mundka - Mundra - Mundwa - Mungaoli - Mungeli - Muni Ki Reti - Munirabad Project Area - Munnur - Munsiyari - Murli Manohar Joshi - Muradnagar - Muragachha - Murbad - Murgathaul - Murgud - Murliganj - Murtijapur - Muruganpalayam - Murum - Murwara (Katni) - Musabani - Musafirkhana - Musi River - Music of India - Musiri - Muslim - Mussoori - Mustafabad - Muthupet - Muthur - Muttayyapuram - Muzaffarid dynasty - Mysore - Mysore District - Mysore Division - Mysore (region) - Mysore Kingdom - Mysore state	/m/021zh3	Madhu_Sudan	463	474	/award/award_winner,/computer/computer_scientist,/education/academic,/people/person
The 2001 Gödel Prize was awarded to Sanjeev Arora, Uriel Feige, Shafi Goldwasser, Carsten Lund, László Lovász, Rajeev Motwani, Shmuel Safra, Madhu Sudan, and Mario Szegedy for work on the PCP theorem and its connection to hardness of approximation.	The 2001 Gödel Prize was awarded to Sanjeev Arora, Uriel Feige, Shafi Goldwasser, Carsten Lund, László Lovász, Rajeev Motwani, Shmuel Safra, Madhu Sudan, and Mario Szegedy for work on the PCP theorem and its connection to hardness of approximation.	/m/021zh3	Madhu_Sudan	141	152	/award/award_winner,/computer/computer_scientist,/education/academic,/people/person
Thomas Jakobsen introduced a probabilistic version of the interpolation attack using Madhu Sudan's algorithm for improved decoding of Reed-Solomon codes. This attack can work even when an algebraic relationship between plaintexts and ciphertexts holds for only a fraction of values.	Thomas Jakobsen introduced a probabilistic version of the interpolation attack using Madhu Sudan's algorithm for improved decoding of Reed-Solomon codes.	/m/021zh3	Madhu_Sudan	85	96	/award/award_winner,/computer/computer_scientist,/education/academic,/people/person
Venkatesan Guruswami (born 1976) is a computer scientist at Carnegie Mellon University in Pittsburgh, USA. He did his schooling at Padma Seshadri Bala Bhavan, one of the premier educational institutions in Chennai, India. He completed his undergraduate in Computer Science from IIT Madras and his doctorate from Massachusetts Institute of Technology under the supervision of Madhu Sudan in 2001 . After receiving his PhD, he spent a year at UC Berkeley as a Miller Fellow, and then was a member of the faculty at the University of Washington from 2002 to 2009. His primary area of research is Computer Science, where he is well known for his work on error-correcting codes. Following 2007, he was on leave from University of Washington. During 2007-2008, he visited IAS at Princeton University as a Member of School of Mathematics. He also visited SCS at Carnegie Mellon University during 2008-09 as a Visiting Faculty. In July 2009, he joined the School of Computer Science at Carnegie Mellon University as Associate Professor in the Computer Science Department.	He completed his undergraduate in Computer Science from IIT Madras and his doctorate from Massachusetts Institute of Technology under the supervision of Madhu Sudan in 2001 .	/m/021zh3	Madhu_Sudan	153	164	/award/award_winner,/computer/computer_scientist,/education/academic,/people/person
The contributors to The Princeton Companion to Mathematics consist of 133 of the world's best mathematicians. Timothy Gowers, its editor, is the recipient of the Fields Medal, considered to be the top honor in mathematics. Other contributors include Fields medalists Michael Atiyah, Alain Connes, Charles Fefferman, and Terence Tao, and well-known mathematicians Noga Alon, George Andrews, Béla Bollobás, John P. Burgess, Clifford Cocks, Ingrid Daubechies, Persi Diaconis, Jordan Ellenberg, Oded Goldreich, Andrew Granville, Jeremy Gray, Frank Kelly, Sergiu Klainerman, Jon Kleinberg, János Kollár, Peter Lax, Dusa McDuff, Barry Mazur, Carl Pomerance, Eleanor Robson, Peter Sarnak, Madhu Sudan, Clifford Taubes, and Avi Wigderson.	Other contributors include Fields medalists Michael Atiyah, Alain Connes, Charles Fefferman, and Terence Tao, and well-known mathematicians Noga Alon, George Andrews, Béla Bollobás, John P. Burgess, Clifford Cocks, Ingrid Daubechies, Persi Diaconis, Jordan Ellenberg, Oded Goldreich, Andrew Granville, Jeremy Gray, Frank Kelly, Sergiu Klainerman, Jon Kleinberg, János Kollár, Peter Lax, Dusa McDuff, Barry Mazur, Carl Pomerance, Eleanor Robson, Peter Sarnak, Madhu Sudan, Clifford Taubes, and Avi Wigderson.	/m/021zh3	Madhu_Sudan	459	470	/award/award_winner,/computer/computer_scientist,/education/academic,/people/person
He is also known for his joint work with Sanjeev Arora, Madhu Sudan, Rajeev Motwani, and Mario Szegedy that discovered the existence of probabilistically checkable proofs for NP-hard problems and used them to prove hardness results for approximation problems; in 2001 he and his co-authors received the Gödel Prize for their share in these discoveries.	He is also known for his joint work with Sanjeev Arora, Madhu Sudan, Rajeev Motwani, and Mario Szegedy that discovered the existence of probabilistically checkable proofs for NP-hard problems and used them to prove hardness results for approximation problems; in 2001 he and his co-authors received the Gödel Prize for their share in these discoveries.	/m/021zh3	Madhu_Sudan	56	67	/award/award_winner,/computer/computer_scientist,/education/academic,/people/person
In coding theory, folded Reed–Solomon codes are like Reed–Solomon codes, which are obtained by mapping  Reed–Solomon codewords over a larger alphabet by careful bundling of codeword symbols. They are also a special case of Parvaresh–Vardy codes. Using optimal parameters one can decode with a rate of R, and achieve a decoding radius of 1 − R. The term "folded Reed–Solomon codes" was coined in a paper by V.Y. Krachkovsky with an algorithm that presented Reed–Solomon codes with many random "phased burst" errors . The list-decoding algorithm for folded RS codes corrects beyond the  bound for Reed–Solomon codes achieved by the Guruswami–Sudan algorithm for such phased burst errors.	The list-decoding algorithm for folded RS codes corrects beyond the  bound for Reed–Solomon codes achieved by the Guruswami–Sudan algorithm for such phased burst errors.	/m/021zh3	Madhu_Sudan	124	129	/award/award_winner,/computer/computer_scientist,/education/academic,/people/person
There are many efficient algorithms that can perform List decoding. list decoding algorithm for Reed–Solomon (RS) codes by Sudan which can correct up to  errors is give first. Later on more efficient Guruswami–Sudan list decoding algorithm, which can correct up to  errors is discussed.	list decoding algorithm for Reed–Solomon (RS) codes by Sudan which can correct up to  errors is give first.	/m/021zh3	Madhu_Sudan	55	60	/award/award_winner,/computer/computer_scientist,/education/academic,/people/person
There are many efficient algorithms that can perform List decoding. list decoding algorithm for Reed–Solomon (RS) codes by Sudan which can correct up to  errors is give first. Later on more efficient Guruswami–Sudan list decoding algorithm, which can correct up to  errors is discussed.	Later on more efficient Guruswami–Sudan list decoding algorithm, which can correct up to  errors is discussed.	/m/021zh3	Madhu_Sudan	34	39	/award/award_winner,/computer/computer_scientist,/education/academic,/people/person
There are many efficient algorithms that can perform List decoding. list decoding algorithm for Reed–Solomon (RS) codes by Sudan which can correct up to  errors is give first. Later on more efficient Guruswami–Sudan list decoding algorithm, which can correct up to  errors is discussed.	list decoding algorithm for Reed–Solomon (RS) codes by Sudan which can correct up to  errors is give first.	/m/021zh3	Madhu_Sudan	55	60	/award/award_winner,/computer/computer_scientist,/education/academic,/people/person
There are many efficient algorithms that can perform List decoding. list decoding algorithm for Reed–Solomon (RS) codes by Sudan which can correct up to  errors is give first. Later on more efficient Guruswami–Sudan list decoding algorithm, which can correct up to  errors is discussed.	Later on more efficient Guruswami–Sudan list decoding algorithm, which can correct up to  errors is discussed.	/m/021zh3	Madhu_Sudan	34	39	/award/award_winner,/computer/computer_scientist,/education/academic,/people/person
Fuzzy extractors convert biometric data into random strings, which makes it possible to apply cryptographic techniques for biometric security. They are used to encrypt and authenticate users records, with biometric inputs as a key. Historically, the first biometric system of this kind was designed by Juels and Wattenberg and was called "Fuzzy commitment", where the cryptographic key is decommitted using biometric data. "Fuzzy", in that context, implies that the value close to the original one can extract the committed value. Later, Juels and Sudan came up with Fuzzy vault schemes which are order invariant for the fuzzy commitment scheme but uses a Reed–Solomon code. Codeword is evaluated by polynomial and the secret message is inserted as the coefficients of the polynomial. The polynomial is evaluated for different values of a set of features of the biometric data. So Fuzzy commitment and Fuzzy Vault were per-cursor to Fuzzy extractors. Fuzzy extractor is a biometric tool to authenticate a user using its own biometric template as a key. They extract uniform and random string  from its input  that has tolerance for noise. If the input changes to  but is still close to , the string  can still be re-constructed. When  is used first time to re-construct, it outputs a helper string  which can be made public without compromising the security of  (used for encryption and authentication key) and  (helper string) is stored to recover . They remain secure even when the adversary modifies  (key agreement between a user and a server based only on a biometric input). This article is based on the papers "Fuzzy Extractors: A Brief Survey of Results from 2004 to 2006" and "Fuzzy Extractors: How to Generate Strong Keys from Biometrics and Other Noisy Data" by Yevgeniy Dodis, Rafail Ostrovsky, Leonid Reyzin and Adam Smith	Later, Juels and Sudan came up with Fuzzy vault schemes which are order invariant for the fuzzy commitment scheme but uses a Reed–Solomon code.	/m/021zh3	Madhu_Sudan	17	22	/award/award_winner,/computer/computer_scientist,/education/academic,/people/person
Foundations and Trends in Theoretical Computer Science is a peer-reviewed scientific journal that publishes long survey and tutorial articles in the field of theoretical computer science. It was established in 2005 and is published by Now Publishers. The founding editor-in-chief is Madhu Sudan (Microsoft Research).	The founding editor-in-chief is Madhu Sudan (Microsoft Research).	/m/021zh3	Madhu_Sudan	32	43	/award/award_winner,/computer/computer_scientist,/education/academic,/people/person
The Paris Kanellakis Theory and Practice Award is granted yearly by the Association for Computing Machinery (ACM) to honor "specific theoretical accomplishments that have had a significant and demonstrable effect on the practice of computing". It was instituted in 1996, in memory of Paris C. Kanellakis, a computer scientist who died with his immediate family in an airplane crash in South America in 1995 (American Airlines Flight 965). The award is accompanied by a prize of $10,000 and is endowed by contributions from Kanellakis's parents, with additional financial support provided by four ACM Special Interest Groups (SIGACT, SIGDA, SIGMOD, and SIGPLAN), the ACM SIG Projects Fund, and individual contributions.	It was instituted in 1996, in memory of Paris C. Kanellakis, a computer scientist who died with his immediate family in an airplane crash in South America in 1995 (American Airlines Flight 965).	/m/08hfh9	Paris_Kanellakis	40	59	/computer/computer_scientist,/education/academic,/people/deceased_person,/people/person
SAT was the first known NP-complete problem, as proved by Stephen Cook in 1971 and independently by Leonid Levin in 1973. Until that time, the concept of an NP-complete problem did not even exist. The problem remains NP-complete even if all expressions are written in conjunctive normal form with 3 variables per clause (3-CNF), yielding the 3SAT problem. This means the expression has the form:	SAT was the first known NP-complete problem, as proved by Stephen Cook in 1971 and independently by Leonid Levin in 1973.	/m/09tcd	Stephen_Cook	58	70	/award/award_winner,/computer/computer_scientist,/education/academic,/influence/influence_node,/people/person
The P versus NP problem is a major unsolved problem in computer science. Informally, it asks whether every problem whose solution can be quickly verified by a computer can also be quickly solved by a computer. It was introduced in 1971 by Stephen Cook in his seminal paper "The complexity of theorem proving procedures" and is considered by many to be the most important open problem in the field. It is one of the seven Millennium Prize Problems selected by the Clay Mathematics Institute to carry a US$ 1,000,000 prize for the first correct solution.	It was introduced in 1971 by Stephen Cook in his seminal paper "The complexity of theorem proving procedures" and is considered by many to be the most important open problem in the field.	/m/09tcd	Stephen_Cook	29	41	/award/award_winner,/computer/computer_scientist,/education/academic,/influence/influence_node,/people/person
