paragraph	sentence	mid	title	start	end	notable_types
The CAMAL (CAMbridge ALgebra system) is a computer algebra system written at Cambridge University by David Barton, Steve Bourne, and John Fitch. It was initially used for computations in celestial mechanics and general relativity.	The CAMAL (CAMbridge ALgebra system) is a computer algebra system written at Cambridge University by David Barton, Steve Bourne, and John Fitch.	/m/027rqx2	John_Fitch_(computer_scientist)	133	143	/people/person
Various Unix people, particularly Peter H. Salus, Dennis Ritchie and Berny Goodheart, lobbied Unix's various owners (AT&T, Novell, the Santa Cruz Operation) for many years to allow the book to be published officially. In 1996, the Santa Cruz Operation finally authorised the release of the twenty-year-old 6th Edition source code (along with the source code of other versions of "Ancient UNIX"), and the full code plus the 1977 version of the commentary was published by Peer-To-Peer Communications (ISBN 1-57398-013-7). The reissue includes commentary from Michael Tilson (SCO), Peter Salus, Dennis Ritchie, Ken Thompson, Peter Collinson, Greg Rose, Mike O'Dell, Berny Goodheart and Peter Reintjes.	Various Unix people, particularly Peter H. Salus, Dennis Ritchie and Berny Goodheart, lobbied Unix's various owners (AT&T, Novell, the Santa Cruz Operation) for many years to allow the book to be published officially.	/m/0325cf	Berny_Goodheart	69	84	/people/person
Various Unix people, particularly Peter H. Salus, Dennis Ritchie and Berny Goodheart, lobbied Unix's various owners (AT&T, Novell, the Santa Cruz Operation) for many years to allow the book to be published officially. In 1996, the Santa Cruz Operation finally authorised the release of the twenty-year-old 6th Edition source code (along with the source code of other versions of "Ancient UNIX"), and the full code plus the 1977 version of the commentary was published by Peer-To-Peer Communications (ISBN 1-57398-013-7). The reissue includes commentary from Michael Tilson (SCO), Peter Salus, Dennis Ritchie, Ken Thompson, Peter Collinson, Greg Rose, Mike O'Dell, Berny Goodheart and Peter Reintjes.	The reissue includes commentary from Michael Tilson (SCO), Peter Salus, Dennis Ritchie, Ken Thompson, Peter Collinson, Greg Rose, Mike O'Dell, Berny Goodheart and Peter Reintjes.	/m/0325cf	Berny_Goodheart	143	158	/people/person
Libeskind-Hadas is a coauthor of R. Libeskind-Hadas, N. Hasan, J. Cong, P. McKinley, and C. L. Liu. Fault Covering Problems in Reconfigurable VLSI Systems. Kluwer Academic Publishers, 1992., and has published 16 peer reviewed papers and 20 peer-reviewed conference proceedings.	Libeskind-Hadas is a coauthor of R. Libeskind-Hadas, N. Hasan, J. Cong, P. McKinley, and C. L. Liu.	/m/02q2vp7	Chung_Laung_Liu	89	98	/education/academic,/people/person
Zaks received his BSc degree from Technion in 1971 and MSc from Technion in 1972. In 1979 he received his PhD degree from University of Illinois at Urbana-Champaign, where his PhD supervisor was Chung Laung Liu. Since then, he has done joint work with numerous co-authors, including the prolific mathematician Paul Erdős.	In 1979 he received his PhD degree from University of Illinois at Urbana-Champaign, where his PhD supervisor was Chung Laung Liu.	/m/02q2vp7	Chung_Laung_Liu	113	128	/education/academic,/people/person
In the 1990s, AI researchers developed sophisticated mathematical tools to solve specific subproblems. These tools are truly scientific, in the sense that their results are both measurable and verifiable, and they have been responsible for many of AI's recent successes. The shared mathematical language has also permitted a high level of collaboration with more established fields (like mathematics, economics or operations research). Stuart Russell and Peter Norvig describe this movement as nothing less than a "revolution" and "the victory of the neats." Critics argue that these techniques are too focused on particular problems and have failed to address the long term goal of general intelligence. There is an ongoing debate about the relevance and validity of statistical approaches in AI, exemplified in part by exchanges between Peter Norvig and Noam Chomsky.	Stuart Russell and Peter Norvig describe this movement as nothing less than a "revolution" and "the victory of the neats.	/m/02qrqn	Stuart_J._Russell	0	14	/book/author,/computer/computer_scientist,/education/academic,/influence/influence_node,/people/person
New statistical and mathematical approaches to AI were developed in the 1990s, using highly developed formalisms such as Bayesian nets and mathematical optimization. This general trend towards more formal methods in AI is described as "the victory of the neats" by Peter Norvig and Stuart Russell. Pamela McCorduck, in 2004: "As I write, AI enjoys a Neat hegemony, people who believe that machine intelligence, at least, is best expressed in logical, even mathematical terms." Neat solutions have been highly successful in the 21st century and are now used throughout the technology industry. These solutions, however, have mostly been applied to specific problems with specific solutions, and the problem of general intelligence remains unsolved.	This general trend towards more formal methods in AI is described as "the victory of the neats" by Peter Norvig and Stuart Russell.	/m/02qrqn	Stuart_J._Russell	116	130	/book/author,/computer/computer_scientist,/education/academic,/influence/influence_node,/people/person
He is a Fellow and Councilor of the Association for the Advancement of Artificial Intelligence and co-author, with Stuart Russell, of Artificial Intelligence: A Modern Approach, now the leading college text in the field. He previously was head of the Computational Sciences Division (now the Intelligent Systems Division) at NASA Ames Research Center, where he oversaw a staff of 200 scientists performing NASA's research and development in autonomy and robotics, automated software engineering and data analysis, neuroengineering, collaborative systems research, and simulation-based decision-making. Before that he was Chief Scientist at Junglee, where he helped develop one of the first Internet comparison shopping services; Chief designer at Harlequin Inc.; and Senior Scientist at Sun Microsystems Laboratories.	He is a Fellow and Councilor of the Association for the Advancement of Artificial Intelligence and co-author, with Stuart Russell, of Artificial Intelligence: A Modern Approach, now the leading college text in the field.	/m/02qrqn	Stuart_J._Russell	115	129	/book/author,/computer/computer_scientist,/education/academic,/influence/influence_node,/people/person
Artificial Intelligence: A Modern Approach (AIMA) is a college textbook on Artificial Intelligence, written by Stuart J. Russell and Peter Norvig. The third edition of the book was released 11 December 2009. It is used in over 1100 universities worldwide and has been called "the most popular artificial intelligence textbook in the world".	Artificial Intelligence: A Modern Approach (AIMA) is a college textbook on Artificial Intelligence, written by Stuart J. Russell and Peter Norvig.	/m/02qrqn	Stuart_J._Russell	111	128	/book/author,/computer/computer_scientist,/education/academic,/influence/influence_node,/people/person
The term "strong AI" is now used to describe any artificial intelligence system that acts like it has a mind, regardless of whether a philosopher would be able to determine if it actually has a mind or not. As Russell and Norvig write: "Most AI researchers take the weak AI hypothesis for granted, and don't care about the strong AI hypothesis." AI researchers are interested in a related statement:	As Russell and Norvig write: "Most AI researchers take the weak AI hypothesis for granted, and don't care about the strong AI hypothesis.	/m/02qrqn	Stuart_J._Russell	3	10	/book/author,/computer/computer_scientist,/education/academic,/influence/influence_node,/people/person
One criticism of the Turing test is that it is explicitly anthropomorphic. If our ultimate goal is to create machines that are more intelligent than people, why should we insist that our machines must closely resemble people? Russell and Norvig write that "aeronautical engineering texts do not define the goal of their field as 'making machines that fly so exactly like pigeons that they can fool other pigeons.'"	Russell and Norvig write that "aeronautical engineering texts do not define the goal of their field as 'making machines that fly so exactly like pigeons that they can fool other pigeons.	/m/02qrqn	Stuart_J._Russell	0	7	/book/author,/computer/computer_scientist,/education/academic,/influence/influence_node,/people/person
Neither of Searle's two positions are of great concern to AI research, since they do not directly answer the question "can a machine display general intelligence?" (unless it can also be shown that consciousness is necessary for intelligence). There are a few researchers who believe that consciousness is an essential element in intelligence, such as Igor Aleksander, Stan Franklin, Ron Sun, and Pentti Haikonen, although their definition of "consciousness" strays very close to "intelligence." See artificial consciousness. Turing wrote "I do not wish to give the impression that I think there is no mystery about consciousness ... ut I do not think these mysteries necessarily need to be solved before we can answer the question ." Russell and Norvig agree: "Most AI researchers take the weak AI hypothesis for granted, and don't care about the strong AI hypothesis."	" Russell and Norvig agree: "Most AI researchers take the weak AI hypothesis for granted, and don't care about the strong AI hypothesis.	/m/02qrqn	Stuart_J._Russell	2	9	/book/author,/computer/computer_scientist,/education/academic,/influence/influence_node,/people/person
Prentice Hall is the publisher of Magruder's American Government as well as Biology by Ken Miller and Joe Levine. Their artificial intelligence series includes Artificial Intelligence: A Modern Approach by Stuart J. Russell and Peter Norvig and ANSI Common Lisp by Paul Graham. They also published the well-known computer programming book The C Programming Language by Brian Kernighan and Dennis Ritchie.	Their artificial intelligence series includes Artificial Intelligence: A Modern Approach by Stuart J. Russell and Peter Norvig and ANSI Common Lisp by Paul Graham.	/m/02qrqn	Stuart_J._Russell	92	109	/book/author,/computer/computer_scientist,/education/academic,/influence/influence_node,/people/person
Mainstream AI researchers argue that trying to pass the Turing Test is merely a distraction from more fruitful research. Indeed, the Turing test is not an active focus of much academic or commercial effort—as Stuart Russell and Peter Norvig write: "AI researchers have devoted little attention to passing the Turing test." There are several reasons.	Indeed, the Turing test is not an active focus of much academic or commercial effort—as Stuart Russell and Peter Norvig write: "AI researchers have devoted little attention to passing the Turing test.	/m/02qrqn	Stuart_J._Russell	88	102	/book/author,/computer/computer_scientist,/education/academic,/influence/influence_node,/people/person
The project was started as ChipTest at Carnegie Mellon University by Feng-hsiung Hsu, followed by its successor, Deep Thought. After their graduation from Carnegie Mellon, Hsu, Thomas Anantharaman, and Murray Campbell from the Deep Thought team were hired by IBM Research to continue their quest to build a chess machine that could defeat the world champion. Hsu and Campbell joined IBM in autumn 1989, with Anantharaman following later. Anantharaman subsequently left IBM for Wall Street and Arthur Joseph Hoane joined the team to perform programming tasks. Jerry Brody, a long-time employee of IBM Research, was recruited for the team in 1990. The team was managed first by Randy Moulic, followed by Chung-Jen (C J) Tan.	After their graduation from Carnegie Mellon, Hsu, Thomas Anantharaman, and Murray Campbell from the Deep Thought team were hired by IBM Research to continue their quest to build a chess machine that could defeat the world champion.	/m/02853tn	Murray_Campbell	75	90	/computer/computer_scientist,/computer/software_developer,/people/person
ChipTest was a 1985 chess playing computer built by Feng-hsiung Hsu, Thomas Anantharaman and Murray Campbell at Carnegie Mellon University. It is the predecessor of Deep Thought which in turn evolved into Deep Blue.	ChipTest was a 1985 chess playing computer built by Feng-hsiung Hsu, Thomas Anantharaman and Murray Campbell at Carnegie Mellon University.	/m/02853tn	Murray_Campbell	93	108	/computer/computer_scientist,/computer/software_developer,/people/person
HiTech was a chess machine built at Carnegie Mellon University under the direction of World Correspondence Chess Champion Dr. Hans J. Berliner, by Berliner, Carl Ebeling, Murray Campbell, and Gordon Goetsch.	HiTech was a chess machine built at Carnegie Mellon University under the direction of World Correspondence Chess Champion Dr. Hans J. Berliner, by Berliner, Carl Ebeling, Murray Campbell, and Gordon Goetsch.	/m/02853tn	Murray_Campbell	171	186	/computer/computer_scientist,/computer/software_developer,/people/person
Bernard Cafferty talk - Michel Caillaud talk - Ignazio Calvi talk - Ricardo Calvo talk - Murray Campbell talk - Daniel Cámpora talk - Florencio Campomanes talk - Esteban Canal talk - Arianne Caoili talk - José Raúl Capablanca talk - Rodolfo Tan Cardoso talk - Ruth Volgl Cardoso talk - Carl Carls talk - Magnus Carlsen talk - Pontus Carlsson talk - Horatio Caro talk - Fabiano Caruana talk - Berna Carrasco talk - Pietro Carrera talk - Hartwig Cassel talk - Vincenzo Castaldi talk - Mariano Castillo talk - Mišo Cebalo talk - Betül Cemre Yıldız talk - Giovanni Cenni talk - Luigi Centurini talk - Alfonso Ceron talk - Oscar Chajes talk - Ferenc Chalupetzky talk - Edward Chamier talk - Chan Peng Kong talk - Murray Chandler talk - Chang Tung Lo talk - Pascal Charbonneau talk - Henry Charlick talk - Rudolf Charousek talk - Chantal Chaudé de Silans talk - Russ Chauvenet talk - Valery Chekhov talk - Vitaly Chekhover talk - Chen Zude talk - Chen De talk - Bobby Cheng talk - Ivan Cheparinov talk - Alexander Cherepkov talk - Irving Chernev talk - Alexander Chernin talk - Konstantin Chernyshov talk - André Chéron talk - Maia Chiburdanidze talk - Mikhail Chigorin talk - Larry Christiansen talk - Martin Christoffel talk - Vladimir Chuchelov talk - Slavko Cicak talk - Roberto Cifuentes talk - Victor Ciocâltea talk - Kenneth Clayton talk - Hermann Clemenz talk - Albert Clerc talk - Viktorija Čmilytė talk - John Cochrane (chess player) talk - Philip M. Cohen talk - Erich Cohn talk - Wilhelm Cohn talk - Edgard Colle talk - John W. Collins talk - Eugene Ernest Colman talk - Adrián García Conde talk - Stuart Conquest talk - Nathaniel Cook talk - Philip Corbin talk - Deysi Cori talk - Jorge Cori talk - Anya Corke talk - Nicolaas Cortlever talk - Juan Corzo talk - John Cox (chess player) talk - Carlo Cozio talk - Spencer Crakanthorp talk - Pia Cramling talk - Robert Crépeaux talk - Rupert Cross talk - Oswaldo Cruz Filho talk - Walter Cruz talk - István Csom talk - Miguel Cuéllar talk - Pablo Cuéllar talk - Josef Cukierman talk - John Curdo talk - Ognjen Cvitan talk - Hieronim Czarnowski talk - Moshe Czerniak talk -	Bernard Cafferty talk - Michel Caillaud talk - Ignazio Calvi talk - Ricardo Calvo talk - Murray Campbell talk - Daniel Cámpora talk - Florencio Campomanes talk - Esteban Canal talk - Arianne Caoili talk - José Raúl Capablanca talk - Rodolfo Tan Cardoso talk - Ruth Volgl Cardoso talk - Carl Carls talk - Magnus Carlsen talk - Pontus Carlsson talk - Horatio Caro talk - Fabiano Caruana talk - Berna Carrasco talk - Pietro Carrera talk - Hartwig Cassel talk - Vincenzo Castaldi talk - Mariano Castillo talk - Mišo Cebalo talk - Betül Cemre Yıldız talk - Giovanni Cenni talk - Luigi Centurini talk - Alfonso Ceron talk - Oscar Chajes talk - Ferenc Chalupetzky talk - Edward Chamier talk - Chan Peng Kong talk - Murray Chandler talk - Chang Tung Lo talk - Pascal Charbonneau talk - Henry Charlick talk - Rudolf Charousek talk - Chantal Chaudé de Silans talk - Russ Chauvenet talk - Valery Chekhov talk - Vitaly Chekhover talk - Chen Zude talk - Chen De talk - Bobby Cheng talk - Ivan Cheparinov talk - Alexander Cherepkov talk - Irving Chernev talk - Alexander Chernin talk - Konstantin Chernyshov talk - André Chéron talk - Maia Chiburdanidze talk - Mikhail Chigorin talk - Larry Christiansen talk - Martin Christoffel talk - Vladimir Chuchelov talk - Slavko Cicak talk - Roberto Cifuentes talk - Victor Ciocâltea talk - Kenneth Clayton talk - Hermann Clemenz talk - Albert Clerc talk - Viktorija Čmilytė talk - John Cochrane (chess player) talk - Philip M. Cohen talk - Erich Cohn talk - Wilhelm Cohn talk - Edgard Colle talk - John W. Collins talk - Eugene Ernest Colman talk - Adrián García Conde talk - Stuart Conquest talk - Nathaniel Cook talk - Philip Corbin talk - Deysi Cori talk - Jorge Cori talk - Anya Corke talk - Nicolaas Cortlever talk - Juan Corzo talk - John Cox (chess player) talk - Carlo Cozio talk - Spencer Crakanthorp talk - Pia Cramling talk - Robert Crépeaux talk - Rupert Cross talk - Oswaldo Cruz Filho talk - Walter Cruz talk - István Csom talk - Miguel Cuéllar talk - Pablo Cuéllar talk - Josef Cukierman talk - John Curdo talk - Ognjen Cvitan talk - Hieronim Czarnowski talk - Moshe Czerniak talk -	/m/02853tn	Murray_Campbell	89	104	/computer/computer_scientist,/computer/software_developer,/people/person
Deep Thought was a computer designed to play chess. Deep Thought was initially developed at Carnegie Mellon University and later at IBM. It was second in the line of chess computers developed by Feng-hsiung Hsu, starting with ChipTest and culminating in Deep Blue. In addition to Hsu, the Deep Thought team included Thomas Anantharaman, Mike Browne, Murray Campbell and Andreas Nowatzyk. Deep Thought was easily defeated in both games of a two-game match with Garry Kasparov in 1989 as well as in a correspondence match with Michael Valvo.	In addition to Hsu, the Deep Thought team included Thomas Anantharaman, Mike Browne, Murray Campbell and Andreas Nowatzyk.	/m/02853tn	Murray_Campbell	85	100	/computer/computer_scientist,/computer/software_developer,/people/person
In 1985, Carnegie Mellon University graduate students Feng-hsiung Hsu, Anantharaman, Murray Campbell and Andreas Nowatzyk used spare chips they'd found to put together a chess-playing machine that they called ChipTest. By 1987, the machine, integrating some innovative ideas about search strategies, had become the reigning computer chess champion. A successor, Deep Thought, using two special-purpose chips, plus about 200 off-the-shelf chips, working in parallel, achieved grandmaster-level play.	In 1985, Carnegie Mellon University graduate students Feng-hsiung Hsu, Anantharaman, Murray Campbell and Andreas Nowatzyk used spare chips they'd found to put together a chess-playing machine that they called ChipTest.	/m/02853tn	Murray_Campbell	85	100	/computer/computer_scientist,/computer/software_developer,/people/person
Boing Boing started as a zine in 1988 by Mark Frauenfelder and Carla Sinclair, his wife. Issues were subtitled "The World's Greatest Neurozine". Associate editors included Gareth Branwyn, Jon Lebkowsky, and Paco Nathan. Along with Mondo 2000, Boing Boing was an influence in the development of the cyberpunk subculture. It reached a maximum circulation of 17,500 copies. Common themes include technology, futurism, science fiction, gadgets, intellectual property, Disney and left-wing politics. The last issue of the zine was #15.	Associate editors included Gareth Branwyn, Jon Lebkowsky, and Paco Nathan.	/m/027b7w7	Paco_Nathan	62	73	/base/activism/activist,/computer/computer_scientist,/people/person
One of the first web chatterbots, named Max Headcold, was written by Garner in 1995. Max served two purposes, to collect data about web chat behavior and to entertain customers of the FringeWare online bookstore. This program was eventually implemented as a Java package called JFRED, written by Paco Nathan based on the C++ FRED CGI program, and his own influences from Stanford and various corporations. Garner and Nathan took part in the world's largest online Turing test in 1998. Their JFRED program was perceived as human by 17% of the participants.	This program was eventually implemented as a Java package called JFRED, written by Paco Nathan based on the C++ FRED CGI program, and his own influences from Stanford and various corporations.	/m/027b7w7	Paco_Nathan	83	94	/base/activism/activist,/computer/computer_scientist,/people/person
The publication was co-founded by Jon Lebkowsky and Paco Nathan, with art director Monte McCarter and assistant editor Tiffany Lee Brown. The magazine's parent company, FringeWare, Inc., was the first company built on Internet community (the FringeWare email list, later referred to as the FringeWare News Network, and probably the first to use web technology when it appeared. FringeWare also had presences on The WELL and on Illuminati Online's Metaverse, which was conceived as a commercial mulituser object-oriented environment (MOO). The company, which quickly built an international reputation through the Internet and the magazine, also owned an independent Austin bookstore that was an underground culture-hub for the city of Austin. FringeWare was one of many independent businesses to disappear from Austin during the late 1990s.	The publication was co-founded by Jon Lebkowsky and Paco Nathan, with art director Monte McCarter and assistant editor Tiffany Lee Brown.	/m/027b7w7	Paco_Nathan	52	63	/base/activism/activist,/computer/computer_scientist,/people/person
The concept has enjoyed renewed popularity among practitioners of chaos magic, following the Corporate Metabolism series of articles by Paco Xander Nathan, which were published in 2001.	The concept has enjoyed renewed popularity among practitioners of chaos magic, following the Corporate Metabolism series of articles by Paco Xander Nathan, which were published in 2001.	/m/027b7w7	Paco_Nathan	136	154	/base/activism/activist,/computer/computer_scientist,/people/person
Jon Lebkowsky (born April 20, 1949) is an web consultant/developer, author, and activist who was the co-founder of FringeWare, Inc. (along with Paco Nathan). FringeWare, an early attempt at ecommerce and online community, published a popular "magalog" called FringeWare Review, and a literary zine edited by Lebkowsky called Unshaved Truths. FringeWare's email list, called the FringeWare News Network, established an international following for the organization, which also opened a store in Austin, Texas.	Jon Lebkowsky (born April 20, 1949) is an web consultant/developer, author, and activist who was the co-founder of FringeWare, Inc. (along with Paco Nathan).	/m/027b7w7	Paco_Nathan	144	155	/base/activism/activist,/computer/computer_scientist,/people/person
In the early 1990s, Scarpa produced a New York City art exhibition entitled “Beyond 2000,” in conjunction with San Francisco based cyber-culture magazine Mondo 2000. The exhibition was held in the spirit of the 1967 human be-in at took place at The Limelight . The exhibition was designed to showcase participatory technologies of the 21st century and is believed to be the first public debut of virtual reality to the general public. Installations included works by IBVA, Synchro-Energizers, Aerotrims and wearable technology fashion designs. The exhibition also showcased a performance of Timothy Leary’s spoken/musical guided meditation How to Operate Your Brain, performances from Dj Keoki, Dj Dmitry from Dee-Lite, virtual reality performance artist Vincent John Vincent, and the first US show of popular techno-group The Prodigy. The event later spawned “Overstimulation,” a 2-day multimedia arts festival highlighting the latest in technology art of the time. Pseudo Programs Inc, founded by Josh Harris, hosted this showcase which featured many emerging silicon alley artists including Emergency Broadcast Network, Judson Rosebush, G.H. Hovagimyan, Dj Spooky and featured expanded virtual reality exhibits from Virtuality and VPL Research.	Installations included works by IBVA, Synchro-Energizers, Aerotrims and wearable technology fashion designs.	/m/027b7w7	Paco_Nathan	32	36	/base/activism/activist,/computer/computer_scientist,/people/person
