paragraph	sentence	mid	title	start	end	notable_types
True to his promise to reduce the number of Ministerial appointees and run a lean government, the number of Ministers was significantly reduced from 87 of the previous Kufuor NPP government to 73 (a reduction of 16%) in the Mills-led government. It was projected that approximately $4 million was saved annually by this bold decision to run a small government. The hundreds of Special Assistants, Presidential Staffers and Spokespersons were also eliminated to improve fiscal efficiency. A few months prior to his death, he was praised by U.S. President Barack Obama for making Ghana a "good news story" that had good democratic credentials. He also fostered economic ties with China in a bid strengthen Sino-Ghanaian bilateral relations. In 2009, the Journal of International Affairs at Columbia University featured Mills as one of the "Five Faces of African Innovation and Entrepreneurship" along with South African innovator, Euvin Naidoo and Mo Ibrahim, (founder of Celtel International and Chairman of the Mo Ibrahim Foundation) where he was lauded for his commitment to strengthening Ghana's Electoral Commission, National Media Commission and National Commission for Civic Education and more importantly, transparency in public institutions, particularly in the country's growing oil and gas sector. Mills' leadership style was very diplomatic, inclusive and less polarizing than his predecessors. The BBC described his presidency as that of "a peacemaker who was never one to make disparaging comments in public" despite intense criticisms and vilification from his political supporters and opponents alike.	In 2009, the Journal of International Affairs at Columbia University featured Mills as one of the "Five Faces of African Innovation and Entrepreneurship" along with South African innovator, Euvin Naidoo and Mo Ibrahim, (founder of Celtel International and Chairman of the Mo Ibrahim Foundation) where he was lauded for his commitment to strengthening Ghana's Electoral Commission, National Media Commission and National Commission for Civic Education and more importantly, transparency in public institutions, particularly in the country's growing oil and gas sector.	/m/026755p	Mo_Ibrahim	207	217	/people/person
Founded in 1989 by Mo Ibrahim after he left Cellnet, Mobile Systems International provided consultancy, network planning and management application software to the wireless industry. In 1998 the company became known as MSI Metapath Software International. This was after a merger with Metapath Software, a firm that made real-time customer management products for the mobile industry. The merger also generated a new spin off called MSI-Cellular Investments which specialised in developing mobile phone services in African countries .	Founded in 1989 by Mo Ibrahim after he left Cellnet, Mobile Systems International provided consultancy, network planning and management application software to the wireless industry.	/m/026755p	Mo_Ibrahim	19	29	/people/person
Celtel was a telecommunications company that operated in several African countries. It was founded by Sudanese-born Mo Ibrahim.	It was founded by Sudanese-born Mo Ibrahim.	/m/026755p	Mo_Ibrahim	32	42	/people/person
Under the direction of Professor Rotberg and supported by the Mo Ibrahim Foundation, an Index of African Governance was created in 2007. It ranks all 48 sub-Saharan African countries according to quality of governance. In conjunction, Mo Ibrahim has created the Ibrahim Prize for Achievement in African Leadership, a prize larger in monetary value than the Nobel Prize.	Under the direction of Professor Rotberg and supported by the Mo Ibrahim Foundation, an Index of African Governance was created in 2007.	/m/026755p	Mo_Ibrahim	62	72	/people/person
Under the direction of Professor Rotberg and supported by the Mo Ibrahim Foundation, an Index of African Governance was created in 2007. It ranks all 48 sub-Saharan African countries according to quality of governance. In conjunction, Mo Ibrahim has created the Ibrahim Prize for Achievement in African Leadership, a prize larger in monetary value than the Nobel Prize.	In conjunction, Mo Ibrahim has created the Ibrahim Prize for Achievement in African Leadership, a prize larger in monetary value than the Nobel Prize.	/m/026755p	Mo_Ibrahim	16	26	/people/person
In January 2011 he was once again listed on the Black Power List, alongside such illustrious names as; Rio Ferdinand, Baroness Scotland, Diane Abbott MP, Mo Ibrahim, Archbishop of York - Dr John Sentamu , Trevor Phillips (Chairman, Commission for Equalities and Human Rights), David Lammy MP, Abigail Blackburn (Editor of Now Magazine), Michelle Ogundehin (Editor-in-chief, Elle Decoration), Paul Boateng (British High Commissioner to South Africa)	In January 2011 he was once again listed on the Black Power List, alongside such illustrious names as; Rio Ferdinand, Baroness Scotland, Diane Abbott MP, Mo Ibrahim, Archbishop of York - Dr John Sentamu , Trevor Phillips (Chairman, Commission for Equalities and Human Rights), David Lammy MP, Abigail Blackburn (Editor of Now Magazine), Michelle Ogundehin (Editor-in-chief, Elle Decoration), Paul Boateng (British High Commissioner to South Africa)	/m/026755p	Mo_Ibrahim	154	164	/people/person
Founded in 1999 by Rob Friedman, Sanjay Parekh and Dennis Maicon, Digital Envoy patented  and introduced geotargeting technology (also recognized as geolocation or IP location technology). In 2005, Digital Envoy created two business units: Digital Element and Digital Resolve. In 2007, Landmark Communications, Inc. purchased Digital Envoy. The company became part of Dominion Enterprises in 2009.	Founded in 1999 by Rob Friedman, Sanjay Parekh and Dennis Maicon, Digital Envoy patented  and introduced geotargeting technology (also recognized as geolocation or IP location technology).	/m/04y99df	Sanjay_Parekh	33	46	/people/person
On 31 July 1985, for what was thought to be $6.3 million, Geoffrey Edelsten "bought" the Swans. In reality it was $2.9 million in cash with funding and other payments spread over five years. Edelsten resigned as chairman in less than twelve months, but had already made his mark. He immediately snapped up former Geelong coach Tom Hafey. Hafey, in turn, used his knowledge of Geelong’s contracts to snap up David Bolton, Bernard Toohey and Greg Williams, who would all form a key part of the Sydney side, at a league-determined total fee of $240,000 (less than the $500,000 Geelong demanded and even the $300,000 Sydney offered). The likes of Gerard Healy, Merv Neagle and Paul Morwood were also poached from other clubs, and failed approaches were made to Simon Madden, Terry Daniher, Andrew Bews and Maurice Rioli.	On 31 July 1985, for what was thought to be $6.3 million, Geoffrey Edelsten "bought" the Swans.	/m/08gbyy	Geoffrey_Edelsten	58	75	/people/person
Local health services in the Town Centre include Modern Medical Health Clinic and Life Physiotherapy. A new medical centre, 'Super Clinic', owned by the controversial Dr. Geoffrey Edelsten is due to open at the Mercure Hotel in late 2010.	A new medical centre, 'Super Clinic', owned by the controversial Dr. Geoffrey Edelsten is due to open at the Mercure Hotel in late 2010.	/m/08gbyy	Geoffrey_Edelsten	65	86	/people/person
On 30 September 2010, writer/director Greg McLean confirmed a sequel is in the works. Production is expected to commence sometime in 2011. The film will be again be set in the Australian outback and feature the character of Mick Taylor. Like the previous film, the story will have some elements based on true events. John Jarratt is also set to reprise the role of Mick Taylor. In August, it was announced that controversial personality Geoffrey Edelsten was investing A$5 million into the production of Wolf Creek 2 after reading the script. However, in December 2011, Edelsten issued court proceedings to set aside a payment demand from the production company, claiming he never would have committed to the project if he had known he would be the largest single private investor, a claim the production company denies. At the time, the budget for the film was quoted as A$13.2 million.	In August, it was announced that controversial personality Geoffrey Edelsten was investing A$5 million into the production of Wolf Creek 2 after reading the script.	/m/08gbyy	Geoffrey_Edelsten	59	76	/people/person
He was also well known for his looks, his long blonde locks of hair, deeply tanned skin and was famous for his white boots and extremely tight shorts. This formed part of the flamboyant image of the Swans club during the years in which it was owned by Geoffrey Edelsten.	This formed part of the flamboyant image of the Swans club during the years in which it was owned by Geoffrey Edelsten.	/m/08gbyy	Geoffrey_Edelsten	101	118	/people/person
In 2011, she caused further controversy when she wrote "I think it's nice you get on so well with your dad" on her Twitter account regarding the difference in age between dancer Brynne Edelsten and her husband Geoffrey Edelsten.	In 2011, she caused further controversy when she wrote "I think it's nice you get on so well with your dad" on her Twitter account regarding the difference in age between dancer Brynne Edelsten and her husband Geoffrey Edelsten.	/m/08gbyy	Geoffrey_Edelsten	210	227	/people/person
It is what he did later in his career however, as an administrator for the VFL (now known as the AFL) in the 1970s and 1980s, that he is most well known for. After holding the position of North Melbourne Football Club president in the 1970s he became president of the VFL and led the expansion of the VFL into the tough Sydney market, along with then-Sydney Swans president Geoffrey Edelsten.	After holding the position of North Melbourne Football Club president in the 1970s he became president of the VFL and led the expansion of the VFL into the tough Sydney market, along with then-Sydney Swans president Geoffrey Edelsten.	/m/08gbyy	Geoffrey_Edelsten	216	233	/people/person
During the 1985 season, the VFL had sold the Sydney Swans to controversial medical entrepreneur Geoffrey Edelsten, in an attempt to create the first privately owned club. "Franchising", club licensing, player drafts and salary caps were all concepts borrowed from the United States that the VFL were attempting to import to Australian football at a time of financial crisis. Edelsten was now frantically signing up star players from Melbourne clubs, offering massive contracts to move to the harbour city. The signature he coveted most was Kevin Sheedy, who had just coached Essendon to successive premierships and was the hottest commodity in the game. Sheedy turned Edelsten down, but urged the Swans' owner to sign his old mentor, Tom Hafey. Hafey duly signed on for three years, was given the highest paid list of players in the game, and he relocated to Sydney with his family.	During the 1985 season, the VFL had sold the Sydney Swans to controversial medical entrepreneur Geoffrey Edelsten, in an attempt to create the first privately owned club.	/m/08gbyy	Geoffrey_Edelsten	96	113	/people/person
Mordor: The Depths of Dejenol is a role-playing video game released in 1995 for Microsoft Windows. It was game designer David Allen's first release. Mordor inspired a sequel, Demise: Rise of the Ku'tan, released in 2000.	It was game designer David Allen's first release.	/m/04mqq5	David_Allen_(game_designer)	21	32	/cvg/cvg_designer,/people/person
Alganon is a massively multiplayer online role-playing game (MMORPG) designed by David Allen, developed by Arizona-based Quest Online. Alganon was previously called "Crusade". Alganon is free to play, requiring an active Internet connection. The game was released December 1, 2009.	Alganon is a massively multiplayer online role-playing game (MMORPG) designed by David Allen, developed by Arizona-based Quest Online.	/m/04mqq5	David_Allen_(game_designer)	81	92	/cvg/cvg_designer,/people/person
When confronted by these accusation, David Allen didn't deny any wrongdoing and insisted that players want a familiar UI.	When confronted by these accusation, David Allen didn't deny any wrongdoing and insisted that players want a familiar UI.	/m/04mqq5	David_Allen_(game_designer)	37	48	/cvg/cvg_designer,/people/person
Demise: Rise of the Ku'tan is a medieval fantasy role-playing video game released in 1999 for the personal computer (PC), developed by Artifact Entertainment and published by IPC Software. The game features the same setting as Mordor: The Depths of Dejenol, which was also developed by designer David Allen.	The game features the same setting as Mordor: The Depths of Dejenol, which was also developed by designer David Allen.	/m/04mqq5	David_Allen_(game_designer)	106	117	/cvg/cvg_designer,/people/person
Traditionally, the colours of the Brisbane Broncos have been maroon, white and gold, which have all long been linked to the history of rugby league in Queensland. Initially, the founders of the club favoured the official blue and gold colours of Brisbane City Council. However, Sydney advertiser John Singleton advised the board that "Queenslanders had been booing players wearing blue for more than three-quarters of a century." As a result, the traditional maroon and white colours of Queensland along with gold, symbolising the Queensland sunshine,  were adopted as the club's colours.	However, Sydney advertiser John Singleton advised the board that "Queenslanders had been booing players wearing blue for more than three-quarters of a century.	/m/0bmv0v	John_Singleton_(Australian_entrepreneur)	27	41	/people/person
The Gold Coast 600 (formerly known as Lexmark Indy 300) is a car racing event held annually, usually in October. The course runs through the streets of Surfers Paradise and Main Beach. The GC 600 comprises many other events such as the Indy Undie Ball and the Miss Indy Competition. Formerly an Indy car event, V8 Supercars are now the headline attraction, using a similar track route, as the circuit was cut in half by a hairpin. The Magic Millions carnival is the brainchild of entrepreneurs Gerry Harvey (of Harvey Normans) and John Singleton. There are plans to relocate and build a state-of-the-art new racetrack at Palm Meadows which will incorporate the Magic Million sale with facilities for up to 4000 horses.	The Magic Millions carnival is the brainchild of entrepreneurs Gerry Harvey (of Harvey Normans) and John Singleton.	/m/0bmv0v	John_Singleton_(Australian_entrepreneur)	100	114	/people/person
Several attempts have been made to have teams enter other national competitions. The most notable of these was the attempt to enter the Central Coast Bears as the 16th team into the NRL. This attempt was financed by a consortium led by John Singleton, but the Gold Coast Titans were ultimately successful. The Northern Eagles, a merger of NRL clubs Manly-Warringah and North Sydney began their tenure playing half of their games at Gosford, however within three years the team was solely playing back at Brookvale. South Sydney were also unsuccessfully approached to play out of Gosford, despite the few games that are played on the Central Coast attracting large crowds. The Central Coast Storm rugby league team play in a number of NSWRL lower grade competitions in rugby league, and the Central Coast Waves rugby union team plays in the Shute Shield. Most recently, the Central Coast Rays rugby union club who competed in the ill-fated Australian Rugby Championship's only season late in 2007, called Bluetongue Stadium home.	This attempt was financed by a consortium led by John Singleton, but the Gold Coast Titans were ultimately successful.	/m/0bmv0v	John_Singleton_(Australian_entrepreneur)	49	63	/people/person
With journalist Steve Crawley he wrote Don't Die with the Music in You whose title refers to a quote from the American intellectual Oliver Wendell Holmes, Sr. regarding failure to meet one's potential. The likes of Steve Waugh, Lachlan Murdoch, David Gallop, John Singleton and Jack Gibson attended the book's launch at the Australian Museum in Sydney on 7 May 2002. It has become one of the best selling books about rugby league in Australia's history (ISBN 0-7333-1107-5, ABC Books Australia). It went on to sell over 100,000 copies.	The likes of Steve Waugh, Lachlan Murdoch, David Gallop, John Singleton and Jack Gibson attended the book's launch at the Australian Museum in Sydney on 7 May 2002.	/m/0bmv0v	John_Singleton_(Australian_entrepreneur)	57	71	/people/person
2CH commenced broadcasting on 15 February 1932 on 1210 kHz. It moved to 1190 in 1935 and again to 1170 in 1978. The NSW Council of Churches was its licence holder until it was sold to Mr John Singleton in April 1994. The CH stands for "Churches". The Council continues to have a significant input in the format of the station.	The NSW Council of Churches was its licence holder until it was sold to Mr John Singleton in April 1994.	/m/0bmv0v	John_Singleton_(Australian_entrepreneur)	75	89	/people/person
The NRL is the national competition in rugby league and was born out of the Sydney based Australian Rugby League and New South Wales Rugby League competitions. In 1987, the Western Suburbs Magpies agreed to relocate from its (inner) Western suburbs base to the outer south-western Macarthur district following a prior move west to Lidcombe Oval. In 1999, they merged with the remaining Inner Western team, the Balmain Tigers, (both teams having been established in 1908) to become Wests Tigers. The North Sydney Bears attempted to move from their Northern Suburbs base to the swiftly growing Central Coast region just north of Sydney in 1999, however problems with construction at the proposed home ground now known as Bluetongue Central Coast Stadium meant that the Bears continued to play home matches in a variety of Sydney grounds before being forced into a merger with the Manly Sea Eagles as the Northern Eagles. The merged clubs played home matches at both the Central Coast and Manly's home ground of Brookvale Oval, but after the bears were expelled from the partnership, poor crowds at the former location led to a reversion to the name of Manly and games played exclusively at Brookvale Oval. Subsequently one of the owners of Bluetongue Central Coast Stadium, John Singleton, has attempted to lure another club to play there, notably the South Sydney Rabbitohs who have experienced poor crowds at their new home ground of ANZ Stadium.	Subsequently one of the owners of Bluetongue Central Coast Stadium, John Singleton, has attempted to lure another club to play there, notably the South Sydney Rabbitohs who have experienced poor crowds at their new home ground of ANZ Stadium.	/m/0bmv0v	John_Singleton_(Australian_entrepreneur)	68	82	/people/person
The club also struggled off-field, with Brian Smith's decision to release players such as Clint Newton, Kirk Reynoldson, and Josh Perry meeting with displeasure from the Sydney media and some sections of the Newcastle support base. Newton's defection to Melbourne and Reynoldson's threats of legal action over the club refusing to play him in the fifteen games required to trigger his fourth contract year saw the club's reputation dragged through the mud. The Daily Telegraph campaigned strongly for the sacking of Smith whilst Bluetongue brewery owner John Singleton also threatened legal action after the releases lead to a multi-million dollar advertising campaign with his company being cancelled. To cap it all off, Andrew Johns again made the press late in the season after being arrested for ecstasy possession in the United Kingdom and confessing to having been a drug addict for the entirety of his playing career.	The Daily Telegraph campaigned strongly for the sacking of Smith whilst Bluetongue brewery owner John Singleton also threatened legal action after the releases lead to a multi-million dollar advertising campaign with his company being cancelled.	/m/0bmv0v	John_Singleton_(Australian_entrepreneur)	97	111	/people/person
Macquarie Radio Network (ASX: MRN) is the name of the company that owns and operates 2GB and 2CH in Sydney. It is a publicly listed company, majority owned by John Singleton.	It is a publicly listed company, majority owned by John Singleton.	/m/0bmv0v	John_Singleton_(Australian_entrepreneur)	51	65	/people/person
Ryan was soon poached by John Singleton to mentor the listless Newtown Jets club. The club were perennial losers and with the club spiralling towards oblivion, Ryan would perform a veritable miracle in 1981, leading a rag-tag team to the Grand Final. Leading 11-7 deep into the second half, Ryan's Jets were eventually overrun 20-11 by a Parramatta Eels team that featured some of the 1980s greatest players. Ryan left Newtown at the end of the 1982 season.	Ryan was soon poached by John Singleton to mentor the listless Newtown Jets club.	/m/0bmv0v	John_Singleton_(Australian_entrepreneur)	25	39	/people/person
The X PRIZE Foundation has a staff of approximately 50 individuals and is headquartered in Playa Vista, California. It boasts an all-star board of trustees including Larry Page, Elon Musk, James Cameron, Dean Kamen, Ratan Tata, Ray Kurzweil, Jim Gianopulos, Naveen Jain, Arianna Huffington, Will Wright and Craig Venter.	It boasts an all-star board of trustees including Larry Page, Elon Musk, James Cameron, Dean Kamen, Ratan Tata, Ray Kurzweil, Jim Gianopulos, Naveen Jain, Arianna Huffington, Will Wright and Craig Venter.	/m/03clvwm	Naveen_Jain	142	153	/influence/influence_node,/law/inventor,/people/person,/user/alexander/philosophy/philosopher
The company was founded as Infospace in March 1996 by Naveen Jain after he left Microsoft. He served as CEO until 2000. The company, which started with six employees, built an online yellow pages service to be funded through advertising. A set of simple chat rooms (based on HTML and meta refresh) were also available on the site.	The company was founded as Infospace in March 1996 by Naveen Jain after he left Microsoft.	/m/03clvwm	Naveen_Jain	54	65	/influence/influence_node,/law/inventor,/people/person,/user/alexander/philosophy/philosopher
Intelius was founded in 2003 by six former Infospace executives: Naveen Jain, Kevin Marcus, Niraj Shah, Ed Petersen, Chandan Chauhan and John Arnold. Jain was then sued by InfoSpace for allegedly violating noncompete agreements, mishandling business-specific secrets and interfering with InfoSpace's customer relationships. The judge ruled in favor of Jain, citing a lack of "clear and convincing evidence" that there was a violation of noncompete agreements.	Intelius was founded in 2003 by six former Infospace executives: Naveen Jain, Kevin Marcus, Niraj Shah, Ed Petersen, Chandan Chauhan and John Arnold.	/m/03clvwm	Naveen_Jain	65	76	/influence/influence_node,/law/inventor,/people/person,/user/alexander/philosophy/philosopher
In January 1983, Steve Case was hired as a marketing consultant for Control Video on the recommendation of his brother, investment banker Dan Case. In May 1983, Jim Kimsey became a manufacturing consultant for Control Video, which was near bankruptcy. Kimsey was brought in by his West Point friend Frank Caufield, an investor in the company. Von Meister quietly left the company in early 1985.	In January 1983, Steve Case was hired as a marketing consultant for Control Video on the recommendation of his brother, investment banker Dan Case.	/m/01p__8	Steve_Case	17	27	/book/book_subject,/business/board_member,/internet/social_network_user,/organization/organization_founder,/people/person,/venture_capital/venture_investor
Steve Case positioned AOL as the online service for people unfamiliar with computers, in particular contrast to CompuServe, which had long served the technical community. The PlayNet system that AOL licensed was the first online service to require use of proprietary software, rather than a standard terminal program; it also offered a graphical user interface (GUI) instead of command lines, and was well ahead of the competition in emphasizing communication among members as a feature.	Steve Case positioned AOL as the online service for people unfamiliar with computers, in particular contrast to CompuServe, which had long served the technical community.	/m/01p__8	Steve_Case	0	10	/book/book_subject,/business/board_member,/internet/social_network_user,/organization/organization_founder,/people/person,/venture_capital/venture_investor
Most recently he joined the Board of Directors of Steve Case's new company Revolution Health. Powell also serves on the Council on Foreign Relations Board of directors.	Most recently he joined the Board of Directors of Steve Case's new company Revolution Health.	/m/01p__8	Steve_Case	50	60	/book/book_subject,/business/board_member,/internet/social_network_user,/organization/organization_founder,/people/person,/venture_capital/venture_investor
