paragraph	sentence	mid	title	start	end	notable_types
Under President Larry Bacow, Tufts started a capital campaign in 2006 with the goal of raising $1.2 billion to implement full need-blind admission by 2011. As of December 10, 2010 (2010-12-10) the campaign raised $1.14 billion. Tufts received the largest donations in its history since 2005, including a $136 million bequest to its endowment upon the dissolution of a charitable trust set up by 1911 alumnus Frank C. Doble, a $100 million gift from eBay founder Pierre Omidyar to establish the Omidyar-Tufts Microfinance Fund, and a number of $40 million-plus gifts to specific schools.	Tufts received the largest donations in its history since 2005, including a $136 million bequest to its endowment upon the dissolution of a charitable trust set up by 1911 alumnus Frank C. Doble, a $100 million gift from eBay founder Pierre Omidyar to establish the Omidyar-Tufts Microfinance Fund, and a number of $40 million-plus gifts to specific schools.	/m/034xnb	Pierre_Omidyar	234	248	/business/board_member,/business/shareholder,/organization/organization_founder,/people/person,/user/narphorium/people/wealthy_person
The Jonathan M. Tisch College of Citizenship and Public Service was founded in 2000 "to educate for active citizenship" with the help of a $10 million gift from eBay founder Pierre Omidyar and his wife Pam. The school was renamed in 2006 after a $40 million gift from Jonathan Tisch. It has been called the "most ambitious attempt by any research university to make public service part of its core academic mission." Tisch College does not grant degrees; the college facilitates and supports a wide range of community service, civic engagement programs, research, and teaching initiatives across the university.	The Jonathan M. Tisch College of Citizenship and Public Service was founded in 2000 "to educate for active citizenship" with the help of a $10 million gift from eBay founder Pierre Omidyar and his wife Pam.	/m/034xnb	Pierre_Omidyar	174	188	/business/board_member,/business/shareholder,/organization/organization_founder,/people/person,/user/narphorium/people/wealthy_person
Tufts alumni in the government sector include Kostas Karamanlis, former Prime Minister of Greece; Shashi Tharoor, former United Nations Under-Secretary General and Indian Minister; Scott Brown, Republican ex-U S Senator from Massachusetts; Bill Richardson, Democratic Governor of New Mexico; and Peter DeFazio, Democratic United States Representative from Oregon. Graduates who have found success in business include Pierre Omidyar, eBay founder; Roy Raymond, founder of Victoria's Secret; Laura Lang, CEO of Time Inc; Jamie Dimon, CEO of JPMorgan Chase; John Bello, SoBe Beverages founder; Jeff Kindler, Former CEO of Pfizer; Jonathan Tisch, CEO of Loews Hotels; Ellen J. Kullman, CEO of DuPont; and Joseph Neubauer, Former CEO and currently Chairman of ARAMARK.	Graduates who have found success in business include Pierre Omidyar, eBay founder; Roy Raymond, founder of Victoria's Secret; Laura Lang, CEO of Time Inc; Jamie Dimon, CEO of JPMorgan Chase; John Bello, SoBe Beverages founder; Jeff Kindler, Former CEO of Pfizer; Jonathan Tisch, CEO of Loews Hotels; Ellen J. Kullman, CEO of DuPont; and Joseph Neubauer, Former CEO and currently Chairman of ARAMARK.	/m/034xnb	Pierre_Omidyar	53	67	/business/board_member,/business/shareholder,/organization/organization_founder,/people/person,/user/narphorium/people/wealthy_person
Campbell /ˈkæmbəl/ is a city in Santa Clara County, California, a suburb of San Jose, and part of Silicon Valley, in the San Francisco Bay Area. As of the 2010 U.S. Census, Campbell's population is 39,349. Although not a major high-tech city like many of its neighbors, Campbell is the original home of eBay and of its creator, Pierre Omidyar.	Although not a major high-tech city like many of its neighbors, Campbell is the original home of eBay and of its creator, Pierre Omidyar.	/m/034xnb	Pierre_Omidyar	122	136	/business/board_member,/business/shareholder,/organization/organization_founder,/people/person,/user/narphorium/people/wealthy_person
AuctionWeb was founded in San Jose, California, on September 5, 1995, by French-born Iranian-American computer programmer Pierre Omidyar (born on June 21, 1967) as part of a larger personal site that included, among other things, Omidyar's own tongue-in-cheek tribute to the Ebola virus. One of the first items sold on AuctionWeb was a broken laser pointer for $14.83. Astonished, Omidyar contacted the winning bidder to ask if he understood that the laser pointer was broken. In his responding email, the buyer explained: "I'm a collector of broken laser pointers." The frequently repeated story that eBay was founded to help Omidyar's fiancée trade Pez candy dispensers was fabricated by a public relations manager in 1997 to interest the media, which were not interested in the company's previous explanation about wanting to create a "perfect market". This was revealed in Adam Cohen's 2002 book, The Perfect Store, and confirmed by eBay. Chris Agarpao was hired as eBay's first employee and Jeffrey Skoll was hired as the first president of the company in early 1996. In November 1996, eBay entered into its first third-party licensing deal, with a company called Electronic Travel Auction to use SmartMarket Technology to sell plane tickets and other travel products. Growth was phenomenal; in January 1997 the site hosted 2,000,000 auctions, compared with 250,000 during the whole of 1996. The company officially changed the name of its service from AuctionWeb to eBay in September 1997. Originally, the site belonged to Echo Bay Technology Group, Omidyar's consulting firm. Omidyar had tried to register the domain name echobay.com, but found it already taken by the Echo Bay Mines, a gold mining company, so he shortened it to his second choice, eBay.com.	AuctionWeb was founded in San Jose, California, on September 5, 1995, by French-born Iranian-American computer programmer Pierre Omidyar (born on June 21, 1967) as part of a larger personal site that included, among other things, Omidyar's own tongue-in-cheek tribute to the Ebola virus.	/m/034xnb	Pierre_Omidyar	122	136	/business/board_member,/business/shareholder,/organization/organization_founder,/people/person,/user/narphorium/people/wealthy_person
Notable recent immigrants from FSU include Natan Sharansky, Boris Gelfand, Natasha Mozgovaya, Avigdor Lieberman, Roman Dzindzichashvili, Anastassia Michaeli, Haim Megrelashvili, Victor Mikhalevski, Evgeny Postny, Maxim Rodshtein, Tatiana Zatulovskaya, Maria Gorokhovskaya, Katia Pisetsky, Aleksandr Averbukh, Jan Talesnikov, Vadim Alexeev, Michael Kolganov, Alexander Danilov, Evgenia Linetskaya, Marina Kravchenko, David Kazhdan, Leonid Nevzlin, Vadim Akolzin, Roman Bronfman, Michael Cherney, Arcadi Gaydamak, Sergei Sakhnovski, Roman Zaretski, Alexandra Zaretski, Larisa Trembovler, Boris Tsirelson and Margarita Levieva.	Notable recent immigrants from FSU include Natan Sharansky, Boris Gelfand, Natasha Mozgovaya, Avigdor Lieberman, Roman Dzindzichashvili, Anastassia Michaeli, Haim Megrelashvili, Victor Mikhalevski, Evgeny Postny, Maxim Rodshtein, Tatiana Zatulovskaya, Maria Gorokhovskaya, Katia Pisetsky, Aleksandr Averbukh, Jan Talesnikov, Vadim Alexeev, Michael Kolganov, Alexander Danilov, Evgenia Linetskaya, Marina Kravchenko, David Kazhdan, Leonid Nevzlin, Vadim Akolzin, Roman Bronfman, Michael Cherney, Arcadi Gaydamak, Sergei Sakhnovski, Roman Zaretski, Alexandra Zaretski, Larisa Trembovler, Boris Tsirelson and Margarita Levieva.	/m/0gv02_	Michael_Cherney	478	493	/people/person
On 24 November 2006, Michael Cherney brought legal action against Deripaska in the Commercial Court of the High Court in London. Cherney sought a declaration that he was the beneficial owner of 20% of RUSAL stock which, he claimed, Deripaska held in trust for him. The claim was denied. On 3 May 2007, Mr Justice Langley ruled that Deripaska had not been properly served and that the court had no jurisdiction to try the claim as Deripaska was not domiciled in England or Wales.	On 24 November 2006, Michael Cherney brought legal action against Deripaska in the Commercial Court of the High Court in London.	/m/0gv02_	Michael_Cherney	21	36	/people/person
Some of Lieberman's connections with local and foreign businessmen are currently under police investigation. Lieberman allegedly received millions of shekels from various entrepreneurs while serving as member of Knesset; under Israeli law, MKs are not allowed to receive any payment beyond their salary. One claim is that Michael Cherney paid a company called Path to the East large amounts of money between the years 1999 and 2006, and that these sums were then allegedly passed on to Lieberman as a bribe. Other allegations concern a company called M.L.1, founded by Lieberman's daughter Michal when she was 21. These allegations concern money transferred to M.L.1 from unknown sources outside Israel; the money was later allegedly used for paying salaries to Avigdor and Michal Lieberman. Lieberman is also under investigation for receiving a bribe from Austrian-Jewish businessman Martin Schlaff.	One claim is that Michael Cherney paid a company called Path to the East large amounts of money between the years 1999 and 2006, and that these sums were then allegedly passed on to Lieberman as a bribe.	/m/0gv02_	Michael_Cherney	18	33	/people/person
The Michael Cherney Foundation is a charitable foundation created by Michael Cherney, a Russian-born Israeli entrepreneur. Cherney defines the mission of the foundation as to help democratic nations in their war on terrorism and assist fellow émigrés to Israel from Russia and other post-Soviet nations realize their intellectual potential and become successfully integrated into the Israeli society.	The Michael Cherney Foundation is a charitable foundation created by Michael Cherney, a Russian-born Israeli entrepreneur.	/m/0gv02_	Michael_Cherney	4	19	/people/person
In February 1993, privatisation of the aluminium industry began. In two years, the distribution of production facilities in the industry was completed. As a result, the Bratsk, Sayanogorsk, Krasnoyarsk (partially) smelters and the Pavlodar alumina refinery in Kazakhstan with an annual capacity of 1 million Mt were appropriated by TWG, whose interests in Russia were represented by the two brothers, Michael and Lev Cherney.	As a result, the Bratsk, Sayanogorsk, Krasnoyarsk (partially) smelters and the Pavlodar alumina refinery in Kazakhstan with an annual capacity of 1 million Mt were appropriated by TWG, whose interests in Russia were represented by the two brothers, Michael and Lev Cherney.	/m/0gv02_	Michael_Cherney	249	256	/people/person
Ron Jacobs notes that the primary sponsor of the conference, Michael Cherney, "is the subject of controversy and is currently denied entry into the United States because of his indictment on various charges in Russia and Israel." Jacobs points out that "Cherney is well-known among supporters of Israel and has contributed millions of dollars to various organizations on the right end of Israel's political spectrum, as well as several thousands to the US Republican Party." The St. Petersburg Times confirms that Cherney is the main contributor to the Summit and notes that "the United States has denied Cherney a visa since 1999 because of alleged ties to the Russian mafia." Cherney is listed for organized crime and money laundering on the the Interpol Red List of wanted persons. Loftus counters that Cherney "was framed by  Negroponte."	Ron Jacobs notes that the primary sponsor of the conference, Michael Cherney, "is the subject of controversy and is currently denied entry into the United States because of his indictment on various charges in Russia and Israel.	/m/0gv02_	Michael_Cherney	61	76	/people/person
Shortly after the 2006 event, the Bush Administration purportedly ordered government personnel not to associate with The Intelligence Summit or attend its conferences; The New York Sun reported, "(B)oth John Deutch and James Woolsey abruptly left their positions at Intelligence Summit, according to its president, John Loftus, who said their departure is part of a campaign by the Directorate of National Intelligence to punish him for releasing the recordings ...." Woolsey denied that there had been any pressure to withdraw, stating that "If Loftus is saying that anyone pressured me about this issue he is quite wrong." UPI reported that Deutch and Woolsey resigned from the Board after learning that the conference's primary sponsor was Michael Cherney, who "has been investigated or blacklisted on suspicion of money laundering, illegal business deals and connections to the Russian mafia by half a dozen European countries and barred from entry by the U.S. authorities"	" UPI reported that Deutch and Woolsey resigned from the Board after learning that the conference's primary sponsor was Michael Cherney, who "has been investigated or blacklisted on suspicion of money laundering, illegal business deals and connections to the Russian mafia by half a dozen European countries and barred from entry by the U.S. authorities"	/m/0gv02_	Michael_Cherney	120	135	/people/person
The company originally started by Scott Hassan in January, 1997, as an email archiving service called FindMail. Carl V. Page, Jr. joined the company part-time in May 1997. In December, 1997, Hassan decided to add the ability to host free mailing lists and called the new product MakeList.com. Martin Roscheisen joined as CEO in March 1998. Makelist.com quickly grew to 250,000 users before taking a venture finance round of $810,000 from Atlas Venture in May 1998. The post-money valuation was set at $4.5m. In June, 1998, the company was renamed eGroups.com. In October, 1998, with 1.2 million users (growing at 12,000 users per day), the company had an offer on the table from Excite for $40m but decided instead to take $5.1 million more investment money from Sequoia Capital.	Martin Roscheisen joined as CEO in March 1998.	/m/0h04vn	Martin_Roscheisen	0	17	/business/board_member,/film/producer,/people/person,/venture_capital/venture_investor
The plot revolves around love and the struggle over the virtues of free will versus destiny. It follows the journey of Reese, who becomes a hitman after he loses his wife and unborn child, as he confronts the forces of love, faith, and destiny. It was written, directed, and produced by Reid Gershbein, executive producer Martin Roscheisen, and stars Lori Petty, Peter Quartaroli, and Mackenzie Firgens.	It was written, directed, and produced by Reid Gershbein, executive producer Martin Roscheisen, and stars Lori Petty, Peter Quartaroli, and Mackenzie Firgens.	/m/0h04vn	Martin_Roscheisen	77	94	/business/board_member,/film/producer,/people/person,/venture_capital/venture_investor
At Stanford became friends with Sergey Brin, Larry Page, and Martin Roscheisen who helped fund the film "Broken Arrows".	At Stanford became friends with Sergey Brin, Larry Page, and Martin Roscheisen who helped fund the film "Broken Arrows".	/m/0h04vn	Martin_Roscheisen	61	78	/business/board_member,/film/producer,/people/person,/venture_capital/venture_investor
FindLaw is a business of Thomson Reuters that provides online legal information and online marketing services for law firms. FindLaw was created by Stacy Stern, Martin Roscheisen, and Tim Stanley in 1995, and was acquired by Thomson West in 2001.	FindLaw was created by Stacy Stern, Martin Roscheisen, and Tim Stanley in 1995, and was acquired by Thomson West in 2001.	/m/0h04vn	Martin_Roscheisen	36	53	/business/board_member,/film/producer,/people/person,/venture_capital/venture_investor
On Jan. 19 2012 former EVP of Engineering & Operations Eugenia Corrales was named CEO following CEO Geoff Tate returning to retirement. Tate had been CEO of Nanosolar since March 22, 2010 having been hired out of retirement as an interim CEO for his experience in leading a company into volume production as CEO of Rambus. Tate replaced co-founder Martin Roscheisen who had been the company's Chairman & CEO for the past eight years; no reason was given for Roscheisen's exit.	Tate replaced co-founder Martin Roscheisen who had been the company's Chairman & CEO for the past eight years; no reason was given for Roscheisen's exit.	/m/0h04vn	Martin_Roscheisen	25	42	/business/board_member,/film/producer,/people/person,/venture_capital/venture_investor
Burger King, often abbreviated as BK, is a global chain of hamburger fast food restaurants headquartered in unincorporated Miami-Dade County, Florida, United States. The company began in 1953 as Insta-Burger King, a Jacksonville, Florida-based restaurant chain. After Insta-Burger King ran into financial difficulties in 1954, its two Miami-based franchisees, David Edgerton and James McLamore, purchased the company and renamed it Burger King. Over the next half century, the company would change hands four times, with its third set of owners, a partnership of TPG Capital, Bain Capital, and Goldman Sachs Capital Partners, taking it public in 2002. In late 2010, 3G Capital of Brazil acquired a majority stake in BK in a deal valued at US$3.26 billion. The new owners promptly initiated a restructuring of the company to reverse its fortunes.	After Insta-Burger King ran into financial difficulties in 1954, its two Miami-based franchisees, David Edgerton and James McLamore, purchased the company and renamed it Burger King.	/m/06n867	David_Edgerton	98	112	/organization/organization_founder,/people/person
When the predecessor of Burger King first opened in Jacksonville in 1953, its menu consisted predominantly of basic hamburgers, French fries, soft drinks, milkshakes and desserts. After being acquired by its Miami, Florida, franchisees and renamed to its current moniker in 1954, BK began expanding the breadth of its menu by adding the Whopper sandwich in 1957. This quarter-pound (4 oz (110 g)) hamburger was created by Burger King's new owners James McLamore and David Edgerton as a way to differentiate BK from other burger outlets at the time. Since its inception, the Whopper has become synonymous with Burger King, and has become the focus of much of its advertising. The company even named its new kiosk-style restaurants Whopper Bars.	This quarter-pound (4 oz (110 g)) hamburger was created by Burger King's new owners James McLamore and David Edgerton as a way to differentiate BK from other burger outlets at the time.	/m/06n867	David_Edgerton	103	117	/organization/organization_founder,/people/person
James Whitman McLamore (May 30, 1926 – August 9, 1996) was co-founder of the Burger King fast food franchise with David Edgerton. McLamore attended Northfield Mount Hermon School before matriculating at Cornell University.	James Whitman McLamore (May 30, 1926 – August 9, 1996) was co-founder of the Burger King fast food franchise with David Edgerton.	/m/06n867	David_Edgerton	114	128	/organization/organization_founder,/people/person
College Hunks Hauling Junk began operations in 2004 after founder Omar Soliman won $10,000 in the annual Leigh Rothschild Business Plan Contest. Upon graduating from the University of Miami, Soliman and partner Nick Friedman moved to Washington D.C. and expanded the company into a full-scale operation. In its first two years, the company hauled away more than 4000 tons of junk, and as of 2010 was hauling away an average of 10,000 tons each year.	Upon graduating from the University of Miami, Soliman and partner Nick Friedman moved to Washington D.C. and expanded the company into a full-scale operation.	/m/0kbhlmw	Nick_Friedman	66	79	/film/producer,/people/person
Despite being the developer of Tetris, Pajitnov did not receive royalties from his creation, as rights were owned by his employer, the Soviet government, which distributed it throughout the USSR and Eastern Europe. He only started to get royalties from his creation in 1996 when he and Henk Rogers formed The Tetris Company.	He only started to get royalties from his creation in 1996 when he and Henk Rogers formed The Tetris Company.	/m/02ckq6	Henk_Rogers	71	82	/people/person
