paragraph	sentence	mid	title	start	end	notable_types
Andrew Keen, a critic of Web 2.0, criticizes some of the Free Culture ideas in his book, Cult of the Amateur, hyperbolically describing Lessig as an "intellectual property communist".	Andrew Keen, a critic of Web 2.0, criticizes some of the Free Culture ideas in his book, Cult of the Amateur, hyperbolically describing Lessig as an "intellectual property communist".	/m/02pz0sv	Andrew_Keen	0	11	/book/author,/business/company_advisor,/film/person_or_entity_appearing_in_film,/people/person
Poe has become known for his commentary on Wikipedia following the publication of his article "The Hive" in The Atlantic Monthly in 2006. Poe's position on Wikipedia is that it's not an encyclopedia, but a repository of common knowledge. He argues that through a collaborative group,great things can be accomplished. He told Andrew Keen: "It’s more like a dictionary. It has the definition, a kind of rough description, of the way we talk about everything. It’s not expert knowledge, it’s common knowledge." In his essay, Poe talks about about how he went from two sentences to 2 paragraphs on his Wikipedia page.	He told Andrew Keen: "It’s more like a dictionary.	/m/02pz0sv	Andrew_Keen	8	19	/book/author,/business/company_advisor,/film/person_or_entity_appearing_in_film,/people/person
On 7 April 2008, Tegenlicht broadcasted a documentary called "Wiki's waarheid" ("The Truth according to Wikipedia"). In this episode the pros and cons of Wikipedia as well as other Web 2.0 websites were discussed by Jimmy Wales, Larry Sanger, Andrew Keen (writer), Charles Leadbeater (writer) and Robert McHenry (former editor-in-chief of the Encyclopædia Britannica). The "Wiki's waarheid" documentary was directed by IJsbrand van Veelen.	In this episode the pros and cons of Wikipedia as well as other Web 2.0 websites were discussed by Jimmy Wales, Larry Sanger, Andrew Keen (writer), Charles Leadbeater (writer) and Robert McHenry (former editor-in-chief of the Encyclopædia Britannica).	/m/02pz0sv	Andrew_Keen	126	137	/book/author,/business/company_advisor,/film/person_or_entity_appearing_in_film,/people/person
The current incarnation of PayPal is the result of a March 2000 merger between Confinity and X.com. Confinity was founded in December 1998 by Max Levchin, Peter Thiel, Luke Nosek, and Ken Howery, initially as a Palm Pilot payments and cryptography company. X.com was founded by Elon Musk in March 1999, initially as an Internet financial services company. Both Confinity and X.com launched their websites in late 1999. Both companies were located on University Avenue in Palo Alto. Confinity's website was initially focused on reconciling beamed payments from Palm Pilots and X.com's website initially featured financial services. Both services offered email payments as a feature.	Confinity was founded in December 1998 by Max Levchin, Peter Thiel, Luke Nosek, and Ken Howery, initially as a Palm Pilot payments and cryptography company.	/m/02q4204	Luke_Nosek	68	78	/business/board_member,/organization/organization_founder,/people/person,/venture_capital/venture_investor
Notable current members include: researcher Aubrey de Grey, nanotechnology pioneer Eric Drexler, engineer Keith Henson and his family, entrepreneur Saul Kent, inventor Ray Kurzweil, casino owner Don Laughlin,  film director Charles Matthau, Internet pioneer Ralph Merkle, Canadian businessman Robert Miller, MIT professor Marvin Minsky, futurists Max More/Natasha Vita-More, entrepreneur Luke Nosek, mathematician Edward O. Thorp, and computer security CEO Kenneth Weiss.	Notable current members include: researcher Aubrey de Grey, nanotechnology pioneer Eric Drexler, engineer Keith Henson and his family, entrepreneur Saul Kent, inventor Ray Kurzweil, casino owner Don Laughlin,  film director Charles Matthau, Internet pioneer Ralph Merkle, Canadian businessman Robert Miller, MIT professor Marvin Minsky, futurists Max More/Natasha Vita-More, entrepreneur Luke Nosek, mathematician Edward O. Thorp, and computer security CEO Kenneth Weiss.	/m/02q4204	Luke_Nosek	388	398	/business/board_member,/organization/organization_founder,/people/person,/venture_capital/venture_investor
Peter Andreas Thiel (German: ; born October 11, 1967) is a German-born American entrepreneur, venture capitalist, and hedge fund manager. Thiel co-founded PayPal with Max Levchin and served as its CEO. He currently serves as president of Clarium Capital, a global macro hedge fund with under $700 million in assets under management; a managing partner in Founders Fund, a $275 million venture capital fund that he launched with Ken Howery and Luke Nosek in 2005; and co-founder and investment committee chair of Mithril Capital Management. He was the first outside investor in Facebook, the popular social-networking site, with a 10.2% stake acquired in 2004 for $500,000, and sits on the company's board of directors. Thiel was ranked #293 on the Forbes 400 in 2011, with a net worth of $1.5 billion as of March 2012. Thiel lives in San Francisco, California.	He currently serves as president of Clarium Capital, a global macro hedge fund with under $700 million in assets under management; a managing partner in Founders Fund, a $275 million venture capital fund that he launched with Ken Howery and Luke Nosek in 2005; and co-founder and investment committee chair of Mithril Capital Management.	/m/02q4204	Luke_Nosek	241	251	/business/board_member,/organization/organization_founder,/people/person,/venture_capital/venture_investor
In 2005 Thiel created Founders Fund, a San Francisco based venture capital fund. Other partners in the fund include Sean Parker, Ken Howery, and Luke Nosek.	Other partners in the fund include Sean Parker, Ken Howery, and Luke Nosek.	/m/02q4204	Luke_Nosek	64	74	/business/board_member,/organization/organization_founder,/people/person,/venture_capital/venture_investor
In 2012, Thiel, along with PayPal co-founder Luke Nosek and Scott Banister, an early adviser and board member, put their support behind the Endorse Liberty Super PAC, alongside Internet advertising veteran Stephen Oskoui and entrepreneur Jeffrey Harmon, who founded Endorse Liberty in November 2011. Collectively Thiel et al. gave $3.9 million to Endorse Liberty, whose purpose was to promote Texas congressman Ron Paul for president in 2012. As of January 31, 2012 (2012-01-31), Endorse Liberty reported spending about $3.3 million promoting Paul by setting up two YouTube channels, buying ads from Google and Facebook and StumbleUpon, and building a presence on the Web.	In 2012, Thiel, along with PayPal co-founder Luke Nosek and Scott Banister, an early adviser and board member, put their support behind the Endorse Liberty Super PAC, alongside Internet advertising veteran Stephen Oskoui and entrepreneur Jeffrey Harmon, who founded Endorse Liberty in November 2011.	/m/02q4204	Luke_Nosek	45	55	/business/board_member,/organization/organization_founder,/people/person,/venture_capital/venture_investor
At the time of his death, the Foundation had raised £1.6 million. Donations totalling £156,000 were received by the Foundation in the 18 days following his death, and on 15 October 2009, it was announced that the Foundation had raised over £2 million, and that at the request of Robson's family, Alan Shearer would take over Robson's role as the Foundation's patron. It passed the £2.5 million mark in September 2010. Three other patrons were added in 2010, Steve Gibson, Mick Mills and Niall Quinn.	Three other patrons were added in 2010, Steve Gibson, Mick Mills and Niall Quinn.	/m/0cmdz0	Steve_Gibson_(businessman)	40	52	/people/person,/sports/sports_team_owner
The club's highest league finish to date was third in the 1913–14 season and they have only spent two seasons outside of the Football League's top two divisions. The club came close to folding in 1986 after experiencing severe financial difficulties before the club was saved by a consortium led by then board member and later chairman Steve Gibson. Middlesbrough were controversially deducted three points for failing to fulfil a fixture against Blackburn Rovers during the 1996–97 Premier League season and were subsequently relegated. They were promoted the following season and spent eleven consecutive seasons in the top division before relegation. Middlesbrough won the League Cup in 2004, the club's first and only major trophy. They reached the 2006 UEFA Cup Final in May 2006 but were beaten by Spanish side Sevilla. On 24 May 2009, Middlesbrough were relegated to the Championship, failing to extend their 11-year stay in the Premier League.	The club came close to folding in 1986 after experiencing severe financial difficulties before the club was saved by a consortium led by then board member and later chairman Steve Gibson.	/m/0cmdz0	Steve_Gibson_(businessman)	174	186	/people/person,/sports/sports_team_owner
The club experienced severe financial difficulties during the mid-1980s. Middlesbrough were dropping down the table, and finished nineteenth in the 1984–85 season. In April 1986 the club had to borrow £30,000 from the PFA to pay wages. The final game of the season saw Middlesbrough relegated to the Third Division once more. That summer, the club called in the Provisional Liquidator and shortly afterwards, the club was wound up and the gates to Ayresome Park were padlocked. Without the £350,000 capital required for Football League registration, a new rule, it seemed inevitable that the club would fold permanently. However, Steve Gibson, a member of the board at the time, brought together a consortium and with ten minutes to spare before the deadline, they completed their registration with the Football League for the 1986–87 season. Following the registration came both a change of club crest and a change of the official company name to Middlesbrough Football and Athletic Club (1986) Ltd.	However, Steve Gibson, a member of the board at the time, brought together a consortium and with ten minutes to spare before the deadline, they completed their registration with the Football League for the 1986–87 season.	/m/0cmdz0	Steve_Gibson_(businessman)	9	21	/people/person,/sports/sports_team_owner
Middlesbrough Football Club in the Community (MFCIC) was founded in 1995 by club chairman Steve Gibson and is the largest community-based football scheme in the United Kingdom. It is run separately from the football club but receives support from both the club in terms of providing players, staff, stadium facilities and PR in the matchday programme and other publications, as well as support from other local organisations.	Middlesbrough Football Club in the Community (MFCIC) was founded in 1995 by club chairman Steve Gibson and is the largest community-based football scheme in the United Kingdom.	/m/0cmdz0	Steve_Gibson_(businessman)	90	102	/people/person,/sports/sports_team_owner
In 2009, steel producer Corus Group announced the possibility that it would mothball its Teesside plant, with up to 4,000 employees and contractors facing redundancy, after a consortium of steel magnates walked away from a 10-year deal. Middlesbrough Football Club helped with the "Save Our Steel" campaign by hosting dozens of steel workers and their families as they marched around the ground, promoted the campaign via the stadium's PA system, scoreboards and in match day programmes, while players wore t-shirts during warm-ups promoting the campaign. Chairman Steve Gibson said:	Chairman Steve Gibson said:	/m/0cmdz0	Steve_Gibson_(businessman)	9	21	/people/person,/sports/sports_team_owner
Middlesbrough is home to the Championship football team, Middlesbrough F.C., owned by local haulage entrepreneur Steve Gibson. The club is based at the Riverside Stadium on the banks of the River Tees, where they have played since relocating from Ayresome Park, their home for 92 years until 1995. Founder members of the Premier League in 1992, Middlesbrough won the Football League Cup in 2004, and were beaten finalists in the 2005-06 UEFA Cup. In 1905 they made history with Britain's first £1,000 transfer when they signed Alf Common from local rivals Sunderland. Another league club, Middlesbrough Ironopolis F.C., was briefly based in the town in the late 19th century, but folded within a few years.	Middlesbrough is home to the Championship football team, Middlesbrough F.C., owned by local haulage entrepreneur Steve Gibson.	/m/0cmdz0	Steve_Gibson_(businessman)	113	125	/people/person,/sports/sports_team_owner
Some early season relegation worries saw Middlesbrough chairman Steve Gibson respond by installing former England boss Terry Venables as joint manager alongside Bryan Robson in December. This experiment with joint management paid off as Middlesbrough finished 14th to avoid the drop by a comfortable margin.	Some early season relegation worries saw Middlesbrough chairman Steve Gibson respond by installing former England boss Terry Venables as joint manager alongside Bryan Robson in December.	/m/0cmdz0	Steve_Gibson_(businessman)	64	76	/people/person,/sports/sports_team_owner
Despite these heroics, he made few appearances for Middlesbrough in the following season and in January 2007, Maccarone moved to Siena on a free transfer, signed a three-year contract. In February 2007, he made headlines by criticizing former Middlesbrough and then England manager Steve McClaren for his "ineptitude", causing his club's chairman Steve Gibson to call Maccarone "a fool".	In February 2007, he made headlines by criticizing former Middlesbrough and then England manager Steve McClaren for his "ineptitude", causing his club's chairman Steve Gibson to call Maccarone "a fool".	/m/0cmdz0	Steve_Gibson_(businessman)	162	174	/people/person,/sports/sports_team_owner
At the end of the 2000–01 season McClaren began looking for a managerial job, having decided his chances of succeeding Ferguson at Old Trafford were slim. With a positive reputation and closely linked with three Premier League vacancies, Middlesbrough chairman Steve Gibson won the race to appoint him after McClaren turned down Southampton and West Ham United. In his first season, Middlesbrough reached the FA Cup semi-final, knocking out his previous employers Manchester United en route, but lost 0–1 to Arsenal. They finished 12th in the league, a small improvement on the previous season's 14th-place finish. The following season bought another modest improvement, this time finishing eleventh.	With a positive reputation and closely linked with three Premier League vacancies, Middlesbrough chairman Steve Gibson won the race to appoint him after McClaren turned down Southampton and West Ham United.	/m/0cmdz0	Steve_Gibson_(businessman)	106	118	/people/person,/sports/sports_team_owner
Kamara was born in Middlesbrough, in north east England to a father of Sierra Leonean roots in 1957. Before starting his footballing career at Portsmouth in 1975 Kamara served with the Royal Navy. Chris remains a great friend of Middlesbrough chairman Steve Gibson with whom he grew up on Middlesbrough's Park End council estate. He and Gibson regularly attended matches together.	Chris remains a great friend of Middlesbrough chairman Steve Gibson with whom he grew up on Middlesbrough's Park End council estate.	/m/0cmdz0	Steve_Gibson_(businessman)	55	67	/people/person,/sports/sports_team_owner
In December 2011, Kamara was awarded the 'The Above & Beyond in Memory of Sir Bill Cotton award' for his contributions to Marie Curie Cancer Care. He, and a team of Football League ambassadors, including Brendan Rodgers, Aidy Boothroyd, and Middlesbrough Chairman Steve Gibson managed to raise £385,000 for the charity and to climb to the peak of Kilimanjaro. As well as being an Ambassador for Marie Curie Cancer Care, Kamara became an Ambassador of the Special Olympics Great Britain Organisation in April 2011 after taking part in the Special Olympics Unity Cup as a celebrity partner before the Germany v Argentina quarter-final match in Cape Town, during the 2010 World Cup. On 26 June 2012 Kamara was one of the runners of the Olympic torch in Doncaster.	He, and a team of Football League ambassadors, including Brendan Rodgers, Aidy Boothroyd, and Middlesbrough Chairman Steve Gibson managed to raise £385,000 for the charity and to climb to the peak of Kilimanjaro.	/m/0cmdz0	Steve_Gibson_(businessman)	117	129	/people/person,/sports/sports_team_owner
Smith joined Middlesbrough as a football consultant in July 2009. He joined the club to help Middlesbrough manager Gareth Southgate, who played under Smith during his time at Crystal Palace, with their bid to return to the Premier League following relegation. Southgate and chairman Steve Gibson discussed the matter in detail before the appointment, which sees Smith take a behind-the-scenes role, rather than being involved on the training pitch or in the dressing room.	Southgate and chairman Steve Gibson discussed the matter in detail before the appointment, which sees Smith take a behind-the-scenes role, rather than being involved on the training pitch or in the dressing room.	/m/0cmdz0	Steve_Gibson_(businessman)	23	35	/people/person,/sports/sports_team_owner
Middlesbrough were relegated from the Premiership after experiencing a unique season. They were on the losing side in both domestic cup finals and were relegated from the Premiership in 19th place, and had managed to finish in the last two of all three major English tournaments. But they would have avoided relegation had it not been for a 3-point deduction imposed in January as punishment for postponing a fixture against Blackburn Rovers within 24 hours of the scheduled kick-off. Chairman Steve Gibson had appealed against the ruling, protesting that too many players were ill or injured for the club to field a full team. But their appeal was rejected.	Chairman Steve Gibson had appealed against the ruling, protesting that too many players were ill or injured for the club to field a full team.	/m/0cmdz0	Steve_Gibson_(businessman)	9	21	/people/person,/sports/sports_team_owner
The first product called the IP Switch ATM 1600 was announced in March 1996 for US$46,000. Its switch used Asynchronous Transfer Mode (ATM) hardware combined with Internet Protocol routing. The company had a notable role in the development of the Multiprotocol Label Switching (MPLS) network protocol. The company published early proposals related to label switching, but did not manage to achieve the market share hoped for and was purchased for $120 million by Nokia in December 1997. The president at the time was Brian NeSmith, and it was located in Sunnyvale, California.	The president at the time was Brian NeSmith, and it was located in Sunnyvale, California.	/m/0d_2lk	Brian_NeSmith	30	43	/business/board_member,/people/person
FC Gold Pride was founded on 3 September 2008 as the seventh and final team to join the new top tier Women's Professional Soccer league. The team is owned by a group led by Brian and Nancy NeSmith, the former being the CEO of Sunnyvale-based internet technology company Blue Coat Systems. Former San Jose Clash midfielder and local youth coach Albertin Montoya was named the team's first head coach, while former CyberRays and Brazilian National Team player Sissi was announced as the first assistant coach for FC Gold Pride on 29 September 2008.	The team is owned by a group led by Brian and Nancy NeSmith, the former being the CEO of Sunnyvale-based internet technology company Blue Coat Systems.	/m/0d_2lk	Brian_NeSmith	36	41	/business/board_member,/people/person
