paragraph	sentence	mid	title	start	end	notable_types
An anniversary edition entitled All New Shooting Stars was shown on 30 December 2008, celebrating the 15th anniversary of Shooting Stars. Ulrika Jonsson returned as captain with Jack Dee as the replacement team captain. Matt Lucas also reprised his George Dawes character for the episode. Guests for the episode were Peter Jones, Kate Garraway, Christine Walkden, and Dizzee Rascal.	Guests for the episode were Peter Jones, Kate Garraway, Christine Walkden, and Dizzee Rascal.	/m/0b3450	Peter_Jones_(entrepreneur)	28	39	/film/actor,/film/person_or_entity_appearing_in_film,/people/person,/tv/tv_actor,/tv/tv_personality,/tv/tv_program_creator
In July 2008, the BBC confirmed that they had commissioned a one-off Christmas Special of Shooting Stars along with an additional "best-of" episode featuring interviews and outtakes, to mark the show's 15 year anniversary. Also confirmed were the return of Reeves, Mortimer and Matt Lucas (as George Dawes), and that the special would be produced by Pett Productions, Reeves and Mortimer's own production company. It was filmed at BBC Television Centre in London on 28 November 2008, and broadcast on BBC Two on 30 December 2008, along with the anniversary programme. Ulrika Jonsson returned as captain of Team B, with Jack Dee appearing as the new captain of Team A. Dizzee Rascal, Kate Garraway, Christine Walkden and Dragons' Den's Peter Jones were the guests.	Ulrika Jonsson returned as captain of Team B, with Jack Dee appearing as the new captain of Team A. Dizzee Rascal, Kate Garraway, Christine Walkden and Dragons' Den's Peter Jones were the guests.	/m/0b3450	Peter_Jones_(entrepreneur)	167	178	/film/actor,/film/person_or_entity_appearing_in_film,/people/person,/tv/tv_actor,/tv/tv_personality,/tv/tv_program_creator
Jessops Europe Limited, trading as Jessops, is a British photographic retailing company. It was founded in Leicester in 1935 by Frank Jessop and traded under the name of The Jessop Group Limited. The business entered administration on 9 January 2013 and all Jessops retail stores ceased trading on 11 January 2013 until the British entrepreneur Peter Jones invested several million pounds into the company and formed Jessops Europe Limited.	The business entered administration on 9 January 2013 and all Jessops retail stores ceased trading on 11 January 2013 until the British entrepreneur Peter Jones invested several million pounds into the company and formed Jessops Europe Limited.	/m/0b3450	Peter_Jones_(entrepreneur)	149	160	/film/actor,/film/person_or_entity_appearing_in_film,/people/person,/tv/tv_actor,/tv/tv_personality,/tv/tv_program_creator
Jessops Group Limited went into administration on 9 January 2013 with an application made to the High Court. On 11 January it was announced that all 187 stores would close, with the loss of 1,370 jobs. Shoppers who put anywhere up to £500 on a gift card, found them useless  and company ceased to accept customer returns although manufacturers' warranties on products not branded by Jessops were not affected.However, on 31 January 2013 the Jessops brand & various assets were acquired by entrepreneur Peter Jones, one of the investors from the television programme Dragons' Den. In early February the supermarket retailer Morrisons agreed to purchase seven of Jessops larger store sites from the administrators for an undisclosed price, to be converted to Morrisons convenience store format M Local	Shoppers who put anywhere up to £500 on a gift card, found them useless  and company ceased to accept customer returns although manufacturers' warranties on products not branded by Jessops were not affected.However, on 31 January 2013 the Jessops brand & various assets were acquired by entrepreneur Peter Jones, one of the investors from the television programme Dragons' Den.	/m/0b3450	Peter_Jones_(entrepreneur)	300	311	/film/actor,/film/person_or_entity_appearing_in_film,/people/person,/tv/tv_actor,/tv/tv_personality,/tv/tv_program_creator
Peter Jones formed Jessops Europe Limited and the retailer opened for business on 28th March 2013 and received a huge amount of media attention with TV & Media and consumers alike welcoming the re-launch of the iconic high street brand.Two stores in London and Birmingham reopened on 28 March and Manchester, Aberdeen, High Wycombe & St. Albans opened on 29th March 2013. A further 20 or more Jessops stores are set to reopen throughout April.	Peter Jones formed Jessops Europe Limited and the retailer opened for business on 28th March 2013 and received a huge amount of media attention with TV & Media and consumers alike welcoming the re-launch of the iconic high street brand.Two stores in London and Birmingham reopened on 28 March and Manchester, Aberdeen, High Wycombe & St. Albans opened on 29th March 2013.	/m/0b3450	Peter_Jones_(entrepreneur)	0	11	/film/actor,/film/person_or_entity_appearing_in_film,/people/person,/tv/tv_actor,/tv/tv_personality,/tv/tv_program_creator
Jessops online photo businesswas also purchased by Peter Jones along with CeWe Color& restructuring specialist Hilco.	Jessops online photo businesswas also purchased by Peter Jones along with CeWe Color& restructuring specialist Hilco.	/m/0b3450	Peter_Jones_(entrepreneur)	51	62	/film/actor,/film/person_or_entity_appearing_in_film,/people/person,/tv/tv_actor,/tv/tv_personality,/tv/tv_program_creator
The British entrepreneur Peter Jones invested £4 million into the company with a group of investors and is in the midst of opening up to 30 stores across the UK from 28 March 2013, aiming for a heavier online presence.	The British entrepreneur Peter Jones invested £4 million into the company with a group of investors and is in the midst of opening up to 30 stores across the UK from 28 March 2013, aiming for a heavier online presence.	/m/0b3450	Peter_Jones_(entrepreneur)	25	36	/film/actor,/film/person_or_entity_appearing_in_film,/people/person,/tv/tv_actor,/tv/tv_personality,/tv/tv_program_creator
Jessops Group Limited had 187 stores across the United Kingdom at the time of its collapse in early 2013. The new business formed by Peter Jones, Jessops Europe Limited, plans to open 30 stores across the UK. All the stores will contain mini-labs that offer one hour processing of photographic film or a 25-minute "express" service. The Jessopsmail order catalogue will be available free from the stores and will be released quarterly. The online stores www.jessops.com has opened for business again and Peter Jones confirmed that pricing will be the same online as it is in store which many believe is the future of retail.	The new business formed by Peter Jones, Jessops Europe Limited, plans to open 30 stores across the UK.	/m/0b3450	Peter_Jones_(entrepreneur)	27	38	/film/actor,/film/person_or_entity_appearing_in_film,/people/person,/tv/tv_actor,/tv/tv_personality,/tv/tv_program_creator
Jessops Group Limited had 187 stores across the United Kingdom at the time of its collapse in early 2013. The new business formed by Peter Jones, Jessops Europe Limited, plans to open 30 stores across the UK. All the stores will contain mini-labs that offer one hour processing of photographic film or a 25-minute "express" service. The Jessopsmail order catalogue will be available free from the stores and will be released quarterly. The online stores www.jessops.com has opened for business again and Peter Jones confirmed that pricing will be the same online as it is in store which many believe is the future of retail.	The online stores www.jessops.com has opened for business again and Peter Jones confirmed that pricing will be the same online as it is in store which many believe is the future of retail.	/m/0b3450	Peter_Jones_(entrepreneur)	68	79	/film/actor,/film/person_or_entity_appearing_in_film,/people/person,/tv/tv_actor,/tv/tv_personality,/tv/tv_program_creator
Jessops Group Limited had 187 stores across the United Kingdom at the time of its collapse in early 2013. The new business formed by Peter Jones, Jessops Europe Limited, plans to open 30 stores across the UK. All the stores will contain mini-labs that offer one hour processing of photographic film or a 25-minute "express" service. The Jessopsmail order catalogue will be available free from the stores and will be released quarterly. The online stores www.jessops.com has opened for business again and Peter Jones confirmed that pricing will be the same online as it is in store which many believe is the future of retail.	The new business formed by Peter Jones, Jessops Europe Limited, plans to open 30 stores across the UK.	/m/0b3450	Peter_Jones_(entrepreneur)	27	38	/film/actor,/film/person_or_entity_appearing_in_film,/people/person,/tv/tv_actor,/tv/tv_personality,/tv/tv_program_creator
Jessops Group Limited had 187 stores across the United Kingdom at the time of its collapse in early 2013. The new business formed by Peter Jones, Jessops Europe Limited, plans to open 30 stores across the UK. All the stores will contain mini-labs that offer one hour processing of photographic film or a 25-minute "express" service. The Jessopsmail order catalogue will be available free from the stores and will be released quarterly. The online stores www.jessops.com has opened for business again and Peter Jones confirmed that pricing will be the same online as it is in store which many believe is the future of retail.	The online stores www.jessops.com has opened for business again and Peter Jones confirmed that pricing will be the same online as it is in store which many believe is the future of retail.	/m/0b3450	Peter_Jones_(entrepreneur)	68	79	/film/actor,/film/person_or_entity_appearing_in_film,/people/person,/tv/tv_actor,/tv/tv_personality,/tv/tv_program_creator
The company was founded by Kiichiro Toyoda in 1937 as a spinoff from his father's company Toyota Industries to create automobiles. Three years earlier, in 1934, while still a department of Toyota Industries, it created its first product, the Type A engine, and, in 1936, its first passenger car, the Toyota AA. Toyota Motor Corporation group companies are Toyota (including the Scion brand), Lexus, Daihatsu, and Hino Motors, along with several "nonautomotive" companies. TMC is part of the Toyota Group, one of the largest conglomerates in the world.	The company was founded by Kiichiro Toyoda in 1937 as a spinoff from his father's company Toyota Industries to create automobiles.	/m/0cgg07	Kiichiro_Toyoda	27	42	/organization/organization_founder,/people/deceased_person,/people/family_member,/people/person
Toyota was started in 1933 as a division of Toyoda Automatic Loom Works devoted to the production of automobiles under the direction of the founder's son, Kiichiro Toyoda. Its first vehicles were the A1 passenger car and the G1 in 1935. The Toyota Motor Co. was established as an independent company in 1937. In 2008, Toyota's sales surpassed General Motors, making Toyota number one in the world.	Toyota was started in 1933 as a division of Toyoda Automatic Loom Works devoted to the production of automobiles under the direction of the founder's son, Kiichiro Toyoda.	/m/0cgg07	Kiichiro_Toyoda	155	170	/organization/organization_founder,/people/deceased_person,/people/family_member,/people/person
Vehicles were originally sold under the name "Toyoda" (トヨダ), from the family name of the company's founder, Kiichirō Toyoda. In April 1936, Toyoda's first passenger car, the Model AA, was completed. The sales price was 3,350 yen, 400 yen cheaper than Ford or GM cars.	Vehicles were originally sold under the name "Toyoda" (トヨダ), from the family name of the company's founder, Kiichirō Toyoda.	/m/0cgg07	Kiichiro_Toyoda	108	123	/organization/organization_founder,/people/deceased_person,/people/family_member,/people/person
Toyota's development of ideas that later became Lean may have started at the turn of the 20th century with Sakichi Toyoda, in a textile factory with looms that stopped themselves when a thread broke, this became the seed of autonomation and Jidoka. Toyota's journey with JIT may have started back in 1934 when it moved from textiles to produce its first car. Kiichiro Toyoda, founder of Toyota Motor Corporation, directed the engine casting work and discovered many problems in their manufacture. He decided he must stop the repairing of poor quality by intense study of each stage of the process. In 1936, when Toyota won its first truck contract with the Japanese government, his processes hit new problems and he developed the "Kaizen" improvement teams.	Kiichiro Toyoda, founder of Toyota Motor Corporation, directed the engine casting work and discovered many problems in their manufacture.	/m/0cgg07	Kiichiro_Toyoda	0	15	/organization/organization_founder,/people/deceased_person,/people/family_member,/people/person
Eiji Toyoda studied engineering at Tokyo Imperial University from 1933 to 1936. During this time Toyoda's cousin Kiichiro established an automobile plant at the Toyoda Automatic Loom Works in the city of Nagoya in central Japan. Toyoda joined his cousin in the plant at the conclusion of his degree and throughout their lives they shared a deep friendship. In 1938, Kiichiro Toyoda asked Eiji Toyoda to oversee construction of a newer factory about 32 km east of Nagoya on the site of a red pine forest in the town of Koromo, later renamed Toyota City. Known as the Honsha ("headquarters") plant, to this day it is considered the "mother factory" for Toyota Motor production facilities worldwide.	During this time Toyoda's cousin Kiichiro established an automobile plant at the Toyoda Automatic Loom Works in the city of Nagoya in central Japan.	/m/0cgg07	Kiichiro_Toyoda	33	41	/organization/organization_founder,/people/deceased_person,/people/family_member,/people/person
Eiji Toyoda studied engineering at Tokyo Imperial University from 1933 to 1936. During this time Toyoda's cousin Kiichiro established an automobile plant at the Toyoda Automatic Loom Works in the city of Nagoya in central Japan. Toyoda joined his cousin in the plant at the conclusion of his degree and throughout their lives they shared a deep friendship. In 1938, Kiichiro Toyoda asked Eiji Toyoda to oversee construction of a newer factory about 32 km east of Nagoya on the site of a red pine forest in the town of Koromo, later renamed Toyota City. Known as the Honsha ("headquarters") plant, to this day it is considered the "mother factory" for Toyota Motor production facilities worldwide.	In 1938, Kiichiro Toyoda asked Eiji Toyoda to oversee construction of a newer factory about 32 km east of Nagoya on the site of a red pine forest in the town of Koromo, later renamed Toyota City.	/m/0cgg07	Kiichiro_Toyoda	9	17	/organization/organization_founder,/people/deceased_person,/people/family_member,/people/person
The area was a major producer of silk and prospered from the Meiji period through the Taishō periods. As the demand for raw silk declined in Japan and abroad, Koromo entered a period of gradual decline after 1930. The decline encouraged Kiichiro Toyoda, cousin of Eiji Toyoda, to look for alternatives to the family's automatic loom manufacturing business. The search led to the founding of what became the Toyota Motor Corporation.	The decline encouraged Kiichiro Toyoda, cousin of Eiji Toyoda, to look for alternatives to the family's automatic loom manufacturing business.	/m/0cgg07	Kiichiro_Toyoda	23	38	/organization/organization_founder,/people/deceased_person,/people/family_member,/people/person
Originally called "just-in-time production," it builds on the approach created by the founder of Toyota, Sakichi Toyoda, his son Kiichiro Toyoda, and the engineer Taiichi Ohno. The principles underlying the TPS are embodied in The Toyota Way.	Originally called "just-in-time production," it builds on the approach created by the founder of Toyota, Sakichi Toyoda, his son Kiichiro Toyoda, and the engineer Taiichi Ohno.	/m/0cgg07	Kiichiro_Toyoda	129	144	/organization/organization_founder,/people/deceased_person,/people/family_member,/people/person
