paragraph	sentence	mid	title	start	end	notable_types
Clemens Wilmenrod (July 24, 1906 – April 12, 1967) was the first German television cook. His pseudonym was derived from the municipality Willmenrod in the Westerwald region, where he was born as Karl Clemens Hahn. Wilmenrod is considered the inventor of Toast Hawaii, "Arabian riders' meat" and "stuffed strawberry". He is also credited with making Rumtopf popular in Southern and Western Germany, and with introducing turkey as a typical Christmas dinner.	He is also credited with making Rumtopf popular in Southern and Western Germany, and with introducing turkey as a typical Christmas dinner.	/m/04whmc	Rumtopf	32	39	/food/food
As an appetizer and dip, hummus is scooped with flatbread, such as pita. It is also served as part of a meze or as an accompaniment to falafel, grilled chicken, fish or eggplant. Garnishes include chopped tomato, cucumber, coriander, parsley, caramelized onions, sautéed mushrooms, whole chickpeas, olive oil, hard-boiled eggs, paprika, sumac, ful, olives, pickles and pine nuts (as photographed in the "History" section). Outside the Middle East, it is sometimes served with tortilla chips or crackers.	Outside the Middle East, it is sometimes served with tortilla chips or crackers.	/m/03rv52	Tortilla_chip	53	67	/food/food
Corn tortillas may also be deep fried to make crisp tortilla chips. These are often salted, and can be eaten alone or accompanied with various salsas and dips such as guacamole. Tortilla chips are a key ingredient in nachos.	Corn tortillas may also be deep fried to make crisp tortilla chips.	/m/03rv52	Tortilla_chip	52	66	/food/food
They can also be an appetizer, cut into small triangles to dip into salsa, guacamole, or beans. This version of the tostada has its origins in New Mexican and Tex-Mex cuisine. Tortilla chips, commercially known as nachos, are served with salsa or chile con queso.	Tortilla chips, commercially known as nachos, are served with salsa or chile con queso.	/m/03rv52	Tortilla_chip	0	14	/food/food
Doritos /dɵˈriːtoʊz/ (literally, from Mexican Spanish doradito or dorito: "turned golden or crisp") is a brand of seasoned tortilla chips produced since 1964 by the North American food company Frito-Lay (a wholly owned subsidiary of PepsiCo, Inc.).	Doritos /dɵˈriːtoʊz/ (literally, from Mexican Spanish doradito or dorito: "turned golden or crisp") is a brand of seasoned tortilla chips produced since 1964 by the North American food company Frito-Lay (a wholly owned subsidiary of PepsiCo, Inc.).	/m/03rv52	Tortilla_chip	123	137	/food/food
Tex-Mex cuisine is characterized by its heavy use of melted cheese, meat (particularly beef), beans, and spices, in addition to corn or flour tortillas. Chili con carne, crispy chalupas, chili con queso, enchiladas, and fajitas are all Tex-Mex inventions. A common feature of Tex-Mex is the combination plate, with several of the above on one large platter. Serving tortilla chips and a hot sauce or salsa as an appetizer is also an original Tex-Mex invention. Cabrito, barbacoa, carne seca, and other products of cattle culture have been common in the ranching cultures of South Texas and Northern Mexico. In the 20th century, Tex-Mex took on Americanized elements such as yellow cheese, as goods from the United States became cheap and readily available. Moreover, Tex-Mex has imported flavors from other spicy cuisines, such as the use of cumin.	Serving tortilla chips and a hot sauce or salsa as an appetizer is also an original Tex-Mex invention.	/m/03rv52	Tortilla_chip	8	22	/food/food
In the US, refried beans are most commonly made from pinto beans. They are served as a side dish with most Tex-Mex restaurant meals. They also have become very popular as a dip for corn tortilla chips. Refried beans are also a primary ingredient in many tostada, chimichanga, and pupusa recipes. In addition, they are a typical ingredient in layered dips, such as 7 layer dip, in nachos, and are especially implied when a dish is referred to as nachos grande or burrito grande.	They also have become very popular as a dip for corn tortilla chips.	/m/03rv52	Tortilla_chip	53	67	/food/food
Nachos are a popular food based on nixtamalized corn, of Mexican origin associated with Tex-Mex cuisine that can be either made quickly to serve as a snack or prepared with more ingredients to make a full meal. In their simplest form, nachos are tortilla chips (totopos) covered in nacho cheese or shredded cheese and/or salsa. First created circa 1943 by Ignacio "Nacho" Anaya, the original nachos consisted of fried corn tortillas covered with melted cheddar cheese and sliced jalapeño peppers.	In their simplest form, nachos are tortilla chips (totopos) covered in nacho cheese or shredded cheese and/or salsa.	/m/03rv52	Tortilla_chip	35	49	/food/food
A similar dish that involves tortilla chips and cheese is found in Tex-Mex restaurants. Small bowls of chili con queso and/or, more commonly, salsa, are served with baskets of warm tortilla chips as appetizers.	A similar dish that involves tortilla chips and cheese is found in Tex-Mex restaurants.	/m/03rv52	Tortilla_chip	29	43	/food/food
A similar dish that involves tortilla chips and cheese is found in Tex-Mex restaurants. Small bowls of chili con queso and/or, more commonly, salsa, are served with baskets of warm tortilla chips as appetizers.	Small bowls of chili con queso and/or, more commonly, salsa, are served with baskets of warm tortilla chips as appetizers.	/m/03rv52	Tortilla_chip	93	107	/food/food
One of the main concerns the FDA had about olestra was it might encourage consumers to eat more of the "top of the pyramid" foods due to the perception of its being healthier. This could result in consumers engaging in over-consumption, thinking the addition of olestra would remove negative consequences. In light of this fact, approving it as an additive would have meant consumers would be consuming a food with a relatively high amount of an additive, whose long-term health effects were not documented. This made the FDA particularly hesitant to approve the product, as well as the side effects, such as diarrhea, and concern for the loss of fat-soluble vitamins. In August 1990, P&G narrowed their focus to "savory snacks", potato chips, tortilla chips, crackers and similar foods.	In August 1990, P&G narrowed their focus to "savory snacks", potato chips, tortilla chips, crackers and similar foods.	/m/03rv52	Tortilla_chip	75	89	/food/food
Green sauces are common in Mexican cuisine. The basis of the green sauce (known as salsa verde) is typically pureed cooked or raw tomatillos, with jalapeños or other chili peppers, white onion, cilantro, and sometimes lime added to taste. Salsa verde can range in spiciness from mild to mouth-searing. It may be warm, as in a chile verde, or cold, as a condiment. In Mexican cuisine, a green sauce is frequently used as a dip for tortilla chips and served with tacos, grilled pork, grilled meats and even fish.	In Mexican cuisine, a green sauce is frequently used as a dip for tortilla chips and served with tacos, grilled pork, grilled meats and even fish.	/m/03rv52	Tortilla_chip	66	80	/food/food
Potato chip flavors available in the United States include the flagship Regular flavor, as well as Sour Cream & Onion, Cheddar & Sour Cream, Dill Pickle, Bar-B-Q, and Onion & Garlic. In addition, Ripples Chips are available in Original, French, Mesquite Bar-B-Q, and Loaded Spud varieties. On February 4, 2008, Mexican Chili and Au Gratin were reintroduced back to Canada. Other products include Dutch Crunch kettle-cooked chips, cheese puffs, Puffcorn (puffed corn twists), Restaurante Style tortilla chips, pretzels, dips and salsas, and beef jerky.	Other products include Dutch Crunch kettle-cooked chips, cheese puffs, Puffcorn (puffed corn twists), Restaurante Style tortilla chips, pretzels, dips and salsas, and beef jerky.	/m/03rv52	Tortilla_chip	120	134	/food/food
The MexiDips & Chips is a bed of tortilla chips with two fried corn tortilla bowls. For dine-in orders, one bowl contains queso, one holds refried pinto beans, and there are 2 scoops of fresh guacamole on the side. For carry-out, the guacamole goes in one of the tortilla bowls and the cheese is in a plastic container with a lid to prevent spillage.	The MexiDips & Chips is a bed of tortilla chips with two fried corn tortilla bowls.	/m/03rv52	Tortilla_chip	33	47	/food/food
Mucho Nachos is a bed of corn tortilla chips topped with refried beans, ground beef or grilled chicken, chili sauce, tomatoes, and sour cream.	Mucho Nachos is a bed of corn tortilla chips topped with refried beans, ground beef or grilled chicken, chili sauce, tomatoes, and sour cream.	/m/03rv52	Tortilla_chip	25	44	/food/food
Tostitos is a brand of tortilla chips and (more recently) dips produced by Frito-Lay. In January 1978 Frito-Lay's product development group led by Jack Liczkowski had completed development of TOSTITOS, authentic Mexican-style tortilla chips. The chips were round, made of white corn and had a more authentic "Mexican" flavor. Part of achieving this authenticity occurred after research discovered that Mexicans, after cooking corn with lime, did not rinse the corn completely; therefore, the resulting stone ground corn masa has higher content of lime and lower pH. When deep fat frying the formed chips, calcium hydroxide reacts with oil and gives this specific taste. After successful test marketing in 1979, Tostitos Traditional Flavor and Tostitos Nacho Cheese Flavor went in 1980 into national distribution in the United States and have reached the sales of $140 million, making it one of the most successful new product introductions in Frito-Lay history. The chips are about 1 ⅓ of an inch in diameter and are often eaten with salsa or nacho cheese dip, which the company also produces.	Tostitos is a brand of tortilla chips and (more recently) dips produced by Frito-Lay.	/m/03rv52	Tortilla_chip	23	37	/food/food
Tostitos is a brand of tortilla chips and (more recently) dips produced by Frito-Lay. In January 1978 Frito-Lay's product development group led by Jack Liczkowski had completed development of TOSTITOS, authentic Mexican-style tortilla chips. The chips were round, made of white corn and had a more authentic "Mexican" flavor. Part of achieving this authenticity occurred after research discovered that Mexicans, after cooking corn with lime, did not rinse the corn completely; therefore, the resulting stone ground corn masa has higher content of lime and lower pH. When deep fat frying the formed chips, calcium hydroxide reacts with oil and gives this specific taste. After successful test marketing in 1979, Tostitos Traditional Flavor and Tostitos Nacho Cheese Flavor went in 1980 into national distribution in the United States and have reached the sales of $140 million, making it one of the most successful new product introductions in Frito-Lay history. The chips are about 1 ⅓ of an inch in diameter and are often eaten with salsa or nacho cheese dip, which the company also produces.	In January 1978 Frito-Lay's product development group led by Jack Liczkowski had completed development of TOSTITOS, authentic Mexican-style tortilla chips.	/m/03rv52	Tortilla_chip	140	154	/food/food
A dip or dipping sauce is a common condiment for many types of food. Dips are used to add flavor or texture to a food, such as pita bread, dumplings, crackers, cut-up raw vegetables, seafood, cubed pieces of meat and cheese, potato chips, tortilla chips, and falafel. Unlike other sauces, instead of applying the sauce to the food, the food is typically put, dipped, or added into the dipping sauce (hence the name). Dips are commonly used for finger foods, appetizers, and other easily held foods. Thick dips based on sour cream, crème fraiche, milk, yogurt, mayonnaise, soft cheese, or beans are a staple of American hors d'oeuvres and are thinner than spreads which can be thinned to make dips. Alton Brown suggests that a dip is defined based on its ability to "maintain contact with its transport mechanism over three feet of white carpet".	Dips are used to add flavor or texture to a food, such as pita bread, dumplings, crackers, cut-up raw vegetables, seafood, cubed pieces of meat and cheese, potato chips, tortilla chips, and falafel.	/m/03rv52	Tortilla_chip	170	184	/food/food
CC's (pronounced cee-cees) is a brand of flavoured tortilla chips created by Snack Foods Limited and produced since the early 1980s by the Australian food company Snack Brands Australia (a division of The Real McCoy Snackfood Co.). CC's are predominantly sold in Australia and come in assorted flavors. CC's were also sold in New Zealand until Bluebird Foods (the owner of the CC's brand in New Zealand) decided to bring in the American brand Doritos in March 2010. The chips are made of ground corn, vegetable oil, and seasoning. The full ingredients list is Vegetable Oils (Sunflower, Palmolein), Milk Solids (Cheese Powder), Food Acids (270, 330, 331), Flavour Enhancers (621, 627, 631), Starch (Wheat, Maize), Vegetable Powders (Onion, Tomato, Garlic), Salt, Sugar, Yeast Extract, Herb, Spice (Cumin), Flavour (Natural & Nature Identical), Yeast Extract, Vegetable Extract (Soy, Wheat), Antioxidants (304, 306).	CC's (pronounced cee-cees) is a brand of flavoured tortilla chips created by Snack Foods Limited and produced since the early 1980s by the Australian food company Snack Brands Australia (a division of The Real McCoy Snackfood Co.).	/m/03rv52	Tortilla_chip	51	65	/food/food
While American-style corn chips and tortilla chips are both made from corn, the corn in tortilla chips is subjected to the nixtamalization process, resulting in a milder flavor and aroma, and a less rigid texture. Tortilla chips also tend to be larger, thinner, and less salty than American-style corn chips.	While American-style corn chips and tortilla chips are both made from corn, the corn in tortilla chips is subjected to the nixtamalization process, resulting in a milder flavor and aroma, and a less rigid texture.	/m/03rv52	Tortilla_chip	36	50	/food/food
Torengos was a brand of tortilla chip snack produced by Procter & Gamble. It was introduced in December 2001, after more than two years of research. As of 2007, the Procter & Gamble website indicates that the product is no longer available.	Torengos was a brand of tortilla chip snack produced by Procter & Gamble.	/m/03rv52	Tortilla_chip	24	37	/food/food
Don Tacos (ドンタコス, Don Takosu?) is a Japanese snack food manufactured by Koikeya. It is a tortilla chip that comes in four flavours: Mexican Chili, Seafood, Super Hot Chili, and Rich Butter Grilled Corn. Don Tacos is sold in 78-95 gram bags, in 47 gram cups that include dipping sauce, and in 50 gram boxes for supermarkets with dipping sauce. The cups come with either BBQ sauce or ketchup sauce, and the boxes come with either hamburger sauce or ketchup dipping sauce.	It is a tortilla chip that comes in four flavours: Mexican Chili, Seafood, Super Hot Chili, and Rich Butter Grilled Corn.	/m/03rv52	Tortilla_chip	8	21	/food/food
Kettle Foods is an international manufacturer of potato chips, tortilla chips, and nut butters based in Salem, Oregon, United States, with a European and Middle East headquarters in Norwich, United Kingdom. As of 2006 they are the largest natural potato chip brand in the U.S. The company, founded in 1978 by Cameron Healy, has been owned by Diamond Foods since 2010.	Kettle Foods is an international manufacturer of potato chips, tortilla chips, and nut butters based in Salem, Oregon, United States, with a European and Middle East headquarters in Norwich, United Kingdom.	/m/03rv52	Tortilla_chip	63	77	/food/food
The Justice Friends: Pain in the Mouth: Krunk gets a tortilla chip stuck in his tooth, and Major Glory decides to fix it by pulling the tooth out himself.	The Justice Friends: Pain in the Mouth: Krunk gets a tortilla chip stuck in his tooth, and Major Glory decides to fix it by pulling the tooth out himself.	/m/03rv52	Tortilla_chip	53	66	/food/food
The taco salad also takes a twist in many American homes. Instead of using a tortilla or a bowl of Spanish rice as a base, the meal is based on top of crushed tortilla chips, making the dish similar to the Mexican dish of nachos, with the addition of lettuce and unmelted cheese.	Instead of using a tortilla or a bowl of Spanish rice as a base, the meal is based on top of crushed tortilla chips, making the dish similar to the Mexican dish of nachos, with the addition of lettuce and unmelted cheese.	/m/03rv52	Tortilla_chip	101	115	/food/food
Totopo, in Mexican cuisine, is a flat, round, or triangular corn product similar to a tortilla, but prepared with ground black beans in nixtamalized corn masa. Totopos are best known as originating from Zapotec peoples of the isthmus of Tehuantepec region of the Mexican state of Oaxaca. There, the Zapotec women bake totopos in a clay oven known as a comixcal. Totopos resemble a round, baked tortilla chip or certain types of Scandinavian flat bread, however, unlike tortillas, salt is added to the masa and holes are made in the disk prior to baking.	Totopos resemble a round, baked tortilla chip or certain types of Scandinavian flat bread, however, unlike tortillas, salt is added to the masa and holes are made in the disk prior to baking.	/m/03rv52	Tortilla_chip	32	45	/food/food
Some episodes are produced to coincide with certain events. For example, three episodes aired during the weekend of Super Bowl XLI. Because of trademark restrictions, the words "Super Bowl" were substituted with other words such as "Super Sunday," "The Big Game" or "That Last Football Game." The first episode had Dickson blend a smoothie out of salsa, tortilla chips, Buffalo wings and some Budweiser. The second and third episodes used two blenders to predict the outcome of the Super Bowl by blending miniature helmets (AFC vs. NFC) and foam footballs (Indianapolis Colts vs. Chicago Bears). To coincide with the release of the film Transformers, Dickson blended the Transformers toys Bumblebee and Swindle before challenging two of his grandchildren to transform the remains. When Dickson learned that The Beach Boys did not win Esquire Magazine's 2007 Esky Award, he blended the trophy. He also blended the music/rhythm video game Guitar Hero III: Legends of Rock after finding no Beach Boys in it, and the first-person shooter Halo 3 after two of his grandchildren beat him in a multiplayer game. To celebrate the release of Weezer's 2008 album, Dickson blended a copy of the CD with a can of pork and beans (a reference to the album's first single, as Will It Blend? is among the internet memes referenced in the song's video). Dickson also blended the Wii Wheel after breaking it during a game of Mario Kart Wii, and a Grand Theft Auto IV disc because the 1968 Mustang GT 390 (like in Bullitt) was not included in the game. His other notable blends include blending various gadgets, and blending Justin Bieber's music CD, along with DVD of his movie and his action figure, followed by action figures of teenage girls and a unicorn. While blending it, Tom sarcastically describes Bieber as "legendary" and adds that no legendary music artist is actually legendary without being blended.	" The first episode had Dickson blend a smoothie out of salsa, tortilla chips, Buffalo wings and some Budweiser.	/m/03rv52	Tortilla_chip	63	77	/food/food
Sterzing's ships potato chips ships both nationwide and worldwide. International shipping originally began during the Vietnam War when servicemen from Southeast Iowa requested the brand of chips they grew up eating. Since then international shipments have branched out and expanded with destinations as diverse as Europe, the Middle East and Egypt. With the addition of an online store within the last decade, they are able to stay a small town business while offering dedicated customers the opportunity to continue purchasing their chips from anywhere. In 1984, Sterzings began making tortilla chips, followed by a line of dips, and salsas.	In 1984, Sterzings began making tortilla chips, followed by a line of dips, and salsas.	/m/03rv52	Tortilla_chip	32	46	/food/food
Wise Foods, Inc. is a company based in Berwick, Pennsylvania, that makes and sells snacks through retail food outlets in 15 eastern seaboard states, as well as Vermont, Ohio, West Virginia, Kentucky, Tennessee, and Washington, D.C. Best known for its potato chips which come in several varieties, including jalapeno, unsalted, wavy, and all-natural under the Kettle Cooked label—Wise also offers Cheez Doodles, varieties of bagged popcorn, tortilla chips, pork rinds, Cheez Waffies, onion rings, Dipsy Doodle chips, Nacho Twisters, Quinlan brand pretzels, and French onion and nacho cheese dips. Their production workers are represented by UFCW Local 1776.	Wise Foods, Inc. is a company based in Berwick, Pennsylvania, that makes and sells snacks through retail food outlets in 15 eastern seaboard states, as well as Vermont, Ohio, West Virginia, Kentucky, Tennessee, and Washington, D.C. Best known for its potato chips which come in several varieties, including jalapeno, unsalted, wavy, and all-natural under the Kettle Cooked label—Wise also offers Cheez Doodles, varieties of bagged popcorn, tortilla chips, pork rinds, Cheez Waffies, onion rings, Dipsy Doodle chips, Nacho Twisters, Quinlan brand pretzels, and French onion and nacho cheese dips.	/m/03rv52	Tortilla_chip	440	454	/food/food
Mexican maize tortillas are commonly eaten throughout the western world as tortilla chips, and are an essential ingredient in many popular Mexican dishes, such as enchiladas, tostadas, and flautas. Tacos, while usually made with maize tortillas in Mexico, are made with either maize or wheat tortillas in other places that make Mexican-style or Tex-Mex food.	Mexican maize tortillas are commonly eaten throughout the western world as tortilla chips, and are an essential ingredient in many popular Mexican dishes, such as enchiladas, tostadas, and flautas.	/m/03rv52	Tortilla_chip	75	89	/food/food
The idea for Maggie's Organics began with an Organic Tortilla chip. The founders worked in the organic food industry, selling both blue and yellow corn tortilla chips, when one of their farmers recommended adding cotton to the crop rotation to improve the quality of the corn. Organic farmers often use crop rotation as a way to improve crop yields without chemicals. His experiment worked. However, his cotton yielded a crop that then became the possession of the founders who had no venue to sell it.	The idea for Maggie's Organics began with an Organic Tortilla chip.	/m/03rv52	Tortilla_chip	53	66	/food/food
Their most well known product are various potato chips, branded as "Maarud Potetgull" (lit. 'potato gold'), but the company also produces other foods such as tortilla chips, peanuts, and popcorn. The company also has branches in Sweden, Finland and the Baltic states under the names "Estrella" and "Taffel" (in Lithuania).	'potato gold'), but the company also produces other foods such as tortilla chips, peanuts, and popcorn.	/m/03rv52	Tortilla_chip	66	80	/food/food
In Tex-Mex restaurants, this dish is sometimes confused or conflated with chili con queso, a cheese sauce served with tortilla chips for dipping. The term queso fundido also refers to processed cheese and is defined as such in the Spanish version of Codex Alimentarius.	In Tex-Mex restaurants, this dish is sometimes confused or conflated with chili con queso, a cheese sauce served with tortilla chips for dipping.	/m/03rv52	Tortilla_chip	118	132	/food/food
Casa Sanchez is a Mexican-style salsa and tortilla chip company based in San Francisco, California. Beginning in the 1920s as a tortilla manufacturer in the Mission District of San Francisco, then evolving into a salsa company in the 1960s. Casa Sanchez has grown to become one of the leaders in the Mexican-style snacks market. During 1999, the company launched a unique food give-away promotion involving a Neil Armstrong type event which inspired its corporate logo.	Casa Sanchez is a Mexican-style salsa and tortilla chip company based in San Francisco, California.	/m/03rv52	Tortilla_chip	42	55	/food/food
In 1988, the company increased its plant size again. This growth continued through the 1990s and included the addition of a second continuous fryer, two hand-kettle fryers that featured automatic stirring systems (among the very first manufactured in all of the United States), computerized combination weighers, state-of-the-snack equipment for tortilla chips and cheese curls, and an additional 100,000 square feet of space.	This growth continued through the 1990s and included the addition of a second continuous fryer, two hand-kettle fryers that featured automatic stirring systems (among the very first manufactured in all of the United States), computerized combination weighers, state-of-the-snack equipment for tortilla chips and cheese curls, and an additional 100,000 square feet of space.	/m/03rv52	Tortilla_chip	293	307	/food/food
