paragraph	sentence	mid	title	start	end	notable_types
Watterson defends what Calvin's parents do, remarking that in the case of parenting a kid like Calvin, "I think they do a better job than I would." Calvin's father is overly concerned with "character building" activities in a number of strips, either in the things he makes Calvin do or in the masochistic eccentricities of his own lifestyle. For example, Calvin's father is shown coming home from an early morning run in the snow, which he follows with a bowl of plain oatmeal.	For example, Calvin's father is shown coming home from an early morning run in the snow, which he follows with a bowl of plain oatmeal.	/m/01bf_1	Oatmeal	127	134	/base/breakfast/breakfast_cereal_style,/food/food,/food/ingredient,/medicine/condition_prevention_factors,/medicine/drug,/medicine/drug_ingredient,/medicine/medical_treatment
Maple syrup is often eaten with pancakes, waffles, French toast, or oatmeal and porridge. It is also used as an ingredient in baking, and as a sweetener or flavouring agent. Culinary experts have praised its unique flavour, although the chemistry responsible is not fully understood.	Maple syrup is often eaten with pancakes, waffles, French toast, or oatmeal and porridge.	/m/01bf_1	Oatmeal	68	75	/base/breakfast/breakfast_cereal_style,/food/food,/food/ingredient,/medicine/condition_prevention_factors,/medicine/drug,/medicine/drug_ingredient,/medicine/medical_treatment
They sometimes also have lids to cover the sand when not in use, so that passing animals cannot contaminate the sand by urinating or defecating in it. Having lids also prevents the sand in outdoor sandpits from getting wet when it rains, although some dampness is often desirable as it helps the sand hold together. Prefabricated sandpits may also be used indoors, especially in day care facilities. Materials other than sand are also often used, such as oatmeal, which are necessarily non-toxic and light enough to easily vacuum away.	Materials other than sand are also often used, such as oatmeal, which are necessarily non-toxic and light enough to easily vacuum away.	/m/01bf_1	Oatmeal	55	62	/base/breakfast/breakfast_cereal_style,/food/food,/food/ingredient,/medicine/condition_prevention_factors,/medicine/drug,/medicine/drug_ingredient,/medicine/medical_treatment
Some other foods rich in thiamine are oatmeal, flax, and sunflower seeds, brown rice, whole grain rye, asparagus, kale, cauliflower, potatoes, oranges, liver (beef, pork, and chicken), and eggs.	Some other foods rich in thiamine are oatmeal, flax, and sunflower seeds, brown rice, whole grain rye, asparagus, kale, cauliflower, potatoes, oranges, liver (beef, pork, and chicken), and eggs.	/m/01bf_1	Oatmeal	38	45	/base/breakfast/breakfast_cereal_style,/food/food,/food/ingredient,/medicine/condition_prevention_factors,/medicine/drug,/medicine/drug_ingredient,/medicine/medical_treatment
Vegetarian diets typically contain similar levels of iron to non-vegetarian diets, but this has lower bioavailability than iron from meat sources, and its absorption can sometimes be inhibited by other dietary constituents. According to the Vegetarian Resource Group, consuming food that contains vitamin C, such as citrus fruit or juices, tomatoes, or broccoli, is a good way to increase the amount of iron absorbed at a meal. Vegetarian foods rich in iron include black beans, cashews, hempseed, kidney beans, broccoli, lentils, oatmeal, raisins, spinach, cabbage, lettuce, black-eyed peas, soybeans, many breakfast cereals, sunflower seeds, chickpeas, tomato juice, tempeh, molasses, thyme, and whole-wheat bread. The related vegan diets can often be higher in iron than vegetarian diets, because dairy products are low in iron. Iron stores often tend to be lower in vegetarians than non-vegetarians, and a few small studies report very high rates of iron deficiency (up to 40%, and 58% of the respective vegetarian or vegan groups). However, the American Dietetic Association states that iron deficiency is no more common in vegetarians than non-vegetarians (adult males are rarely iron deficient); iron deficiency anaemia is rare no matter the diet.	Vegetarian foods rich in iron include black beans, cashews, hempseed, kidney beans, broccoli, lentils, oatmeal, raisins, spinach, cabbage, lettuce, black-eyed peas, soybeans, many breakfast cereals, sunflower seeds, chickpeas, tomato juice, tempeh, molasses, thyme, and whole-wheat bread.	/m/01bf_1	Oatmeal	103	110	/base/breakfast/breakfast_cereal_style,/food/food,/food/ingredient,/medicine/condition_prevention_factors,/medicine/drug,/medicine/drug_ingredient,/medicine/medical_treatment
Other foods associated with the county include: Yorkshire curd tart, a curd tart recipe with rosewater; Parkin, a sweet ginger cake which is different from standard ginger cakes in that it includes oatmeal and treacle; and Wensleydale cheese, a cheese associated with Wensleydale and often eaten as an accompaniment to sweet foods. The beverage ginger beer, flavoured with ginger, came from Yorkshire and has existed since the mid 18th century. Liquorice sweet was first created by George Dunhill from Pontefract, who in the 1760s thought to mix the liquorice plant with sugar. Yorkshire and in particular the city of York played a prominent role in the confectionery industry, with chocolate factories owned by companies such as Rowntree's, Terry's and Thorntons inventing many of Britain's most popular sweets. Another traditional Yorkshire food is pikelets which are similar to crumpets but much thinner. The Rhubarb Triangle is a location within Yorkshire which supplies most of the rhubarb to locals.	Other foods associated with the county include: Yorkshire curd tart, a curd tart recipe with rosewater; Parkin, a sweet ginger cake which is different from standard ginger cakes in that it includes oatmeal and treacle; and Wensleydale cheese, a cheese associated with Wensleydale and often eaten as an accompaniment to sweet foods.	/m/01bf_1	Oatmeal	198	205	/base/breakfast/breakfast_cereal_style,/food/food,/food/ingredient,/medicine/condition_prevention_factors,/medicine/drug,/medicine/drug_ingredient,/medicine/medical_treatment
The common oat (Avena sativa) is a species of cereal grain grown for its seed, which is known by the same name (usually in the plural, unlike other grains). While oats are suitable for human consumption as oatmeal and rolled oats, one of the most common uses is as livestock feed. Oats typically make up a part of the daily diet of domestic horses, about 20% of daily intake or smaller, and are regularly fed to cattle, as well. Oats are also used in some brands of dog food and chicken feed. Oat seeds are commonly marketed as cat grass to cat enthusiasts, since cats readily harvest and eat tender young oat, wheat, and some other grass sprouts.	While oats are suitable for human consumption as oatmeal and rolled oats, one of the most common uses is as livestock feed.	/m/01bf_1	Oatmeal	49	56	/base/breakfast/breakfast_cereal_style,/food/food,/food/ingredient,/medicine/condition_prevention_factors,/medicine/drug,/medicine/drug_ingredient,/medicine/medical_treatment
Oats have numerous uses in food; most commonly, they are rolled or crushed into oatmeal, or ground into fine oat flour. Oatmeal is chiefly eaten as porridge, but may also be used in a variety of baked goods, such as oatcakes, oatmeal cookies, and oat bread. Oats are also an ingredient in many cold cereals, in particular muesli and granola. Oats may also be consumed raw, and cookies with raw oats are becoming popular.	Oats have numerous uses in food; most commonly, they are rolled or crushed into oatmeal, or ground into fine oat flour.	/m/01bf_1	Oatmeal	80	87	/base/breakfast/breakfast_cereal_style,/food/food,/food/ingredient,/medicine/condition_prevention_factors,/medicine/drug,/medicine/drug_ingredient,/medicine/medical_treatment
Oats have numerous uses in food; most commonly, they are rolled or crushed into oatmeal, or ground into fine oat flour. Oatmeal is chiefly eaten as porridge, but may also be used in a variety of baked goods, such as oatcakes, oatmeal cookies, and oat bread. Oats are also an ingredient in many cold cereals, in particular muesli and granola. Oats may also be consumed raw, and cookies with raw oats are becoming popular.	Oatmeal is chiefly eaten as porridge, but may also be used in a variety of baked goods, such as oatcakes, oatmeal cookies, and oat bread.	/m/01bf_1	Oatmeal	106	113	/base/breakfast/breakfast_cereal_style,/food/food,/food/ingredient,/medicine/condition_prevention_factors,/medicine/drug,/medicine/drug_ingredient,/medicine/medical_treatment
Because of its slightly gray color, pollock is often prepared, as in Norway, as fried fish balls, or if juvenile sized, breaded with oatmeal and fried, as in Shetland. Year-old fish are traditionally split, salted and dried over a peat hearth in Orkney, where their texture becomes wooden and somewhat phosphorescent. The fish can also be salted and smoked and achieve a salmon-like orange color (although it is not closely related to the salmon), as is the case in Germany where the fish is commonly sold as Seelachs or sea salmon. In Korea, pollock may be repeatedly frozen and melted to create hwangtae, half-dried to create ko-da-ri, or fully dried and eaten as book-o.	Because of its slightly gray color, pollock is often prepared, as in Norway, as fried fish balls, or if juvenile sized, breaded with oatmeal and fried, as in Shetland.	/m/01bf_1	Oatmeal	133	140	/base/breakfast/breakfast_cereal_style,/food/food,/food/ingredient,/medicine/condition_prevention_factors,/medicine/drug,/medicine/drug_ingredient,/medicine/medical_treatment
Some foods are not recommended for pressure cooking in liquid. Such foods could expand too much, froth, and sputter, which can result in blocking the steam vent. Examples include macaroni, cranberries, and cereals such as oatmeal.	Examples include macaroni, cranberries, and cereals such as oatmeal.	/m/01bf_1	Oatmeal	60	67	/base/breakfast/breakfast_cereal_style,/food/food,/food/ingredient,/medicine/condition_prevention_factors,/medicine/drug,/medicine/drug_ingredient,/medicine/medical_treatment
On the show, the recipe for the green slime was treated as a closely guarded secret, with attempts by the kids to find out the true recipe all being unsuccessful (in one episode, Ross (Les Lye) even went so far as to decoy the kids with a fake recipe), although some episodes posited revolting theories as to what the slime was really made of - one 1989 episode which dealt with smoking, for example, theorized that slime was mucus from smokers' lungs. In reality, however, the slime recipe used through most of the show's run consisted of a mixture of lime green gelatin powder and flour; eventually, oatmeal was added to the recipe, as was baby shampoo so that it would wash out of the actors' hair more easily. Especially in the later years of the show, cast members who were slimed frequently looked upward into the slime as it was falling so that it covered their faces (the same was also true of the waterings).	In reality, however, the slime recipe used through most of the show's run consisted of a mixture of lime green gelatin powder and flour; eventually, oatmeal was added to the recipe, as was baby shampoo so that it would wash out of the actors' hair more easily.	/m/01bf_1	Oatmeal	149	156	/base/breakfast/breakfast_cereal_style,/food/food,/food/ingredient,/medicine/condition_prevention_factors,/medicine/drug,/medicine/drug_ingredient,/medicine/medical_treatment
A typical breakfast in Denmark consists of breakfast cereals such as oatmeal, corn flakes, youghurt being popular options. Bread or bread rolls (rundstykker) with different kind of cheeses and jams, usually made from berries or citrus fruits, and other toppings, accompanied by coffee, skimmed milk or tea.  Weekends or festive occasions may call for Danish pastries (wienerbrød) or a bitters, such as Gammel Dansk.	A typical breakfast in Denmark consists of breakfast cereals such as oatmeal, corn flakes, youghurt being popular options.	/m/01bf_1	Oatmeal	69	76	/base/breakfast/breakfast_cereal_style,/food/food,/food/ingredient,/medicine/condition_prevention_factors,/medicine/drug,/medicine/drug_ingredient,/medicine/medical_treatment
Oat grains can be sold whole (groats), ground into oatmeal or Scottish oats, steamed and rolled into flakes of varying thickness, or cut into two or three pieces, steel-cut. Groats can be used as other whole grains; they are a little softer than wheat berries. Rolled oats can be used for many purposes; the bigger the flakes, the chewier the result. They may be precooked—instant varieties. Steel-cut, as a cereal, are much chewier. They are suitable as a breakfast cereal, but less so for baking, as they do not soften well. It is said that, because of their size and shape, the body breaks steel-cut oats down more slowly than rolled oats, reducing spikes in blood sugar and keeping you full longer.	Oat grains can be sold whole (groats), ground into oatmeal or Scottish oats, steamed and rolled into flakes of varying thickness, or cut into two or three pieces, steel-cut.	/m/01bf_1	Oatmeal	51	58	/base/breakfast/breakfast_cereal_style,/food/food,/food/ingredient,/medicine/condition_prevention_factors,/medicine/drug,/medicine/drug_ingredient,/medicine/medical_treatment
A chocolate chip cookie is a drop cookie that originated in the United States and features chocolate chips as its distinguishing ingredient. The traditional recipe combines a dough composed of butter and both brown and white sugar with semi-sweet chocolate chips. Variations include recipes with other types of chocolate or additional ingredients, such as nuts or oatmeal.	Variations include recipes with other types of chocolate or additional ingredients, such as nuts or oatmeal.	/m/01bf_1	Oatmeal	100	107	/base/breakfast/breakfast_cereal_style,/food/food,/food/ingredient,/medicine/condition_prevention_factors,/medicine/drug,/medicine/drug_ingredient,/medicine/medical_treatment
George H. Hoyt created Wheatena circa 1879, during an era when retailers would typically buy cereal (the most popular being cracked wheat, oatmeal, and cerealine) in barrel lots, and scoop it out to sell by the pound to customers. Hoyt, who had found a distinctive process of preparing wheat for cereal, sold his cereal in boxes, offering consumers a sanitary appeal.	George H. Hoyt created Wheatena circa 1879, during an era when retailers would typically buy cereal (the most popular being cracked wheat, oatmeal, and cerealine) in barrel lots, and scoop it out to sell by the pound to customers.	/m/01bf_1	Oatmeal	139	146	/base/breakfast/breakfast_cereal_style,/food/food,/food/ingredient,/medicine/condition_prevention_factors,/medicine/drug,/medicine/drug_ingredient,/medicine/medical_treatment
Common hot cereals in parts of Canada include oatmeal, Cream of Wheat and Red River cereal. These hot cereals are typically served with maple syrup or brown sugar and milk or cream. Yogurt is a popular addition to Red River cereal. Many Canadians also enjoy cereals common to the style pioneered and currently prevalent in the United States market.	Common hot cereals in parts of Canada include oatmeal, Cream of Wheat and Red River cereal.	/m/01bf_1	Oatmeal	46	53	/base/breakfast/breakfast_cereal_style,/food/food,/food/ingredient,/medicine/condition_prevention_factors,/medicine/drug,/medicine/drug_ingredient,/medicine/medical_treatment
In 1761, the Fenwick Weavers' Society was formed in Fenwick, East Ayrshire, Scotland to sell discounted oatmeal to local workers. Its services expanded to include assistance with savings and loans, emigration and education. In 1810, Welsh social reformer Robert Owen, from Newtown in mid-Wales, and his partners purchased New Lanark mill from Owen's father-in-law David Dale and proceeded to introduce better labour standards including discounted retail shops where profits were passed on to his employees. Owen left New Lanark to pursue other forms of cooperative organization and develop co-op ideas through writing and lecture. Cooperative communities were set up in Glasgow, Indiana and Hampshire, although ultimately unsuccessful. In 1828, William King set up a newspaper, The Cooperator, to promote Owen's thinking, having already set up a co-operative store in Brighton.	In 1761, the Fenwick Weavers' Society was formed in Fenwick, East Ayrshire, Scotland to sell discounted oatmeal to local workers.	/m/01bf_1	Oatmeal	104	111	/base/breakfast/breakfast_cereal_style,/food/food,/food/ingredient,/medicine/condition_prevention_factors,/medicine/drug,/medicine/drug_ingredient,/medicine/medical_treatment
Several residents of Akron have played a role in defining the American cuisine. Ferdinand Schumacher created the first American oatmeal and is a pioneer of breakfast cereal. He also founded the Empire Barley Mill and German Mills American Oatmeal Company, which would later merge several times with other companies, with the result being the Quaker Oats Company. The Menches Brothers, are the disputed inventors of the waffle ice cream cone, caramel corn, and hamburger. The beer, BORIS The Crusher Oatmeal-Imperial Stout, brewed by the Hoppin' Frog Brewing Company located in the city, won 1st place in the Imperial Stout category of the 2008 Great American Beer Festival, and the company was named the 24th best brewer in the world for 2010 by RateBeer.com Notable eateries in Akron are Luigi's Pizzeria (established in 1949) and The Diamond Grille. Other places include: Crave, Bricco, Cilantro, Diamond Deli, Urban Eats, Mary Coyle Ice Cream, Swenson's, Ken Stewart's, Tangier, Louie's, Duffy's, New Era, The Office Bistro, Strickland's Frozen Custard, and Hamburger Station. The rivalry between Swenson's and Skyway, aired on Iron Chef Michael Symon's Food Feuds, which Swenson's won.	Ferdinand Schumacher created the first American oatmeal and is a pioneer of breakfast cereal.	/m/01bf_1	Oatmeal	48	55	/base/breakfast/breakfast_cereal_style,/food/food,/food/ingredient,/medicine/condition_prevention_factors,/medicine/drug,/medicine/drug_ingredient,/medicine/medical_treatment
Allen hosted a number of television programs up until the 1980s, including The New Steve Allen Show in 1961 and the game show I've Got a Secret (replacing original host Garry Moore) in 1964. In the summer of 1967, he brought most of the regulars from over the years back with The Steve Allen Comedy Hour, featuring the debuts of Rob Reiner, Richard Dreyfuss, and John Byner and featuring Ruth Buzzi, who would become famous soon after on "Laugh-In." In 1968–71, he returned to syndicated nightly variety-talk with the same wacky stunts that would influence David Letterman in later years, including becoming a human hood ornament; jumping into vats of oatmeal and cottage cheese; and being slathered with dog food, allowing dogs backstage to feast on the free food. During the run of this series, Allen also introduced Albert Brooks and Steve Martin to a national audience for the first time.	" In 1968–71, he returned to syndicated nightly variety-talk with the same wacky stunts that would influence David Letterman in later years, including becoming a human hood ornament; jumping into vats of oatmeal and cottage cheese; and being slathered with dog food, allowing dogs backstage to feast on the free food.	/m/01bf_1	Oatmeal	204	211	/base/breakfast/breakfast_cereal_style,/food/food,/food/ingredient,/medicine/condition_prevention_factors,/medicine/drug,/medicine/drug_ingredient,/medicine/medical_treatment
Bert, though kind and intelligent, is also grumpy, boring and easily frustrated. His catchphrase is "Yes, I do mind!" He enjoys activities such as paper clip and bottle cap collecting, cooking oatmeal and watching pigeons. Producer Arlene Sherman has called Bert "everyone's idea of a blind date". In one sketch, Bert reads a book called Boring Stories and chuckles, "Wow! These boring stories are really exciting!" In the book Sesame Street Unpaved, Frank Oz says, "I was never really happy with Bert's character until about a year in, when I realized... that he was a very boring character, and I'd use that weakness as a strength for him."	" He enjoys activities such as paper clip and bottle cap collecting, cooking oatmeal and watching pigeons.	/m/01bf_1	Oatmeal	77	84	/base/breakfast/breakfast_cereal_style,/food/food,/food/ingredient,/medicine/condition_prevention_factors,/medicine/drug,/medicine/drug_ingredient,/medicine/medical_treatment
Another B-unit, consisting of pre-mixed oatmeal cereal, was introduced in 1944 as a breakfast ration that was usually paired with the "Ham, Egg, and Potato" Meal.	Another B-unit, consisting of pre-mixed oatmeal cereal, was introduced in 1944 as a breakfast ration that was usually paired with the "Ham, Egg, and Potato" Meal.	/m/01bf_1	Oatmeal	40	47	/base/breakfast/breakfast_cereal_style,/food/food,/food/ingredient,/medicine/condition_prevention_factors,/medicine/drug,/medicine/drug_ingredient,/medicine/medical_treatment
In Europe and the Americas, typical fillers include meat, fat, suet, bread, cornmeal, sweet potato, onion, chestnuts, barley, and oatmeal. In Spain, Portugal and Asia, potato is often replaced by rice.	In Europe and the Americas, typical fillers include meat, fat, suet, bread, cornmeal, sweet potato, onion, chestnuts, barley, and oatmeal.	/m/01bf_1	Oatmeal	130	137	/base/breakfast/breakfast_cereal_style,/food/food,/food/ingredient,/medicine/condition_prevention_factors,/medicine/drug,/medicine/drug_ingredient,/medicine/medical_treatment
Alongside the mustamakkara (black sausage) in Finland, a dish similar to black pudding is made by making batter out of pig's blood and baking it like pancakes. Traditionally, rye flour or oatmeal is used and minced onion is added to the mix. This dish is called veriohukainen (blood pancake - crepe-style in contrast to Finnish pancake which is baked in an oven). It is similar to the Swedish dish blodplättar below, and is alternatively called verilettu or verilätty using a Finland-Swedish term for pancakes instead of a native Finnish one. Rössypottu is a traditional soup in northern Finland with blood pudding as a main ingredient.	Traditionally, rye flour or oatmeal is used and minced onion is added to the mix.	/m/01bf_1	Oatmeal	28	35	/base/breakfast/breakfast_cereal_style,/food/food,/food/ingredient,/medicine/condition_prevention_factors,/medicine/drug,/medicine/drug_ingredient,/medicine/medical_treatment
The town developed a large trade in oatmeal during the 16th century but this had ceased by about 1720. There was a noted tannery at Linkfield Street which was expanded in the 19th century. It burnt down about 1930.	The town developed a large trade in oatmeal during the 16th century but this had ceased by about 1720.	/m/01bf_1	Oatmeal	36	43	/base/breakfast/breakfast_cereal_style,/food/food,/food/ingredient,/medicine/condition_prevention_factors,/medicine/drug,/medicine/drug_ingredient,/medicine/medical_treatment
In other foods, heat treatment generates vanillin from other chemicals. In this way, vanillin contributes to the flavor and aroma of coffee, maple syrup, and whole grain products including corn tortillas and oatmeal.	In this way, vanillin contributes to the flavor and aroma of coffee, maple syrup, and whole grain products including corn tortillas and oatmeal.	/m/01bf_1	Oatmeal	136	143	/base/breakfast/breakfast_cereal_style,/food/food,/food/ingredient,/medicine/condition_prevention_factors,/medicine/drug,/medicine/drug_ingredient,/medicine/medical_treatment
The highest concentrations of carnitine are found in red meat and dairy products. Carnitine can be found at significantly lower levels in many other foods including nuts and seeds (e.g. pumpkin, sunflower, sesame), legumes or pulses (beans, peas, lentils, peanuts), vegetables (artichokes, asparagus, beet greens, broccoli, brussels sprouts, collard greens, garlic, mustard greens, okra, parsley, kale), fruits (apricots, bananas), cereals (buckwheat, corn, millet, oatmeal, rice bran, rye, whole wheat, wheat bran, wheat germ) and other foods (bee pollen, brewer's yeast, carob).	pumpkin, sunflower, sesame), legumes or pulses (beans, peas, lentils, peanuts), vegetables (artichokes, asparagus, beet greens, broccoli, brussels sprouts, collard greens, garlic, mustard greens, okra, parsley, kale), fruits (apricots, bananas), cereals (buckwheat, corn, millet, oatmeal, rice bran, rye, whole wheat, wheat bran, wheat germ) and other foods (bee pollen, brewer's yeast, carob).	/m/01bf_1	Oatmeal	280	287	/base/breakfast/breakfast_cereal_style,/food/food,/food/ingredient,/medicine/condition_prevention_factors,/medicine/drug,/medicine/drug_ingredient,/medicine/medical_treatment
A scone is a single-serving cake or quick bread. They are usually made of wheat, barley or oatmeal, with baking powder as a leavening agent, and are baked on sheet pans. They are often lightly sweetened and are occasionally glazed. The scone is a basic component of the cream tea or Devonshire tea. It differs from a tea cake and other sweet buns, which are made with yeast. A scone is not a type of pastry.	They are usually made of wheat, barley or oatmeal, with baking powder as a leavening agent, and are baked on sheet pans.	/m/01bf_1	Oatmeal	42	49	/base/breakfast/breakfast_cereal_style,/food/food,/food/ingredient,/medicine/condition_prevention_factors,/medicine/drug,/medicine/drug_ingredient,/medicine/medical_treatment
