paragraph	sentence	mid	title	start	end	notable_types
The book throws light on 18th century cooking practices. For example, Marshall advocated removing salt from butter by washing it in Rose water, making it more palatable for the cheesecakes, puddings and sweet pastries she taught her pupils to prepare. She also used the technique of using a feather to clear the seeds from jellies. This method is still used today for Bar-le-duc jelly.	This method is still used today for Bar-le-duc jelly.	/m/09j9bh	Bar-le-duc_jelly	36	52	/food/food
After killing Paul Owen, one of his colleagues, Bateman appropriates his apartment as a place to kill and store more victims. Bateman's control over his violent urges deteriorates. His murders become increasingly sadistic and complex, progressing from simple stabbings to drawn out sequences of torture, rape, mutilation, cannibalism, and necrophilia, and the separation between his two lives begins to blur. He introduces stories about serial killers into casual conversations and on several occasions openly confesses his murderous activities to his coworkers, who never take him seriously, do not hear what he says, or misunderstand him completely—for example, hearing the words "murders and executions" as "mergers and acquisitions." Bateman begins to experience bizarre hallucinations such as seeing a Cheerio interviewed on a talk show, being stalked by an anthropomorphic park bench, and finding a bone in his Dove Bar. These incidents culminate in a shooting spree during which he kills several random people in the street, resulting in a SWAT team being dispatched in a helicopter. Bateman flees on foot and hides in his office, where he phones his attorney, Harold Carnes, and confesses all his crimes to the answering machine.	" Bateman begins to experience bizarre hallucinations such as seeing a Cheerio interviewed on a talk show, being stalked by an anthropomorphic park bench, and finding a bone in his Dove Bar.	/m/02q9kh6	Dove_Bar	181	189	/food/food
Rosebud the Basselope was the world's last basselope (a cross between a basset hound and an antelope). The rest of the basselopes died of clogged arteries, as they liked lots of butter on their Pop-Tarts. Rosebud tried out for Steve Dallas's heavy metal rock band but was unsuccessful and ended up becoming an equipment carrier. After it was revealed that Rosebud was a female, it was discovered that Rosebud had had an affair with Hodge-Podge the jackrabbit, and was pregnant. Rosebud gave birth to 64 jackabasselopes who matured and left after a week. Rosebud made her first appearance while Milo and Opus were hunting for a beast that "easily devours fifty rhinos a day." Basselopes supposedly live extremely long lives due to "taking cold showers." Rosebud was part of three gag government weapon programs against the Soviet Union. One involved Rosebud launching a six megaton atomic bomb from between her antlers with a large rubber band. The second depicted Rosebud as the control system for a space weapon, described as "powered by twinkies, cheaper than a computer, somewhat slow reflexes but can hold  breath for six months or more." The third had Rosebud disguised as an old Russian woman and distributing American commercials, Dove Bars, Mickey Mouse clothing, and cheeseburgers.	" The third had Rosebud disguised as an old Russian woman and distributing American commercials, Dove Bars, Mickey Mouse clothing, and cheeseburgers.	/m/02q9kh6	Dove_Bar	97	106	/food/food
The name comes from Dove Candies & Ice Cream, which were Chicago sweet shops owned by Leo Stefanos, a Greek-American. In 1956, Stefanos created the Dove brand of ice cream bars, which were only sold locally in Chicago until 1985 when distribution began in selected cities around the country. The Galaxy brand was first launched in the UK in 1960. In 1986, the company was acquired by Mars, Incorporated. In a 2013 advertising campaign Galaxy features a virtual Audrey Hepburn eating a piece of Galaxy chocolate in a 1960s Mediterranean setting.	In 1956, Stefanos created the Dove brand of ice cream bars, which were only sold locally in Chicago until 1985 when distribution began in selected cities around the country.	/m/02q9kh6	Dove_Bar	30	58	/food/food
Leo Stefanos was the owner of Dove Candies & Ice Cream in Chicago and the inventor of the DoveBar.	Leo Stefanos was the owner of Dove Candies & Ice Cream in Chicago and the inventor of the DoveBar.	/m/02q9kh6	Dove_Bar	90	97	/food/food
There are two types of nabemono in Japan: lightly flavored stock (mostly with kombu) types such as yudōfu (湯豆腐) and mizutaki (水炊き), eaten with a dipping sauce (tare) to enjoy the taste of the ingredients themselves; and strongly flavored stock (typically with miso, soy sauce, dashi, and/or sweet soy) types such as yosenabe (寄鍋), oden (おでん), and sukiyaki (すき焼き), eaten without further flavoring.	There are two types of nabemono in Japan: lightly flavored stock (mostly with kombu) types such as yudōfu (湯豆腐) and mizutaki (水炊き), eaten with a dipping sauce (tare) to enjoy the taste of the ingredients themselves; and strongly flavored stock (typically with miso, soy sauce, dashi, and/or sweet soy) types such as yosenabe (寄鍋), oden (おでん), and sukiyaki (すき焼き), eaten without further flavoring.	/m/0479zj6	Tare_sauce	160	164	/food/food
Nabemono are usually eaten with a sauce sometimes called tare, literally "dipping". Several kinds of sauce can be used with additional spices, called yakumi. Typical yakumi include grated garlic, butter, red pepper, a mixture of red pepper and other spices, roasted sesame, or momiji oroshi (a mixture of grated daikon radish and red pepper).	Nabemono are usually eaten with a sauce sometimes called tare, literally "dipping".	/m/0479zj6	Tare_sauce	57	61	/food/food
Yakiniku is a variant of bulgogi that has been modified by Zainichi Koreans to appeal to Japanese tastes. The present style of yakiniku restaurants are also derived from the Korean restaurants in Osaka and Tokyo which were opened around 1945. In a yakiniku restaurant, diners order several types of prepared raw ingredients (either individually or as a set) which are brought to the table. The ingredients are cooked by the diners on a grill built into the table throughout the duration of the meal, several pieces at a time. The ingredients are then dipped in sauces known as tare before being eaten. The most common sauce is made of Japanese soy sauce mixed with sake, mirin, sugar, garlic, fruit juice and sesame. Garlic-and-shallot or miso-based dips are sometimes used. Different kinds of Korean side dishes like kimchi, nameul, bibimbap are also served alongside.	The ingredients are then dipped in sauces known as tare before being eaten.	/m/0479zj6	Tare_sauce	51	55	/food/food
Gyūtan (牛タン?) is a Japanese food that is made from grilled beef tongue. The word gyūtan is a combination of the Japanese word for cow (牛, gyū?) and the English word tongue. Since gyūtan literally means "cow tongue," the word is also used to refer to cow tongues in Japan. The custom of cooking gyūtan originated in Sendai in 1948, and is usually served with barley rice, tail soup, and pickles in the Sendai area. In other areas in Japan, gyūtan is most often served in yakiniku restaurants. Gyūtan was originally conceived to be flavored with salt, which led to gyūtan being called tanshio (タン塩?, lit. "tongue salt") in many yakiniku restaurants. However, some stores now serve gyūtan with tare sauce.	However, some stores now serve gyūtan with tare sauce.	/m/0479zj6	Tare_sauce	43	53	/food/food
The most prominent differences of Japanese-style gyōza from Chinese style jiaozi are the rich garlic flavor, which is less noticeable in the Chinese version, and the fact that Japanese gyōza are very lightly flavored with salt, soy, and that the gyōza wrappers are much thinner. Of course, jiaozi vary greatly across regions even within China, so these differences are not always substantial. They are usually served with soy-based tare sauce seasoned with rice vinegar and/or Rāyu (known as chili oil in English, làyóu (辣油) in China). The most common recipe found is a mixture of minced pork, cabbage, and Nira (Chinese chives), and sesame oil, and/or garlic, and/or ginger, which is then wrapped into thinly rolled dough skins. In essence, gyōza are similar in shape to pierogi.	They are usually served with soy-based tare sauce seasoned with rice vinegar and/or Rāyu (known as chili oil in English, làyóu (辣油) in China).	/m/0479zj6	Tare_sauce	39	49	/food/food
Hiyashi chūka (冷やし中華?, lit. "chilled Chinese") is a Japanese dish consisting of chilled ramen noodles with various toppings served in the summer. Toppings are usually colorful cold ingredients and a tare sauce.	Toppings are usually colorful cold ingredients and a tare sauce.	/m/0479zj6	Tare_sauce	53	63	/food/food
Diners ordering yakitori usually have a choice of having it cooked with salt (shio), or with tare sauce, which is generally made up of mirin, sake, soy sauce and sugar. The sauce is applied to the skewered meat which is grilled until delicately cooked.	Diners ordering yakitori usually have a choice of having it cooked with salt (shio), or with tare sauce, which is generally made up of mirin, sake, soy sauce and sugar.	/m/0479zj6	Tare_sauce	93	103	/food/food
The three earliest cuisines of Canada have First Nations, English, and French roots, with the traditional cuisine of English Canada closely related to British and American cuisine, while the traditional cuisine of French Canada has evolved from French cuisine and the winter provisions of fur traders. With subsequent waves of immigration in the 18th and 19th century from Central, Southern, and Eastern Europe, and then from Asia, Africa and Caribbean, the regional cuisines were subsequently augmented. The Jewish immigrants to Canada during the late 1800s also play a significant role to foods in Canada. The Montreal-style bagel and Montreal-style smoked meat are both food items developed by Jewish communities living in Montreal.	The Montreal-style bagel and Montreal-style smoked meat are both food items developed by Jewish communities living in Montreal.	/m/045f31	Montreal-style_bagel	4	24	/food/food
In many regions of Canada, in particular in Southern Ontario, brunch is popular on Sundays when families will often host relatives or friends in their dining room. The typical brunch can last a few hours and go late into the afternoon. Montreal-style bagels may be served alongside egg dishes, waffles or crepes, smoked meat or fish, fruit, salads, cheese, and dessert. Oftentimes, champagne or wine will be served and following the meal tea or coffee is usually consumed.	Montreal-style bagels may be served alongside egg dishes, waffles or crepes, smoked meat or fish, fruit, salads, cheese, and dessert.	/m/045f31	Montreal-style_bagel	0	21	/food/food
In modern times, Canadian-born astronaut Gregory Chamitoff is the first person known to have taken a batch of bagels into space on his 2008 Space Shuttle mission to the International Space Station. His shipment consisted of 18 sesame seed bagels.	In modern times, Canadian-born astronaut Gregory Chamitoff is the first person known to have taken a batch of bagels into space on his 2008 Space Shuttle mission to the International Space Station.	/m/045f31	Montreal-style_bagel	110	116	/food/food
In modern times, Canadian-born astronaut Gregory Chamitoff is the first person known to have taken a batch of bagels into space on his 2008 Space Shuttle mission to the International Space Station. His shipment consisted of 18 sesame seed bagels.	His shipment consisted of 18 sesame seed bagels.	/m/045f31	Montreal-style_bagel	41	47	/food/food
The two most prominent styles of traditional bagel in North America are the Montreal-style bagel and the New York-style bagel. The Montreal bagel contains malt and sugar with no salt; it is boiled in honey-sweetened water before baking in a wood-fired oven; and it is predominantly either of the poppy "black" or sesame "white" seeds variety. The New York bagel contains salt and malt and is boiled in water prior to baking in a standard oven. The resulting New York bagel is puffy with a moist crust, while the Montreal bagel is smaller (though with a larger hole), crunchier, and sweeter.	The two most prominent styles of traditional bagel in North America are the Montreal-style bagel and the New York-style bagel.	/m/045f31	Montreal-style_bagel	76	96	/food/food
Examples of contemporary Quebec cuisine include pommes persillade (cubed potatoes fried and topped with persillade as a garnish), poutine (French fries topped with gravy and cheese curds), Le Riopelle de l'Isle cheese, and whippet cookies. Pizza-ghetti is a Quebec combination dish served in fast food and family restaurants. The Jewish community of Montreal has contributed Montreal-style bagels and smoked meat which is similar to pastrami. Barbecue is also popular in the Montreal area, usually utilizing baking, grilling, or grill-braising (combining a direct dry heat grill with a broth-filled pot for moist heat) techniques; there are many barbecue-steakhouse restaurants throughout the city, and the style of this region combines influences from the American Deep South (particularly from the Louisiana area and Kansas City) with Canadian aboriginal, Irish, Central European, and Mediterranean influences, particularly French, German, and Greek (see Regional variations of barbecue for more information).	The Jewish community of Montreal has contributed Montreal-style bagels and smoked meat which is similar to pastrami.	/m/045f31	Montreal-style_bagel	49	70	/food/food
Many restaurants and pubs in Quebec will feature French dishes such as Coq au vin, Beef Burgundy, Pea soup, and French Onion Soup. But they will also feature Québécois specialties such as a Tourtière, Poutine, a Montreal smoked meat sandwich, and Montreal bagels.	But they will also feature Québécois specialties such as a Tourtière, Poutine, a Montreal smoked meat sandwich, and Montreal bagels.	/m/045f31	Montreal-style_bagel	116	131	/food/food
Jewish immigrants to Canada during the late 1800s played a significant culinary role within Canada, chiefly renowned for Montreal-style bagels and Montreal-style smoked meat. A regional variation of both emerged within Winnipeg, Manitoba's Jewish community, which also derived Winnipeg-style Cheesecake from New York recipes.	Jewish immigrants to Canada during the late 1800s played a significant culinary role within Canada, chiefly renowned for Montreal-style bagels and Montreal-style smoked meat.	/m/045f31	Montreal-style_bagel	121	142	/food/food
Chamitoff served on a long duration mission to the International Space Station. He launched as a Mission Specialist on board Space Shuttle mission STS-124. He was Flight Engineer 2 and Science Officer on Expedition 17. He returned home as a Mission Specialist on STS-126, completing a tour that lasted six months. As part of his personal allowance, Chamitoff brought the first bagels into space, 3 bags (18 sesame seed bagels) of Fairmount Bagels with him, from his cousin's bagel bakery.	As part of his personal allowance, Chamitoff brought the first bagels into space, 3 bags (18 sesame seed bagels) of Fairmount Bagels with him, from his cousin's bagel bakery.	/m/045f31	Montreal-style_bagel	63	69	/food/food
The Plateau Mont-Royal borough has historically been a working-class francophone area. The largest neighbourhood is the Plateau (not to be confused with the whole borough), which is currently undergoing considerable gentrification, and a 2001 study deemed it as Canada's most creative neighbourhood because artists comprise 8% of its labour force. The neighbourhood of Mile End in the northwestern part of the borough, has historically been a very multicultural area of the city, and features two of Montreal's well-known bagel establishments, St-Viateur Bagel and Fairmount Bagel. The McGill Ghetto is located in the extreme southwestern portion of the borough, its name being derived from the fact that it is home to thousands of McGill University students and faculty members.	The neighbourhood of Mile End in the northwestern part of the borough, has historically been a very multicultural area of the city, and features two of Montreal's well-known bagel establishments, St-Viateur Bagel and Fairmount Bagel.	/m/045f31	Montreal-style_bagel	174	194	/food/food
The historical context of 'traditional' Quebec cuisine is from the fur trade period and many dishes have a high fat or lard content. From the early 17th century, French settlers populating North America were interested in a new cuisine to confront the climate and the needs arising from the work of colonization. Mindful of the same nutritional needs as settlers from Acadia, it has many similarities with Acadian cuisine. Quebec's cuisine has a strong French and Irish influence, although many aspects of Canadian aboriginal cuisine have also had a significant impact on Quebec cuisine. Quebec is most famous for its Tourtière, Pâté Chinois and Poutine. The temps des sucres (sugar season) is one of the oldest of Quebec culinary traditions. During springtime, many Quebeckers go to the cabane à sucre (sugar house) for a traditional meal. The Jewish community of Montreal has contributed Montreal-style bagels and smoked meat which is similar to pastrami.	The Jewish community of Montreal has contributed Montreal-style bagels and smoked meat which is similar to pastrami.	/m/045f31	Montreal-style_bagel	49	70	/food/food
Whole poppy seeds are widely used as a spice and decoration in and on top of many baked goods. In North America they are used in and on many food items such as poppy seed muffins, rusk, bagels (like the Montreal-style bagel), bialys, and cakes such as sponge cake. Across Europe, buns and soft white bread pastries are often sprinkled on top with black and white poppy seeds (for example Cozonac, Kalach Kolache and, Kołacz).	In North America they are used in and on many food items such as poppy seed muffins, rusk, bagels (like the Montreal-style bagel), bialys, and cakes such as sponge cake.	/m/045f31	Montreal-style_bagel	108	128	/food/food
Fairmount Bagel is a Montreal-style bagel bakery in Montreal, Quebec, Canada. It is located on Fairmount Avenue in the Mile End neighbourhood of the Plateau-Mont-Royal borough.	Fairmount Bagel is a Montreal-style bagel bakery in Montreal, Quebec, Canada.	/m/045f31	Montreal-style_bagel	21	41	/food/food
St-Viateur Bagel is a famous Montreal-style bagel bakery located in the neighbourhood of Mile End in the borough of Le Plateau Mont-Royal. Established in 1957 by Myer Lewkowicz, the bakery takes its name from its street, St-Viateur Street. The bagel shop operates 24 hours a day, 7 days a week, and serves over 12,000 bagels a day.	St-Viateur Bagel is a famous Montreal-style bagel bakery located in the neighbourhood of Mile End in the borough of Le Plateau Mont-Royal.	/m/045f31	Montreal-style_bagel	29	49	/food/food
The restaurant has been in its location at 3961 Saint Laurent Boulevard since its founding, in an area that was the historic Jewish quarter. Identified as a "Jewish steakhouse," its menu was based on traditional Old World recipes, and it catered to the mainly Central European immigrant residents of The Main neighbourhood. The influence of Romanian cuisine has had a significant shaping influence on the culinary culture of Montreal, producing, among other staples, the Montreal-style steak spice, bagels and smoked meat for which the city has become known.	The influence of Romanian cuisine has had a significant shaping influence on the culinary culture of Montreal, producing, among other staples, the Montreal-style steak spice, bagels and smoked meat for which the city has become known.	/m/045f31	Montreal-style_bagel	175	181	/food/food
Two traditional types of bagels are Montreal-style bagel and New York-style bagel.	Two traditional types of bagels are Montreal-style bagel and New York-style bagel.	/m/045f31	Montreal-style_bagel	36	56	/food/food
Kristiansund is known as the major bacalao city of Norway. Bacalao is made of salted, dried codfish, and has traditionally been exported in large amounts to Spain, Portugal and Latin America as food suitable during Lent. In recent years Kristiansund has become the major oil and gas city at the mid-northwestern coast. Oil companies like Royal Dutch Shell and Statoil have offices in Kristiansund from where they serve their offshore installations at Haltenbanken (one of the northernmost underwater oil fields in the world).	Bacalao is made of salted, dried codfish, and has traditionally been exported in large amounts to Spain, Portugal and Latin America as food suitable during Lent.	/m/0dzxxc	Dried_and_salted_cod	19	40	/food/food
Cod has been an important economic commodity in international markets since the Viking period (around 800 AD). Norwegians traveled with dried cod and soon a dried cod market developed in southern Europe. This market has lasted for more than 1,000 years, enduring the Black Death, wars and other crises, and is still an important Norwegian fish trade. The Portuguese began fishing cod in the 15th century. Clipfish is widely enjoyed in Portugal. The Basques played an important role in the cod trade, and allegedly found the Canadian fishing banks before Columbus' discovery of America. The North American east coast developed in part due to the vast cod stocks. Many cities in the New England area are located near cod fishing grounds. The fish was so important to the history and development of Massachusetts, the state's House of Representatives hung a wood carving of a codfish, known as the Sacred Cod of Massachusetts, in its chambers.	Norwegians traveled with dried cod and soon a dried cod market developed in southern Europe.	/m/0dzxxc	Dried_and_salted_cod	25	34	/food/food
Apart from the long history, cod differ from most fish because the fishing grounds are far from population centers. The large cod fisheries along the coast of North Norway (and in particular close to the Lofoten islands) have been developed almost uniquely for export, depending on sea transport of stockfish over large distances. Since the introduction of salt, dried and salted cod (clipfish or 'klippfisk' in Norwegian) has also been exported. By the end of the 14th century, the Hanseatic League dominated trade operations and sea transport, with Bergen as the most important port.	Since the introduction of salt, dried and salted cod (clipfish or 'klippfisk' in Norwegian) has also been exported.	/m/0dzxxc	Dried_and_salted_cod	32	52	/food/food
Lutefisk (Norwegian) or Lutfisk (Swedish) or Ludfisk (Danish) (pronounced  in Northern Norway,  in Central and Southern Norway,  in Sweden, in Denmark  and in Finland (Finnish: lipeäkala)) is a traditional dish of the Nordic countries. It is made from aged stockfish (air-dried whitefish) or dried/salted whitefish (klippfisk) and lye (lut). It is gelatinous in texture, and has an extremely strong, pungent odor. Its name literally means "lye fish."	It is made from aged stockfish (air-dried whitefish) or dried/salted whitefish (klippfisk) and lye (lut).	/m/0dzxxc	Dried_and_salted_cod	56	78	/food/food
Salting is the preservation of food with dry edible salt. It is related to pickling (preparing food with brine, i.e. salty water). It is one of the oldest methods of preserving food, and two historically significant salt-cured foods are dried and salted cod (usually referred to as salt fish) and salt-cured meat. Vegetables such as runner beans and cabbage are also often preserved in this manner.	It is one of the oldest methods of preserving food, and two historically significant salt-cured foods are dried and salted cod (usually referred to as salt fish) and salt-cured meat.	/m/0dzxxc	Dried_and_salted_cod	106	126	/food/food
For centuries, much of the European diet depended on dried cod, known as salt cod or bacalhau (with salt) or stockfish (without). It formed the main protein source for the slaves on the West Indian plantations, and was a major economic force within the triangular trade. Dried shark meat, known as Hákarl, is a delicacy in Iceland.	For centuries, much of the European diet depended on dried cod, known as salt cod or bacalhau (with salt) or stockfish (without).	/m/0dzxxc	Dried_and_salted_cod	73	81	/food/food
Karlsøy is among the world's most important exporters of dried and salted cod, with Portugal, Spain, and Brazil among the main markets. The population is almost totally dependent on fishing. There are also goat herding businesses and some music professionals that live on the island community. There is an increasing amount of tourism, mostly as a result of the festival that runs in the Summer promoting the isle and the alternative history there. As a result there are plans for 50 holiday homes to be built on the isle.	Karlsøy is among the world's most important exporters of dried and salted cod, with Portugal, Spain, and Brazil among the main markets.	/m/0dzxxc	Dried_and_salted_cod	57	77	/food/food
The coat-of-arms were granted in 2006 when the municipalities of Tustna and Aure were merged together. They are based on the arms of the old municipality of Tustna, only the colors were changed. The arms show a white klippfisk (cod) on a blue background. The commercial production of cod in Norway started in Tustna around 1690.	The arms show a white klippfisk (cod) on a blue background.	/m/0dzxxc	Dried_and_salted_cod	22	31	/food/food
