paragraph	sentence	mid	title	start	end	notable_types
The band was formed in mid-2002 by guitarist Aaron Bilbija, bass player Meredith Webster and drummer Matt Lamb. All three had previously been together in a thrash metal band called Psi.Kore that had been founded by Lamb's brother Chuck, guitarist Adam Boyle and bassist Lex Dourian in 1996; Lamb had joined in 1997 and Webster took Dourian's place in late 1998. The band recorded an EP with Chatterbox Records in 2000 and toured Australia widely before Bilbija was recruited in early 2002. Relations within the group pushed Chuck Lamb out and the remaining members decided to continue in a slightly different musical direction. In 1995, Bilbija had formed a death metal band called Deadspawn and with the eventual line-up of himself plus Dave Micallef (vocals, guitar), Bob Latsombath (bass) and Wayne Morris (drums), that group had released an album on Warhead Records in 1999 before eventually splitting up when Micallef left in mid-2001. Bilbija now recruited Micallef into his latest band, and Daysend was formed with guitarist Michael Kordek (from a death metal act called Automation and then, briefly, Infernal Method with Bilbija) also coming into the group. The line-up was only together briefly before Matt Lamb left, his place taken by Morris. Lamb has since played in a variety of Sydney rock and metal bands.	In 1995, Bilbija had formed a death metal band called Deadspawn and with the eventual line-up of himself plus Dave Micallef (vocals, guitar), Bob Latsombath (bass) and Wayne Morris (drums), that group had released an album on Warhead Records in 1999 before eventually splitting up when Micallef left in mid-2001.	/m/02rqqmw	Warhead_Records	226	241	/business/business_operation,/business/employer,/music/record_label,/organization/organization
Several record labels including Century Media courted the band but Dungeon signed eventually to Sydney's Warhead Records in July 1999. Warhead specialised in releasing Australian heavy metal bands and Moore had been friends with the owner Brad Sims for many years. This possibly swayed the group's decision at the time. Justin Sayers decided to leave Dungeon at this point on friendly terms and played a small number of live shows with them until he was replaced by Brendan "Dakk" McDonald. McDonald had previously played guitar in a band called Dr Zeus, the same band that had supplied Dungeon with early drummer Andrew Brody. Resurrection was released in September 1999. While it sold well among the band's growing fanbase, Warhead Records folded early the next year and the album was never re-pressed. Despite this, it won them considerable notice and Dungeon supported Yngwie Malmsteen and Nevermore late in the year before making their first appearance at the Metal for the Brain festival. They would go on to play at the event every year until 2005.	Several record labels including Century Media courted the band but Dungeon signed eventually to Sydney's Warhead Records in July 1999.	/m/02rqqmw	Warhead_Records	105	120	/business/business_operation,/business/employer,/music/record_label,/organization/organization
Several record labels including Century Media courted the band but Dungeon signed eventually to Sydney's Warhead Records in July 1999. Warhead specialised in releasing Australian heavy metal bands and Moore had been friends with the owner Brad Sims for many years. This possibly swayed the group's decision at the time. Justin Sayers decided to leave Dungeon at this point on friendly terms and played a small number of live shows with them until he was replaced by Brendan "Dakk" McDonald. McDonald had previously played guitar in a band called Dr Zeus, the same band that had supplied Dungeon with early drummer Andrew Brody. Resurrection was released in September 1999. While it sold well among the band's growing fanbase, Warhead Records folded early the next year and the album was never re-pressed. Despite this, it won them considerable notice and Dungeon supported Yngwie Malmsteen and Nevermore late in the year before making their first appearance at the Metal for the Brain festival. They would go on to play at the event every year until 2005.	While it sold well among the band's growing fanbase, Warhead Records folded early the next year and the album was never re-pressed.	/m/02rqqmw	Warhead_Records	53	68	/business/business_operation,/business/employer,/music/record_label,/organization/organization
In 1993 Gruer began to work as a sound engineer for the Sydney doom/death metal band Cruciform and in late 1993 joined the group when their bass player left. Gruer played keyboards and took over the lead vocal role. The band recorded a two track demo, one track of which was later included on the Warhead Records compilation Warhead Records Vol. 1 in 1995. A full-length album was started which generated some interest from Earache Records but the band split up before it was completed. In the meantime, Cruciform's guitarist Tony Mulhearn had introduced Gruer to artist and musician Judy Chiara and the pair began to develop musical ideas for Avrigus. With the dissolution of Cruciform, Gruer and Chiara now had more time to devote to Avrigus and recorded two tracks, "As Ivy Groweth Green" and "The Final Wish" that appearead as a demo in 1997. The following year, Warhead released the band's EP "The Final Wish". Chiara also made a guest appearance on an album called Dreamscapes by the Sydney doom band Elysium.	The band recorded a two track demo, one track of which was later included on the Warhead Records compilation Warhead Records Vol.	/m/02rqqmw	Warhead_Records	81	96	/business/business_operation,/business/employer,/music/record_label,/organization/organization
Lucy reformed Armoured Angel in 1998 with guitarist/vocalist Yuri Ward of fellow Canberra act Psychrist and drummer Steven Luff. In early 1999, the full-length album Angel of the Sixth Order was released on Sydney's Warhead Records. The long-delayed full-length album showed Armoured Angel returning to their earlier thrash roots while still heavily in the death metal vain, but suffered from poor production. More touring followed, but the original success of Armoured Angel could not be repeated, and the band split again in 1999 after Luff decided to leave the band. Warhead Records had folded up just as the album had been released, which also led to the band's demise. Ward continued to be a member of Psychrist until the band folded in 2003 and is now a member of Kill For Satan. Luck was a member of Reign Of Terror for a short period and now owns a Canberra metal merchandise store.	In early 1999, the full-length album Angel of the Sixth Order was released on Sydney's Warhead Records.	/m/02rqqmw	Warhead_Records	87	102	/business/business_operation,/business/employer,/music/record_label,/organization/organization
Lucy reformed Armoured Angel in 1998 with guitarist/vocalist Yuri Ward of fellow Canberra act Psychrist and drummer Steven Luff. In early 1999, the full-length album Angel of the Sixth Order was released on Sydney's Warhead Records. The long-delayed full-length album showed Armoured Angel returning to their earlier thrash roots while still heavily in the death metal vain, but suffered from poor production. More touring followed, but the original success of Armoured Angel could not be repeated, and the band split again in 1999 after Luff decided to leave the band. Warhead Records had folded up just as the album had been released, which also led to the band's demise. Ward continued to be a member of Psychrist until the band folded in 2003 and is now a member of Kill For Satan. Luck was a member of Reign Of Terror for a short period and now owns a Canberra metal merchandise store.	Warhead Records had folded up just as the album had been released, which also led to the band's demise.	/m/02rqqmw	Warhead_Records	0	15	/business/business_operation,/business/employer,/music/record_label,/organization/organization
Originally a five piece band formed by guitarist Jamie "Astennu" Stinson and vocalist Jamie "The Lord of Night Summoning" Marsh, they soon dropped the original drummer in favour of a drum machine and recorded the initial demo, Path To My Funeral Light in 1995. Later the same year, with the membership now down to a four ; Astennu, Marsh, bassist Incubus and keyboards by Sir Morrison, Lord Kaos recorded the album Thorns of Impurity with Astennu tracking guitars. The album was recorded for release on Sydney label Warhead Records but also found interest from Norway's Head Not Found. This caused a split in the group when Astennu relocated to Norway to pursue release for Lord Kaos there, only for the remaining band members to resist the move. The release of Thorns of Impurity was delayed due to this course of action and it was not issued (by Warhead) until late 1996. By then, Astennu had virtually completed his first Carpe Tenebrum album Majestic Nothingness with vocal contributions from Nagash of Dimmu Borgir, the guitarist for the band he would then join in 1997.	The album was recorded for release on Sydney label Warhead Records but also found interest from Norway's Head Not Found.	/m/02rqqmw	Warhead_Records	51	66	/business/business_operation,/business/employer,/music/record_label,/organization/organization
Resurrection is the second album from Australian heavy metal band Dungeon. Recording was fraught with difficulties including a brief period when first Sayers then Grose both left then rejoined the group and the low budget available resulted in poor sound quality; nonetheless Dungeon was courted by Century Media before deciding to have the album released by Warhead Records. It was released in October, 1999 as the final release from that label. The album was later completely re-recorded and released worldwide in 2005. The 2005 version featured Lord Tim (vocals, guitar, keyboards, bass), Steve Moore (drums, vocals) and Stu Marshall (guitar, vocals).	Recording was fraught with difficulties including a brief period when first Sayers then Grose both left then rejoined the group and the low budget available resulted in poor sound quality; nonetheless Dungeon was courted by Century Media before deciding to have the album released by Warhead Records.	/m/02rqqmw	Warhead_Records	284	299	/business/business_operation,/business/employer,/music/record_label,/organization/organization
By the middle of the decade, the Australian heavy metal music scene was a well-established underground culture. Small metal labels like Modern Invasion in Melbourne and Warhead Records in Sydney were strong supporters of local acts and both cities had particularly flourishing live metal circuits with established venues for bands to play. The smaller centres also harboured well-developed metal scenes, although Brisbane and particularly Perth were cut off from the growing south-east coast touring circuit by immense distances, for this reason Perth band Epitaph made the relocation to Sydney after being signed to Warhead Records. Nevertheless, Australian metal bands were receiving more media coverage than ever before. As more local releases appeared, more were being added to the playlists of community radio and to 3 Hours of Power, and a second magazine with a metal focus had started to circulate. Hot Metal had become simply HM in the early 90s in order to widen its coverage to include other alternative music styles in the wake of grunge and many metal fans had expressed a belief that the magazine no longer catered to their tastes. An offshoot of Sydney street paper On the Street, Rebel Razor was launched at the Alternative Nation Festival in 1995. Produced on news print at a cheaper cost than HM, Rebel Razor did not cover metal exclusively either but it had a more prominent local focus.	Small metal labels like Modern Invasion in Melbourne and Warhead Records in Sydney were strong supporters of local acts and both cities had particularly flourishing live metal circuits with established venues for bands to play.	/m/02rqqmw	Warhead_Records	57	72	/business/business_operation,/business/employer,/music/record_label,/organization/organization
By the middle of the decade, the Australian heavy metal music scene was a well-established underground culture. Small metal labels like Modern Invasion in Melbourne and Warhead Records in Sydney were strong supporters of local acts and both cities had particularly flourishing live metal circuits with established venues for bands to play. The smaller centres also harboured well-developed metal scenes, although Brisbane and particularly Perth were cut off from the growing south-east coast touring circuit by immense distances, for this reason Perth band Epitaph made the relocation to Sydney after being signed to Warhead Records. Nevertheless, Australian metal bands were receiving more media coverage than ever before. As more local releases appeared, more were being added to the playlists of community radio and to 3 Hours of Power, and a second magazine with a metal focus had started to circulate. Hot Metal had become simply HM in the early 90s in order to widen its coverage to include other alternative music styles in the wake of grunge and many metal fans had expressed a belief that the magazine no longer catered to their tastes. An offshoot of Sydney street paper On the Street, Rebel Razor was launched at the Alternative Nation Festival in 1995. Produced on news print at a cheaper cost than HM, Rebel Razor did not cover metal exclusively either but it had a more prominent local focus.	The smaller centres also harboured well-developed metal scenes, although Brisbane and particularly Perth were cut off from the growing south-east coast touring circuit by immense distances, for this reason Perth band Epitaph made the relocation to Sydney after being signed to Warhead Records.	/m/02rqqmw	Warhead_Records	277	292	/business/business_operation,/business/employer,/music/record_label,/organization/organization
In 1997 Misery signed to Sydney metal label Warhead Records and released their second album Revel In Blasphemy, which is regarded by many as Misery's heaviest recorded work. More touring followed, with the band playing Metal for the Brain. Another album's worth of material was set for release by 1998, but due to Warhead Records ceasing operation at the time, third album Curses would not see release until 2000 through Venomous Records.	In 1997 Misery signed to Sydney metal label Warhead Records and released their second album Revel In Blasphemy, which is regarded by many as Misery's heaviest recorded work.	/m/02rqqmw	Warhead_Records	44	59	/business/business_operation,/business/employer,/music/record_label,/organization/organization
In 1997 Misery signed to Sydney metal label Warhead Records and released their second album Revel In Blasphemy, which is regarded by many as Misery's heaviest recorded work. More touring followed, with the band playing Metal for the Brain. Another album's worth of material was set for release by 1998, but due to Warhead Records ceasing operation at the time, third album Curses would not see release until 2000 through Venomous Records.	Another album's worth of material was set for release by 1998, but due to Warhead Records ceasing operation at the time, third album Curses would not see release until 2000 through Venomous Records.	/m/02rqqmw	Warhead_Records	74	89	/business/business_operation,/business/employer,/music/record_label,/organization/organization
Astennu first came to notice as the guitarist and songwriter for the Australian black metal band Lord Kaos. The band recorded both the demo "Path to My Funeral Light" and a full-length album Thorns of Impurity in 1995. Before the album's release Astennu went to Norway and found interest in the album from Head Not Found Records however the other members of the band decided to remain in Australia and Thorns of Impurity was released by Sydney label Warhead Records in 1996. Astennu stayed in Norway and reworked some music he had written for Lord Kaos into songs for a solo project called Carpe Tenebrum.	Before the album's release Astennu went to Norway and found interest in the album from Head Not Found Records however the other members of the band decided to remain in Australia and Thorns of Impurity was released by Sydney label Warhead Records in 1996.	/m/02rqqmw	Warhead_Records	231	246	/business/business_operation,/business/employer,/music/record_label,/organization/organization
The new tour material was the subject of Front 242's new recording contract in the U.S. with Metropolis Records. Front 242 also indicated at this time that they were recording new material. However, they had little activity after 1998, making occasional appearances in Europe and Mexico, while Codenys recorded under the name Gaiden with Steve Stoll in 2001.	The new tour material was the subject of Front 242's new recording contract in the U.S. with Metropolis Records.	/m/03b8gh	Metropolis_Records	93	111	/business/business_operation,/business/employer,/internet/social_network_user,/music/record_label,/organization/organization
With a line-up consisting of Erickson, Stroht and German musician Ingo Beitz, the band toured Europe in 1998 with Off-Beat label-mate Suicide Commando, which attracted the attention of Metropolis Records, the largest industrial label in United States. The parent label of Pendragon, Metropolis distributed the album Neuralblastoma, a partnership that would endure.	With a line-up consisting of Erickson, Stroht and German musician Ingo Beitz, the band toured Europe in 1998 with Off-Beat label-mate Suicide Commando, which attracted the attention of Metropolis Records, the largest industrial label in United States.	/m/03b8gh	Metropolis_Records	185	203	/business/business_operation,/business/employer,/internet/social_network_user,/music/record_label,/organization/organization
The band's second album, Señor Smoke, was released in the United Kingdom on February 14, 2005. Since the band had been dropped from their previous American record label, a North American release of the album was delayed until February 7, 2006, when it came out on Metropolis Records.	Since the band had been dropped from their previous American record label, a North American release of the album was delayed until February 7, 2006, when it came out on Metropolis Records.	/m/03b8gh	Metropolis_Records	169	187	/business/business_operation,/business/employer,/internet/social_network_user,/music/record_label,/organization/organization
In 1997 the band's name was reverted to Clan of Xymox; Moorings recruited new live members, besides Mojca, and started touring. The band signed with the independent US label Tess Records and released Hidden Faces, produced by David M. Allen. In 1998 Clan of Xymox got signed by Metropolis Records in the USA, at a time of increasing US interest in the band, and released Creatures. That same year, 4AD re-released Clan of Xymox and Medusa in the USA, and a US tour was planned for April and May 1999. The band at that time consisted of Moorings, Mojca (bass), Rob Vonk (guitar), Sharon Soffner (keyboards), and Rui Ramos (drums).	In 1998 Clan of Xymox got signed by Metropolis Records in the USA, at a time of increasing US interest in the band, and released Creatures.	/m/03b8gh	Metropolis_Records	36	54	/business/business_operation,/business/employer,/internet/social_network_user,/music/record_label,/organization/organization
Covenant spent 1999 touring, changing record labels, and on the preparation of another album. Off-Beat Records went out of business, and dependent was created by former Off Beat employees. Together with a few selected former Off-Beat acts, Covenant joined Dependent. In addition, Covenant was signed with SubSpace Communications in Sweden, effectively ending their tenure with Memento Materia. Meanwhile, 21st Circuitry Records ceased operations, leading the three to find a new home in America with Metropolis Records (Metropolis had bought the rights to the 21st Circuitry back catalogue). Shortly thereafter, the band's first three albums and the Theremin EP were re-issued in the US under the Metropolis label.	Meanwhile, 21st Circuitry Records ceased operations, leading the three to find a new home in America with Metropolis Records (Metropolis had bought the rights to the 21st Circuitry back catalogue).	/m/03b8gh	Metropolis_Records	106	124	/business/business_operation,/business/employer,/internet/social_network_user,/music/record_label,/organization/organization
Theremin is an EP released by Covenant in 1997 by the American label 21st Circuitry. It compiled tracks which were, for the most part, previously unavailable in the US. It was re-released by Metropolis in July 1999.	It was re-released by Metropolis in July 1999.	/m/03b8gh	Metropolis_Records	22	32	/business/business_operation,/business/employer,/internet/social_network_user,/music/record_label,/organization/organization
Van Roy was one of the founders of the dependent label in 1999. It was on this new label that Suicide Commando's next releases, two singles and one EP: Hellraiser, Comatose Delusion, and Love Breeds Suicide, accompanied Suicide Commando's 2000 release, Mindstrip, which reached the number one spot on the Deutsche Alternative Charts. Later the Mindstrip album was licensed and released in North America by Metropolis Records.	Later the Mindstrip album was licensed and released in North America by Metropolis Records.	/m/03b8gh	Metropolis_Records	72	90	/business/business_operation,/business/employer,/internet/social_network_user,/music/record_label,/organization/organization
Released in 2007, one year after the band's 20th anniversary, the X20 boxset included 3 CDs (one remix CD, one best of CD and the Fuck You Bitch EP) and Suicide Commando's very first live DVD. The special remix CD and the best of album were later released as separate discs by Metropolis Records. At the end of 2007 Suicide Commando returned with the song Hate me, their first new material since the bind torture kill album, released on the noise terror volume 2 sampler on NTP/Dependent.	The special remix CD and the best of album were later released as separate discs by Metropolis Records.	/m/03b8gh	Metropolis_Records	84	102	/business/business_operation,/business/employer,/internet/social_network_user,/music/record_label,/organization/organization
In 2009 SUICIDE COMMANDO signed a deal with Out Of Line label and Metropolis Records.	In 2009 SUICIDE COMMANDO signed a deal with Out Of Line label and Metropolis Records.	/m/03b8gh	Metropolis_Records	66	84	/business/business_operation,/business/employer,/internet/social_network_user,/music/record_label,/organization/organization
On 20 November 2006, the band returned to the studio to record their third album, In Nothing We Trust. It was produced by Sean Genockey with Jack Rushton in Livingstone Studios, London. The album featured three guest vocalists, Frank Turner, Hannah Clark (the singer from the Hampshire based band, Arthur) and Paul Townsend (formerly of Hundred Reasons). Throughout recording the band uploaded short videos on YouTube for each day in the studio. The album was released on 25 June 2007 via Hideous Records.	The album was released on 25 June 2007 via Hideous Records.	/m/027nyr7	Hideous_Records	43	58	/business/business_operation,/business/employer,/music/record_label,/organization/organization
On 13 January 2007, Reuben announced that they would be running their own label, Hideous Records in order to have more control over future releases. The video for the first single from their next album, "Blood, Bunny, Larkhall" was posted on their website on 7 May 2007. The track was released on 18 June 2007.	On 13 January 2007, Reuben announced that they would be running their own label, Hideous Records in order to have more control over future releases.	/m/027nyr7	Hideous_Records	81	96	/business/business_operation,/business/employer,/music/record_label,/organization/organization
The DVD was sold at their February 2007 tour, and was originally only available on the Hideous Records website and in several independent music stores across the country.	The DVD was sold at their February 2007 tour, and was originally only available on the Hideous Records website and in several independent music stores across the country.	/m/027nyr7	Hideous_Records	87	102	/business/business_operation,/business/employer,/music/record_label,/organization/organization
The TwoByThree EP was the first EP release under the Hideous Records label, and also the first from the label to feature other bands. The EP is a three-way split between Reuben, The Ghost of a Thousand and Baddies (ex-member of Engerica, Michael Webster's new project). The EP was limited to 500 in stores and 1000 at Reuben shows.	The TwoByThree EP was the first EP release under the Hideous Records label, and also the first from the label to feature other bands.	/m/027nyr7	Hideous_Records	53	68	/business/business_operation,/business/employer,/music/record_label,/organization/organization
