paragraph	sentence	mid	title	start	end	notable_types
The band's music had evolved much in a short time, moving away from hardcore formulas toward a more innovative jazz-informed style, featuring musicianship and dynamics far beyond other bands in the genre (thus effectively removing the music from that genre). By now the group had become a de facto political force, pitting itself against rising elements of American social and political life such as the religious right, Ronald Reagan and the idle rich. The band continued touring all over the United States, as well as Europe and Australia, and gained a large underground following. While they continued to play live shows during 1983 and 1984, they took a break from releasing new records to concentrate on the Alternative Tentacles record label, which would become synonymous with DIY alternative culture. The band continued to write and perform new material during this time, which would appear on their next album (some of these early performances can be seen in the Live at DMPO's on Broadway video, originally released by Dirk Dirksen and later reissued on Rhino).	While they continued to play live shows during 1983 and 1984, they took a break from releasing new records to concentrate on the Alternative Tentacles record label, which would become synonymous with DIY alternative culture.	/m/014j0w	Alternative_Tentacles	129	150	/business/business_operation,/business/employer,/music/record_label,/organization/organization
In the late 1990s, former band members discovered problems with the amount of payments which each band member had received from their record label Alternative Tentacles. Former band members claimed that Jello Biafra had conspired to pay lower royalty rates to the band members. Although both sides agreed that the failure to pay these royalties was an accounting mistake, they were upset that Biafra failed to inform the band of the mistake after he and his co-workers discovered it.	In the late 1990s, former band members discovered problems with the amount of payments which each band member had received from their record label Alternative Tentacles.	/m/014j0w	Alternative_Tentacles	147	168	/business/business_operation,/business/employer,/music/record_label,/organization/organization
The original logo was created by Winston Smith. He later contributed artwork for the covers of In God We Trust, Inc., Plastic Surgery Disasters, Frankenchrist, Bedtime for Democracy, Give Me Convenience or Give Me Death, the back cover of the "Kill the Poor" single and the Alternative Tentacles logo. When asked about the "DK" logo in an interview, Jello Biafra explained, "...I wanted to make sure it was something simple and easy to spray-paint so people would graffiti it all over the place, and then I showed it to Winston Smith. He played around with it, came back with a bunch of designs that had the circle and slightly 3-D looking letters and he had ones with different patterns behind it. I liked the one with bricks, but ultimately I thought simple red behind it was the boldest and the best."	He later contributed artwork for the covers of In God We Trust, Inc., Plastic Surgery Disasters, Frankenchrist, Bedtime for Democracy, Give Me Convenience or Give Me Death, the back cover of the "Kill the Poor" single and the Alternative Tentacles logo.	/m/014j0w	Alternative_Tentacles	226	247	/business/business_operation,/business/employer,/music/record_label,/organization/organization
Jello Biafra (born Eric Reed Boucher; June 17, 1958) is the former lead singer and songwriter for San Francisco punk rock band Dead Kennedys, and is currently a musician and spoken word artist. After he left the Dead Kennedys, he took over the influential independent record label Alternative Tentacles, which he had co-founded in 1979 with Dead Kennedys bandmate East Bay Ray. Although now focused primarily on spoken word, he has continued as a musician in numerous collaborations.	After he left the Dead Kennedys, he took over the influential independent record label Alternative Tentacles, which he had co-founded in 1979 with Dead Kennedys bandmate East Bay Ray.	/m/014j0w	Alternative_Tentacles	87	108	/business/business_operation,/business/employer,/music/record_label,/organization/organization
Shortly after Black Flag debuted in Los Angeles, Dead Kennedys were formed in San Francisco. While the band's early releases were played in a style closer to traditional punk rock, In God We Trust, Inc. (1981) marked a shift into hardcore. Similar to Black Flag and Youth Brigade, Dead Kennedys released their albums on their own label Alternative Tentacles. In addition to Dead Kennedys albums, Alternative Tentacles released the seminal hardcore punk compilation Let Them Eat Jellybeans!	Similar to Black Flag and Youth Brigade, Dead Kennedys released their albums on their own label Alternative Tentacles.	/m/014j0w	Alternative_Tentacles	96	117	/business/business_operation,/business/employer,/music/record_label,/organization/organization
Shortly after Black Flag debuted in Los Angeles, Dead Kennedys were formed in San Francisco. While the band's early releases were played in a style closer to traditional punk rock, In God We Trust, Inc. (1981) marked a shift into hardcore. Similar to Black Flag and Youth Brigade, Dead Kennedys released their albums on their own label Alternative Tentacles. In addition to Dead Kennedys albums, Alternative Tentacles released the seminal hardcore punk compilation Let Them Eat Jellybeans!	In addition to Dead Kennedys albums, Alternative Tentacles released the seminal hardcore punk compilation Let Them Eat Jellybeans!	/m/014j0w	Alternative_Tentacles	37	58	/business/business_operation,/business/employer,/music/record_label,/organization/organization
Frankenchrist is the third album released by the American hardcore punk band Dead Kennedys in 1985 on Alternative Tentacles.	Frankenchrist is the third album released by the American hardcore punk band Dead Kennedys in 1985 on Alternative Tentacles.	/m/014j0w	Alternative_Tentacles	102	123	/business/business_operation,/business/employer,/music/record_label,/organization/organization
The album was a subject of controversy because of a poster inserted in the original record sleeve. The poster, H. R. Giger's Landscape #XX, or Penis Landscape, was a painting depicting rows of penises and vulvae. The band's vocalist was brought to trial for distributing harmful matter to minors, and though the case did not result in a conviction, Jello Biafra's Alternative Tentacles was driven almost to bankruptcy.	The band's vocalist was brought to trial for distributing harmful matter to minors, and though the case did not result in a conviction, Jello Biafra's Alternative Tentacles was driven almost to bankruptcy.	/m/014j0w	Alternative_Tentacles	151	172	/business/business_operation,/business/employer,/music/record_label,/organization/organization
Dischord was a local label in the early days of hardcore, and is one of the more famous independent labels, along with the likes of Alternative Tentacles, SST Records, and Touch & Go Records. Early releases by Dischord were relatively well produced compared to other punk recordings of the time. Minor Threat's work is an example of these higher production values.	Dischord was a local label in the early days of hardcore, and is one of the more famous independent labels, along with the likes of Alternative Tentacles, SST Records, and Touch & Go Records.	/m/014j0w	Alternative_Tentacles	132	153	/business/business_operation,/business/employer,/music/record_label,/organization/organization
On June 16 and 17, 2008, a line up of Osborne, original drummer Mike Dillard, and Dale Crover (playing bass) played two shows at the Great American Music Hall in San Francisco in honor of Jello Biafra's 50th birthday. Both sets were composed of songs from The Mangled Demos, a collection of early material released on the Alternative Tentacles record label in 2005.	Both sets were composed of songs from The Mangled Demos, a collection of early material released on the Alternative Tentacles record label in 2005.	/m/014j0w	Alternative_Tentacles	104	125	/business/business_operation,/business/employer,/music/record_label,/organization/organization
Give Me Convenience or Give Me Death is a compilation album by the American hardcore punk band the Dead Kennedys. It was released in June 1987 through frontman Jello Biafra's record label Alternative Tentacles.	It was released in June 1987 through frontman Jello Biafra's record label Alternative Tentacles.	/m/014j0w	Alternative_Tentacles	74	95	/business/business_operation,/business/employer,/music/record_label,/organization/organization
Fresh Fruit for Rotting Vegetables is the debut studio album by the American hardcore punk band Dead Kennedys. It was first released on September 2, 1980 through Cherry Red Records in the United Kingdom and later issued by Jello Biafra's own Alternative Tentacles label in the United States. It has been certified gold by the BPI. The best selling and generally the most critically acclaimed album by the Dead Kennedys, Fresh Fruit for Rotting Vegetables has become a major staple of American punk.	It was first released on September 2, 1980 through Cherry Red Records in the United Kingdom and later issued by Jello Biafra's own Alternative Tentacles label in the United States.	/m/014j0w	Alternative_Tentacles	131	152	/business/business_operation,/business/employer,/music/record_label,/organization/organization
During a brief concert at the Tool and Die club in San Francisco, Dead Kennedys frontman and Alternative Tentacles overseer Jello Biafra witnessed their performance and became a fervent fan. Biafra invited the group to open for the Dead Kennedys and T.S.O.L. at the Whisky a Go Go in Los Angeles, and soon made an offer that would launch their recording career: if they could get someone to lend them studio time, Alternative Tentacles would reimburse the studio when the album was complete. The band then returned to San Antonio to record at BOSS Studios (a.k.a. Bob O'Neill's Sound Studios, a.k.a. the Boss). However, the Mathews brothers did not enter the studio with Haynes and Leary; the two had quit following a physical altercation between Scott Mathews and Haynes. The bass position was taken over by Bill Jolly, who would play on the Surfers' next two releases, and a number of drummers participated. The last of these, King Coffey (born Jeffrey Coffey), is still with the band to this day.	During a brief concert at the Tool and Die club in San Francisco, Dead Kennedys frontman and Alternative Tentacles overseer Jello Biafra witnessed their performance and became a fervent fan.	/m/014j0w	Alternative_Tentacles	93	114	/business/business_operation,/business/employer,/music/record_label,/organization/organization
During a brief concert at the Tool and Die club in San Francisco, Dead Kennedys frontman and Alternative Tentacles overseer Jello Biafra witnessed their performance and became a fervent fan. Biafra invited the group to open for the Dead Kennedys and T.S.O.L. at the Whisky a Go Go in Los Angeles, and soon made an offer that would launch their recording career: if they could get someone to lend them studio time, Alternative Tentacles would reimburse the studio when the album was complete. The band then returned to San Antonio to record at BOSS Studios (a.k.a. Bob O'Neill's Sound Studios, a.k.a. the Boss). However, the Mathews brothers did not enter the studio with Haynes and Leary; the two had quit following a physical altercation between Scott Mathews and Haynes. The bass position was taken over by Bill Jolly, who would play on the Surfers' next two releases, and a number of drummers participated. The last of these, King Coffey (born Jeffrey Coffey), is still with the band to this day.	at the Whisky a Go Go in Los Angeles, and soon made an offer that would launch their recording career: if they could get someone to lend them studio time, Alternative Tentacles would reimburse the studio when the album was complete.	/m/014j0w	Alternative_Tentacles	155	176	/business/business_operation,/business/employer,/music/record_label,/organization/organization
Outside of New York, London, and Cleveland, San Francisco probably had the earliest punk scene, at least as far back as 1976. The scene was aided by San Francisco's famously laid back attitude towards alternative lifestyles, and the legendary record label Alternative Tentacles. Crime and The Nuns were first, followed by Chrome, The Mutants, The Units, VKTMS, AlieNation, The Contractions, Angst, The Sleepers, Pop-O-Pies, Sick Pleasure (aka Code of Honor), Crucifix, Negative Trend, The Avengers (band), SSI, Flipper and Pink Section. The most influential San Francisco hardcore band was the Dead Kennedys, whose frontman, Jello Biafra, became a noted social activist even after the band's last show at the On Broadway, which included The Black Athletes and Naked Lady Wrestlers on the card. Many hardcore bands moved to San Francisco, including legends MDC, as well as D.R.I., Tales of Terror (from Sacramento, CA. who made Kurt Cobain's Top 50 list of favorite Bands and essential listening), The Dicks and Rhythm Pigs Fat Wreck Chords (all from Texas).	The scene was aided by San Francisco's famously laid back attitude towards alternative lifestyles, and the legendary record label Alternative Tentacles.	/m/014j0w	Alternative_Tentacles	130	151	/business/business_operation,/business/employer,/music/record_label,/organization/organization
Despite previously being diagnosed with chronic schizophrenia, Willis gained an enormous cult following in the 1990s. This following began mainly upon the release of Greatest Hits in 1995 on the Alternative Tentacles label. The album was released at the urging of punk rock pioneer Jello Biafra who compiled its tracklist. In addition to a large body of solo musical work, Willis fronted his own punk rock band, the Wesley Willis Fiasco. He was also a visual artist long before his forays into music, producing hundreds of intricate, unusual, colored ink-pen drawings, most of them of Chicago streetscapes and CTA buses.	This following began mainly upon the release of Greatest Hits in 1995 on the Alternative Tentacles label.	/m/014j0w	Alternative_Tentacles	77	98	/business/business_operation,/business/employer,/music/record_label,/organization/organization
In 1992 Matt Wobensmith's zine Outpunk also became a record label, and began to release its own queercore compilations, singles, and albums, and was crucial to the development of queercore. The first recordings by Tribe 8 and Pansy Division were released by the label. Some of the bands appearing later in the mid-1990s on the label include Sta-Prest, Cypher in the Snow and Behead the Prophet, No Lord Shall Live. It was also at this time in the early 1990s that Riot Grrrl emerged. "In many ways the angry- girl genre owes its existence to punk homocore 'zines..." writes Emily White in Rock She Wrote. It follows that many of the participants, their zines, and bands like Excuse 17 were involved in both movements. Along with Outpunk, independent record labels such as Alternative Tentacles, K Records, Kill Rock Stars, Lookout! Records, Yoyo Recordings and Candy Ass Records also supported and released material by queercore artists but in the mid to late 1990s several other small labels, alongside Outpunk, sprung up solely devoted to queercore.	Along with Outpunk, independent record labels such as Alternative Tentacles, K Records, Kill Rock Stars, Lookout!	/m/014j0w	Alternative_Tentacles	54	75	/business/business_operation,/business/employer,/music/record_label,/organization/organization
D.H. Peligro is the frontman for his band called Peligro (Spanish for "Danger") and has released three albums: Peligro (released in 1995 on Biafra's Alternative Tentacles record label, but deleted from the catalog in 2001), Welcome to America and Sum of Our Surroundings, which won Rock Album of the Year from the American Independent Music Awards. Peligro's sound is known to be an eclectic combination of punk, reggae, funk and heavy metal. He recently recorded a punk rock cover of Jimi Hendrix's "Purple Haze", which was nominated for a Grammy Award. D.H. Peligro has also fronted the bands Reverend Jones and the Cool Aid Choir and Al Sharpton's Hair and the Hellions. He appears as an interview subject in the 2003 documentary Afro-Punk.	D.H. Peligro is the frontman for his band called Peligro (Spanish for "Danger") and has released three albums: Peligro (released in 1995 on Biafra's Alternative Tentacles record label, but deleted from the catalog in 2001), Welcome to America and Sum of Our Surroundings, which won Rock Album of the Year from the American Independent Music Awards.	/m/014j0w	Alternative_Tentacles	149	170	/business/business_operation,/business/employer,/music/record_label,/organization/organization
East Bay Ray was involved in all the band’s early studio recordings and is credited for mixing and producing the band's first single, "California Uber Alles"/"Man with the Dogs," the band's first LP Fresh Fruit for Rotting Vegetables with Oliver Dicicco, the EP In God We Trust, Inc. and he mixed "Holiday in Cambodia"/"Police Truck." Ray was one of the founders of the original Alternative Tentacles Records, set up for other artists and Dead Kennedys, and was a partner in it until the mid-1980s. Ray recently mixed and produced two CDs of live Dead Kennedys recordings, Mutiny on the Bay and Live at the Deaf Club.	" Ray was one of the founders of the original Alternative Tentacles Records, set up for other artists and Dead Kennedys, and was a partner in it until the mid-1980s.	/m/014j0w	Alternative_Tentacles	46	75	/business/business_operation,/business/employer,/music/record_label,/organization/organization
In 1987, Eugene, Ojo Taylor and another investor formed Brainstorm Artists International (B.A.I.), which became an important label in the development of the West Coast Christian alternative music scene. Though the record label focused primarily on modern rock artists, B.A.I also released significant contributions from early rap and hip-hop artists like Dynamic Twins and Freedom of Soul. It was also at this time that Eugene discovered future Myrrh Records artist Anointed and went on to produce their first few albums.	It was also at this time that Eugene discovered future Myrrh Records artist Anointed and went on to produce their first few albums.	/m/0153rt	Myrrh_Records	55	68	/business/business_operation,/business/employer,/music/record_label,/organization/organization
Miller's musical career initially took off after singer Sam Phillips discovered a demo tape by the artist and turned it over to friends at Myrrh Records. Miller was signed to a contract and recorded her first solo album, Meet Julie Miller for the label, released in 1990. This album included backing vocals from Shawn Colvin, Victoria Williams, Amy Grant, Kelly Willard and Russ Taff.	Miller's musical career initially took off after singer Sam Phillips discovered a demo tape by the artist and turned it over to friends at Myrrh Records.	/m/0153rt	Myrrh_Records	139	152	/business/business_operation,/business/employer,/music/record_label,/organization/organization
Keaggy's record label during the early part of the decade was Myrrh Records. 1980's Ph'lip Side features the uptempo "Sunday School" and the gentle "Little Ones, an early anthem for the pro-life movement." The following year saw the release of Town to Town, noted for what has become a concert staple "Let Everything Else Go." It also included Keaggy's arrangement of "Rise Up O Men of God." This would begin a trend in which Keaggy would frequently feature a hymn on his albums. In 1982, Keaggy released Play Thru Me, noted for its upbeat classic, "Morning Light" as well as the slide-guitar instrumental workout entitled "Happy."	Keaggy's record label during the early part of the decade was Myrrh Records.	/m/0153rt	Myrrh_Records	62	75	/business/business_operation,/business/employer,/music/record_label,/organization/organization
She began her musical career in the early 1980s, singing background vocals for Christian artists Mark Heard and Randy Stonehill. Phillips was signed to a solo contract with Myrrh Records - under her given name - and recorded four Christian pop albums, Beyond Saturday Night, Dancing with Danger, Black and White in a Grey World and, finally, The Turning, which teamed her with producer and future husband, T-Bone Burnett. Several became Top 10 singles on Christian radio and Myrrh records promoted her as "the Christian Cyndi Lauper". Phillips was never comfortable with this image, and it was a bone of contention between her and her label. She began using the name "Sam" professionally in 1988 when she left Myrrh Records and signed with Virgin Records in order to distance herself from her prior persona.	Phillips was signed to a solo contract with Myrrh Records - under her given name - and recorded four Christian pop albums, Beyond Saturday Night, Dancing with Danger, Black and White in a Grey World and, finally, The Turning, which teamed her with producer and future husband, T-Bone Burnett.	/m/0153rt	Myrrh_Records	44	57	/business/business_operation,/business/employer,/music/record_label,/organization/organization
She began her musical career in the early 1980s, singing background vocals for Christian artists Mark Heard and Randy Stonehill. Phillips was signed to a solo contract with Myrrh Records - under her given name - and recorded four Christian pop albums, Beyond Saturday Night, Dancing with Danger, Black and White in a Grey World and, finally, The Turning, which teamed her with producer and future husband, T-Bone Burnett. Several became Top 10 singles on Christian radio and Myrrh records promoted her as "the Christian Cyndi Lauper". Phillips was never comfortable with this image, and it was a bone of contention between her and her label. She began using the name "Sam" professionally in 1988 when she left Myrrh Records and signed with Virgin Records in order to distance herself from her prior persona.	She began using the name "Sam" professionally in 1988 when she left Myrrh Records and signed with Virgin Records in order to distance herself from her prior persona.	/m/0153rt	Myrrh_Records	68	81	/business/business_operation,/business/employer,/music/record_label,/organization/organization
She began her musical career in the early 1980s, singing background vocals for Christian artists Mark Heard and Randy Stonehill. Phillips was signed to a solo contract with Myrrh Records - under her given name - and recorded four Christian pop albums, Beyond Saturday Night, Dancing with Danger, Black and White in a Grey World and, finally, The Turning, which teamed her with producer and future husband, T-Bone Burnett. Several became Top 10 singles on Christian radio and Myrrh records promoted her as "the Christian Cyndi Lauper". Phillips was never comfortable with this image, and it was a bone of contention between her and her label. She began using the name "Sam" professionally in 1988 when she left Myrrh Records and signed with Virgin Records in order to distance herself from her prior persona.	Phillips was signed to a solo contract with Myrrh Records - under her given name - and recorded four Christian pop albums, Beyond Saturday Night, Dancing with Danger, Black and White in a Grey World and, finally, The Turning, which teamed her with producer and future husband, T-Bone Burnett.	/m/0153rt	Myrrh_Records	44	57	/business/business_operation,/business/employer,/music/record_label,/organization/organization
She began her musical career in the early 1980s, singing background vocals for Christian artists Mark Heard and Randy Stonehill. Phillips was signed to a solo contract with Myrrh Records - under her given name - and recorded four Christian pop albums, Beyond Saturday Night, Dancing with Danger, Black and White in a Grey World and, finally, The Turning, which teamed her with producer and future husband, T-Bone Burnett. Several became Top 10 singles on Christian radio and Myrrh records promoted her as "the Christian Cyndi Lauper". Phillips was never comfortable with this image, and it was a bone of contention between her and her label. She began using the name "Sam" professionally in 1988 when she left Myrrh Records and signed with Virgin Records in order to distance herself from her prior persona.	She began using the name "Sam" professionally in 1988 when she left Myrrh Records and signed with Virgin Records in order to distance herself from her prior persona.	/m/0153rt	Myrrh_Records	68	81	/business/business_operation,/business/employer,/music/record_label,/organization/organization
In addition to these hit singles, Green also had radio hits with songs such as "Love and Happiness", his cover of the Bee Gees' "How Can You Mend a Broken Heart", "Simply Beautiful", "What a Wonderful Thing Love Is" and "Take Me to the River", later covered successfully by new wave band Talking Heads and blues artist Syl Johnson. Green continued to record successful R&B hits in the next several years including "Livin' for You", "Let's Get Married", "Sha-La-La (Makes Me Happy)", "L-O-V-E (Love)" and "Full of Fire". By the time Green released the album, The Belle Album in 1977, however, Green's record sales had plummeted, partially due to Green's own personal issues during this time and his desire to become a minister. His last Hi Records album, Truth n' Time, was released in 1978 and failed to become a success. Two years later, he left Hi for Myrrh Records and recorded only gospel music for the next decade and a half.	Two years later, he left Hi for Myrrh Records and recorded only gospel music for the next decade and a half.	/m/0153rt	Myrrh_Records	32	45	/business/business_operation,/business/employer,/music/record_label,/organization/organization
