paragraph	sentence	mid	title	start	end	notable_types
In 1906, Sears introduced the Oxford disc to replace the earlier Harvard brand. These discs in the 11000 and 16000 series, were produced by Leeds & Catlin. The 1908 Sears catalot introduced 7-inch discs listed at 21 cents that were pressed by Columbia and numbered in the 7000 series. In 1909 10-inch discs from Zonophone, retailing at 30 cents, were introduced. Fall 1911 saw Sears return to Columbia for pressings. These later discs are the most commonly found. The brand was phased out in 1916 for the new Silvertone brand, although records with the Oxford label were still being shipped in late 1917. Recordings appearing on the Oxford label could be recorded anywere from 1901 to 1916. It should be noted that take number is important to dating the recording, particularly for Columbia pressings. Cal Stewart's "I'm Old but I'm Awfully Tough" (Oxford 22) first appeared on Columbia in 1901, but the issued take number of was probably recorded much later.	The brand was phased out in 1916 for the new Silvertone brand, although records with the Oxford label were still being shipped in late 1917.	/m/026r0zf	Silvertone_Records_(1916)	45	55	/business/business_operation,/business/employer,/music/record_label,/organization/organization
Kresge is married to Kamilla Vanilla (also formerly of the HorrorPops) and was also part-owner of Dead Body Records, as well as the founder and owner of the now-defunct Key Lime Pie Records, which released several early recordings by AFI. He has produced for several other bands, including Tiger Army, Heckle, Graveyard Shift (band) and 12 Step Rebels.	Kresge is married to Kamilla Vanilla (also formerly of the HorrorPops) and was also part-owner of Dead Body Records, as well as the founder and owner of the now-defunct Key Lime Pie Records, which released several early recordings by AFI.	/m/02qr70_	Key_Lime_Pie_Records	169	189	/business/business_operation,/business/employer,/internet/social_network_user,/music/record_label,/organization/organization
Dork is an EP by American punk rock band AFI, released on March 2, 1993 on Key Lime Pie Records. It is a split 7" with Loose Change (of which future AFI guitarist Jade Puget was a member), with AFI's Dork on one side and Loose Change's Stick Around on the other side.	Dork is an EP by American punk rock band AFI, released on March 2, 1993 on Key Lime Pie Records.	/m/02qr70_	Key_Lime_Pie_Records	75	95	/business/business_operation,/business/employer,/internet/social_network_user,/music/record_label,/organization/organization
Behind the Times is an EP by AFI released on 11 June 1993 on Key Lime Pie Records. This release was limited to 500 copies, in addition to test pressings. The 1st pressing of 400 and a 2nd pressing of 100 all on black vinyl. They can be distinguished, as the first pressing of the vinyl is translucent when viewed in front of light and the 2nd pressing is opaque black. Some of the first pressings also included an alternate version of the sleeve and a small thank-you list in the form of an additional insert, which was not included with all copies. As of 2007 it has reached a value often over $200 on eBay auctions.	Behind the Times is an EP by AFI released on 11 June 1993 on Key Lime Pie Records.	/m/02qr70_	Key_Lime_Pie_Records	61	81	/business/business_operation,/business/employer,/internet/social_network_user,/music/record_label,/organization/organization
Eddie Picnic's All Wet is a live EP by American rock band AFI. It was recorded on December 29, 1993 during a show at The Phoenix Theater in Petaluma, California and released on March 18, 1994 through Key Lime Pie Records. 201 copies were produced on pink vinyl for its first pressing. The second pressing was limited to 100. It is currently out of print.	It was recorded on December 29, 1993 during a show at The Phoenix Theater in Petaluma, California and released on March 18, 1994 through Key Lime Pie Records.	/m/02qr70_	Key_Lime_Pie_Records	137	157	/business/business_operation,/business/employer,/internet/social_network_user,/music/record_label,/organization/organization
The band self-financed their first album, Six Sixty, before being signed by Emanon Records in 2004. Their second album, Call It What You Want, was produced by Kevin Churko (Robert "Mutt" Lange's chief engineer), and Mitch Allan, lead singer for SR-71 and author of the Bowling for Soup hit, 1985. Call It What You Want features the hit single, "Here We Go Again", which reached No. 1 on KISS 105.5 FM in Salisbury, Maryland. The song has continued climbing the commercial and college radio charts. JParis' music has been used in the soundtrack to Melrose Place and Beverly Hills 90210 second season DVD box sets.	The band self-financed their first album, Six Sixty, before being signed by Emanon Records in 2004.	/m/02qrkc0	Emanon_Records	76	90	/business/business_operation,/business/employer,/music/record_label,/organization/organization
In 2003, they released an EP called Sick of Modern Art on their own label, Tarantulas Records.	In 2003, they released an EP called Sick of Modern Art on their own label, Tarantulas Records.	/m/02rphs	Tarantulas_Records	75	93	/business/business_operation,/business/employer,/music/record_label,/organization/organization
Sick of Modern Art is an EP by The Explosion. It was released on April 22, 2003 on The Explosion's label, Tarantulas Records.	It was released on April 22, 2003 on The Explosion's label, Tarantulas Records.	/m/02rphs	Tarantulas_Records	60	78	/business/business_operation,/business/employer,/music/record_label,/organization/organization
The band's first major release was 2005's "Neon Nights Electric Lives" (produced by Matt Squire) released on Tarantulas Records/Platform Group/Fontana in March 2005. That album was followed up in 2006 by "Blank Screens" (produced by Birnbaum and Bittner) via ReIgnition Records (the sister label to Law of Inertia magazine). Other prior releases include 2004's "Amphibian" single, 2003's "The Past and Now" single, and 2003's "The Cost of Living" 'full-length demo,' released by the band's own imprint Primary Records and the now defunct Boston-based label Red Dawn Records. More can be read about these releases in the news and records archives at the band's Official website.	The band's first major release was 2005's "Neon Nights Electric Lives" (produced by Matt Squire) released on Tarantulas Records/Platform Group/Fontana in March 2005.	/m/02rphs	Tarantulas_Records	109	127	/business/business_operation,/business/employer,/music/record_label,/organization/organization
Originally signed to Tarantulas Records, Darker My Love released its first EP in 2004. Their debut LP, recorded in 2005, was released on August 22, 2006, on Dangerbird Records. In Spring 2006, Presley and Barbato became members of the prolific British post-punk group The Fall, and are both featured prominently on The Fall's 2007 album Reformation Post TLC, whose title refers to the circumstances surrounding their addition. On August 28, 2007, the band released a 12-inch 45 rpm split record with Denver-based rock group Moccasin, featuring the song "Hair Decisions." The record was the first release on L.A.-based label I Hate Rock N Roll.	Originally signed to Tarantulas Records, Darker My Love released its first EP in 2004.	/m/02rphs	Tarantulas_Records	21	39	/business/business_operation,/business/employer,/music/record_label,/organization/organization
The Bronx formed in 2002 with an initial lineup of singer Matt Caughthran, guitarist Joby J. Ford, bassist James Tweedy, and drummer Jorma Vik. After only twelve live performances the band signed to major label Island Def Jam, but opted to put out their early releases independently. They released two demos, both titled Sure Death, in 2002 on their own label, White Drugs. Their first single, "Bats!", was released in July 2003 on Tarantulas Records. Their debut album The Bronx was released in August 2003 through White Drugs and Ferret Records. Later that year Wichita Recordings released La Muerte Viva, an EP exclusive to the United Kingdom and Australia. Wichita has also released all of the singles from The Bronx's albums, beginning with "They Will Kill Us All (Without Mercy)" and "False Alarm" in 2004, which were made into music videos and reached #65 and #73 on the UK Singles Chart, respectively.	", was released in July 2003 on Tarantulas Records.	/m/02rphs	Tarantulas_Records	32	50	/business/business_operation,/business/employer,/music/record_label,/organization/organization
She was personally invited to tour with Jamie T after he attended her second-ever solo gig. She has also toured with a number of other musicians from the UK and beyond, including Adam Green from the anti-folk band The Moldy Peaches. She performed at the 2007 O2 Wireless Festival and also performed at the first Underage Festival in August 2007 at Victoria Park, East London, before releasing her debut EP "London Town" on WayOutWest Records.	She performed at the 2007 O2 Wireless Festival and also performed at the first Underage Festival in August 2007 at Victoria Park, East London, before releasing her debut EP "London Town" on WayOutWest Records.	/m/02x71wl	WayOutWest_Records	190	208	/business/business_operation,/music/record_label,/organization/organization
The band formed in 2004, although some of the songs they perform were written before this, with some dating back to 2001. Their debut single "Space and the Woods" was released through WayOutWest Records from the band's Zarcorp Demo EP in March 2007. This was limited to 500 copies only. The band's second single "Bathroom Gurgle" was produced by Erol Alkan and was released in September 2007 by Moshi Moshi Records. Like their previous release, this was also limited to 500 copies. Their third single, "The Bears Are Coming", was released on 12" and download only, with 7" versions being sold exclusively on their February 2008 tour. This was released through the band's own Zarcorp label. Their fourth single, a double A-side including a new version of "Space and the Woods" as well as "Focker", was released following a headline slot on the Levi's Ones To Watch tour.	Their debut single "Space and the Woods" was released through WayOutWest Records from the band's Zarcorp Demo EP in March 2007.	/m/02x71wl	WayOutWest_Records	62	80	/business/business_operation,/music/record_label,/organization/organization
In the 1990s, largely ignored hill country blues gained minor recognition in both blues and alternative rock music circles with North Mississippi artists R. L. Burnside and Junior Kimbrough. Blues performers explored a range of musical genres, as can be seen, for example, from the broad array of nominees of the yearly Blues Music Awards, previously named W. C. Handy Awards or of the Grammy Awards for Best Contemporary and Traditional Blues Album. The Bilboard Blues Album chart monitors and therefore provides an overview over the current blues production. Contemporary blues music is nurtured by several blues labels such as: Alligator Records, Ruf Records, Severn Records, Chess Records (MCA), Delmark Records, NorthernBlues Music, Fat Possum Records and Vanguard Records (Artemis Records). Some labels are famous for their rediscovering and remastering of blues rarities such as Arhoolie Records, Smithsonian Folkways Recordings (heir of Folkways Records) and Yazoo Records (Shanachie Records).	Some labels are famous for their rediscovering and remastering of blues rarities such as Arhoolie Records, Smithsonian Folkways Recordings (heir of Folkways Records) and Yazoo Records (Shanachie Records).	/m/03_jhh	Shanachie_Records	185	202	/business/business_operation,/business/employer,/music/record_label,/organization/organization
Bait Ham (Warm House) was released in 1984 and included such hits as Yad Beyad (Hand In Hand), Itcha Halayla (With You Tonight) and the title track. The album quickly went gold. In December that year, Haza released what was to become the turning-point of her career, a collection of Yemenite songs, simply titled Yemenite Songs. Despite lukewarm radio airplay, the album went on to become a best-seller, quickly reaching platinum status. This LP was reissued in the United States by Shanachie Records under the title Fifty Gates of Wisdom.	This LP was reissued in the United States by Shanachie Records under the title Fifty Gates of Wisdom.	/m/03_jhh	Shanachie_Records	45	62	/business/business_operation,/business/employer,/music/record_label,/organization/organization
On September 16, 2008, Clinton released a solo album, George Clinton and His Gangsters of Love on Shanachie Records. Largely a covers album, Gangsters features guest appearances from Sly Stone, El DeBarge, Red Hot Chili Peppers, RZA, Carlos Santana, gospel singer Kim Burrell and more.	On September 16, 2008, Clinton released a solo album, George Clinton and His Gangsters of Love on Shanachie Records.	/m/03_jhh	Shanachie_Records	98	115	/business/business_operation,/business/employer,/music/record_label,/organization/organization
Several album followed in the 1990s on Shanachie Records and Ras Records, often recorded with Sly and Robbie, with Dayes leaving the group again around 1994, with Reginald Taylor replacing him.	Several album followed in the 1990s on Shanachie Records and Ras Records, often recorded with Sly and Robbie, with Dayes leaving the group again around 1994, with Reginald Taylor replacing him.	/m/03_jhh	Shanachie_Records	39	56	/business/business_operation,/business/employer,/music/record_label,/organization/organization
In 2003, Metalheadz signees Dylan and Robyn Chaos (aka Faith In Chaos) pushed the harder sound of drum and bass by founding the Freak Recordings label and sublabels Obscene and Tech Freak, together with artists like Technical Itch, Limewax, Counterstrike, SPL, Current Value, and many others, leading to the creation of the Therapy Sessions drum and bass festivals in London. The Therapy Sessions franchise quickly expanded worldwide with greater repercussion on Eastern Europe with an attendance of more than 10.000 fans in cities like St. Petesburg.	In 2003, Metalheadz signees Dylan and Robyn Chaos (aka Faith In Chaos) pushed the harder sound of drum and bass by founding the Freak Recordings label and sublabels Obscene and Tech Freak, together with artists like Technical Itch, Limewax, Counterstrike, SPL, Current Value, and many others, leading to the creation of the Therapy Sessions drum and bass festivals in London.	/m/06q4g_	Freak_Recordings	128	144	/business/business_operation,/business/employer,/music/record_label,/organization/organization
Limewax (born Maxim Anokhin, 1988) is a drum and bass music producer and DJ from Kamianets-Podilskyi, Ukraine. His style is described as inspired by harsher sounds of hardstep and darkstep; however, he is most recognizable as a Skullstep artist. He has collaborated with artists such as The Panacea, Current Value, Donny, Proket, and Dylan.	He has collaborated with artists such as The Panacea, Current Value, Donny, Proket, and Dylan.	/m/06q4g_	Freak_Recordings	88	93	/business/business_operation,/business/employer,/music/record_label,/organization/organization
Future Signal are a Drum and Bass group from London, UK. Composed of Tom Parkin, Mike Quick and James Gorely they have been releasing their music since 2006. They have celebrated releases on Subtitles, Freak Recordings, Habit and Disturbed Recordings.	They have celebrated releases on Subtitles, Freak Recordings, Habit and Disturbed Recordings.	/m/06q4g_	Freak_Recordings	44	60	/business/business_operation,/business/employer,/music/record_label,/organization/organization
Therapy Sessions is a franchise of drum and bass events created by Anger Management booking agency and UK based label Freak Recordings.	Therapy Sessions is a franchise of drum and bass events created by Anger Management booking agency and UK based label Freak Recordings.	/m/06q4g_	Freak_Recordings	118	134	/business/business_operation,/business/employer,/music/record_label,/organization/organization
Nanotek, born Mark Christiansen, is an international Drum & Bass and Dubstep producer and DJ from Wellington, New Zealand. Nanotek gained international recognition in 2007 with releases on darkstep labels such as Freak Recordings and Obscene Recordings. More recent projects include collaborations with artists such as Counterstrike, Current Value and Gein as well as Christiansen's first release on his self titled label, Nanotek.	Nanotek gained international recognition in 2007 with releases on darkstep labels such as Freak Recordings and Obscene Recordings.	/m/06q4g_	Freak_Recordings	90	106	/business/business_operation,/business/employer,/music/record_label,/organization/organization
His break came in late 2006 when Dylan, owner of Freak Recordings, signed two of his tracks, Acid Burn and Deadly Force, to his sister label Obscene Recordings.
This was a turning point for Christiansen, who gained international recognition from DJs such as Current Value, SPL, Limewax, B-Key, Tech Itch, Gein, and Counterstrike, as a result.	His break came in late 2006 when Dylan, owner of Freak Recordings, signed two of his tracks, Acid Burn and Deadly Force, to his sister label Obscene Recordings.	/m/06q4g_	Freak_Recordings	49	65	/business/business_operation,/business/employer,/music/record_label,/organization/organization
Through savvy investments, Phillips soon amassed a fortune. He was one of the first investors with Roy Scott in Holiday Inn, a new motel chain that was about to go national; he became involved with the chain shortly after selling the rights to Elvis Presley to RCA for $35,000 which he multiplied many times over the years with Holiday Inn. He would also create two different subsidiary recording labels—Phillips International and Holiday Inn Records. Neither would match the success or influence of Sun, which Phillips ultimately sold to Shelby Singleton in the 1960s.	He would also create two different subsidiary recording labels—Phillips International and Holiday Inn Records.	/m/06zm_rx	Holiday_Inn_Records	90	109	/business/business_operation,/music/record_label,/organization/organization
Wilson was the founder of many different kind of companies such as Holiday Inn Records. After selling his shares of Holiday Inn, he formed Wilson World, another hotel chain.	Wilson was the founder of many different kind of companies such as Holiday Inn Records.	/m/06zm_rx	Holiday_Inn_Records	67	86	/business/business_operation,/music/record_label,/organization/organization
He started out as a session musician at Sun Studios, playing any side instrument he could in the hopes of someday making his own music there. He eventually played on a small label started by Sam Phillips called Flip records which got him enough attention to record a couple singles for Sun Records and Holiday Inn Records. By all accounts the singer was not held in much regard by Phillips, but Feathers often made the audacious claim that he had arranged "That's All Right" and "Blue Moon of Kentucky" for Elvis Presley and recorded "Good Rockin' Tonight" months before Presley. He also claimed that his "We're Getting Closer (To Being Apart)" had been intended to be Elvis' sixth single for Sun. He did, however, get his name on one of Elvis' Sun records, "I Forgot To Remember To Forget" when the writer Stan Kesler asked him to record a demo of the song.	He eventually played on a small label started by Sam Phillips called Flip records which got him enough attention to record a couple singles for Sun Records and Holiday Inn Records.	/m/06zm_rx	Holiday_Inn_Records	160	179	/business/business_operation,/music/record_label,/organization/organization
Rock-and-roll, country music, and rockabilly artists, including Johnny Cash, Elvis Presley, Carl Perkins, Roy Orbison, Charlie Feathers, Ray Harris, Warren Smith, Charlie Rich, and Jerry Lee Lewis, recorded there throughout the mid to late 1950s until the studio outgrew its Union Avenue location. Sam Phillips opened the larger Sam C. Phillips Recording Studio, better known as Phillips Recording, in 1959 to take the place of the older facility. Since Sam had invested in the Holiday Inn Hotel chain earlier, he also recorded artists starting in 1963 on the label Holiday Inn Records for Kemmons Wilson. In 1957, Bill Justis recorded his Grammy Hall of Fame song "Raunchy" for Sam Phillips and worked as a musical director at Sun Records.	Since Sam had invested in the Holiday Inn Hotel chain earlier, he also recorded artists starting in 1963 on the label Holiday Inn Records for Kemmons Wilson.	/m/06zm_rx	Holiday_Inn_Records	118	137	/business/business_operation,/music/record_label,/organization/organization
Miller disbanded Holiday Records not long after Haley was moved to Essex and the tracks Haley recorded for Holiday were rolled into the Essex catalog. Later, in the early 60's, Haley recorded for Sam Phillips on Holiday Inn Records formed by D. Wayne Foster and Kemmons Wilson.	Later, in the early 60's, Haley recorded for Sam Phillips on Holiday Inn Records formed by D. Wayne Foster and Kemmons Wilson.	/m/06zm_rx	Holiday_Inn_Records	61	80	/business/business_operation,/music/record_label,/organization/organization
Andy Starr (born "Franklin Delano Gulledge" on October 21, 1932 near Combs, Arkansas; died September 12, 2003 in Fayetteville, Arkansas) was a rockabilly musician once described by Billboard as "one of the more noteworthy Presley disciples." However poor song selection and other difficulties made him never chart. "Andy Starr" recorded on Holiday Inn Records as Frank Starr. He spent time performing in Alaska as Frank Starr, did Gospel music, and also ran as a long-shot candidate in the United States presidential election, 1996.	"Andy Starr" recorded on Holiday Inn Records as Frank Starr.	/m/06zm_rx	Holiday_Inn_Records	25	44	/business/business_operation,/music/record_label,/organization/organization
In 1956, Griffin contracted with the Dallas radio show Big D Jamboree, and MGM Records picked up his previous Lin Records releases for national distribution. Though MGM released 45s from Griffin into the early 1960s, he never scored a hit; later releases on Holiday Inn Records fared no better.	Though MGM released 45s from Griffin into the early 1960s, he never scored a hit; later releases on Holiday Inn Records fared no better.	/m/06zm_rx	Holiday_Inn_Records	100	119	/business/business_operation,/music/record_label,/organization/organization
The other Sun Records that preceded the Memphis company by nearly forty years in one case, and six years in the other, or even those that were contemporary with it were never as significant to the history of 20th century music as Sam Phillips' little record company that operated out of his Memphis Recording Service. Since Sam had invested in the Holiday Inn Hotel chain earlier, he also recorded artist starting in 1963 on the label Holiday Inn Records for Kemmons Wilson.	Since Sam had invested in the Holiday Inn Hotel chain earlier, he also recorded artist starting in 1963 on the label Holiday Inn Records for Kemmons Wilson.	/m/06zm_rx	Holiday_Inn_Records	117	136	/business/business_operation,/music/record_label,/organization/organization
He moved around the United States trying to get a recording contract, eventually issuing a handful of singles with Atlantic, Styletone and Holiday Inn in the late 1960s and early 1970s. He also performed on Night Train in the mid 1960s.	He moved around the United States trying to get a recording contract, eventually issuing a handful of singles with Atlantic, Styletone and Holiday Inn in the late 1960s and early 1970s.	/m/06zm_rx	Holiday_Inn_Records	139	150	/business/business_operation,/music/record_label,/organization/organization
In 2002, Thornton began recording The Resurrection of Dr. Octagon with producer Fanatik J, signing a contract with CMH Records to release the album, which was eventually completed without much input from Thornton, due to a falling out over contractual terms. Thornton, Marc Live and H-Bomb formed the group KHM, releasing the album Game on November 19, 2002, changing their name to "The Clayborne Family" by the release of their second album.	In 2002, Thornton began recording The Resurrection of Dr. Octagon with producer Fanatik J, signing a contract with CMH Records to release the album, which was eventually completed without much input from Thornton, due to a falling out over contractual terms.	/m/04043c0	CMH_Records	115	126	/business/business_operation,/business/employer,/internet/website_owner,/music/record_label,/organization/organization
After shopping around demos for the proposed album, Thornton signed a contract with CMH Records to release the album. On July 23, 2002, Rolling Stone reported that a new Dr. Octagon album would be released in February 2003. As production on the album was underway, Thornton had a falling out with Fanatik J over contract rights, and the One-Watt Sun production team was hired to create the album's music. After completing three vocal tracks with the label, based upon rough sonic themes created by the production team, Thornton had a falling out with the label, and gave the label recordings he had made two years previously, consisting of Thornton rapping and goofing off, in order to complete his contract. The resulting album, The Return of Dr. Octagon, was largely produced without Thornton's involvement, and did not resemble the direction Thornton had initially intended for the album.	After shopping around demos for the proposed album, Thornton signed a contract with CMH Records to release the album.	/m/04043c0	CMH_Records	84	95	/business/business_operation,/business/employer,/internet/website_owner,/music/record_label,/organization/organization
