paragraph	sentence	mid	title	start	end	notable_types
Persona is an EP released by the Australian band Karnivool. The disc was originally released on 1 March 2001 via Sic Squared Records, selling 2,000 copies. It was re-released on the band's own label on 12 December 2005 via MGM Distribution, whilst the band were touring for their album Themata. The re-release reaching #1 on the AIR Charts Top 20 Singles (Independent Distribution) chart. The re-release featured a different inkblot cover. In 2006, the EP was nominated for 'Best Performing Single/EP' at the inaugural Australian Independent Record Labels Association (AIR) Awards. The EP was subsequently released in the United States on 24 April 2007.	The disc was originally released on 1 March 2001 via Sic Squared Records, selling 2,000 copies.	/m/02pxql5	Sic_Squared_Records	53	72	/business/business_operation,/business/employer,/internet/social_network_user,/music/record_label,/organization/organization
Lars Bygdén was born 1973 in Sundsvall, Sweden. His musical career started as guitarist in the psychedelic bands Magic Broom and The Shades of Orange. In 1996 Bygdén formed the country-rock combo The Thousand Dollar Playboys. The group released two critically acclaimed albums and got a lot of attention in Swedish media. The band dissolved in 2003. Lars Bygdén has continued as a solo-artist on the record label Massproduktion and released his first solo album Trading Happiness for Songs in 2005 which won the Swedish Manifest award for best singer/songwriter album of the year. The album included the song This Road, a duet featuring Ane Brun (also featured on Brun's album Duets). In 2006 Lars did the theme song for the Swedish TV-show Grattis Världen!, a cover of Iggy Pop's The Passenger. In the spring of 2009 Bygdén released his second solo-album, the conceptual Family Feelings.	Lars Bygdén has continued as a solo-artist on the record label Massproduktion and released his first solo album Trading Happiness for Songs in 2005 which won the Swedish Manifest award for best singer/songwriter album of the year.	/m/02r_c5z	Massproduktion	63	77	/business/business_operation,/business/employer,/music/record_label,/organization/organization
In February 1979 they released their first album on their own label Massproduktion. It had a print run of 492 numbered copies and is now regarded as a collector's item.	In February 1979 they released their first album on their own label Massproduktion.	/m/02r_c5z	Massproduktion	68	82	/business/business_operation,/business/employer,/music/record_label,/organization/organization
Paradise Found is an acoustic/electronic band from Reading, UK. They make recordings under the Dancing Turtle Records label. Their first self-titled album was a combination of warm repetitive guitar loops with occasional vocals. Their music is a blend that borrows from the likes of Boards of Canada and Steve Reich to create a minimalist hypnotic sound.	They make recordings under the Dancing Turtle Records label.	/m/02vm_q5	Dancing_Turtle_Records	31	53	/business/business_operation,/business/employer,/internet/social_network_user,/music/record_label,/organization/organization
The Lani Singers have released one album entitled Ninalik Ndawi. Translated into English this means freedom song. The album was released in November 2008 through the British independent record label Dancing Turtle Records. The album in the sleevenotes as being a mixture of traditional songs passed down through the generations by elders, as well some of their own compositions reflective of their plight. It was produced by English producer Engin Hassan, and as well as Benny and Maria also featured English musicians Roger Harmar on fretless bass and Nick Radcliffe on slide guitar. The album was described by the Guardian newspaper in the UK as 'a gently haunting, rhythmic set that results from a remarkable personal story, and a little-reported struggle'. The group also undertook interviews and live sessions on BBC Radio 3 and BBC Radio London to support the release.	The album was released in November 2008 through the British independent record label Dancing Turtle Records.	/m/02vm_q5	Dancing_Turtle_Records	85	107	/business/business_operation,/business/employer,/internet/social_network_user,/music/record_label,/organization/organization
Dancing Turtle Records was launched in 2005, with a remit to produce music from emerging artists around the world. It has released music from artists coming from countries including Japan, West Papua, Brazil, Italy and the UK. The label's management division looks after the interests of The Lani Singers and Inkliing.	Dancing Turtle Records was launched in 2005, with a remit to produce music from emerging artists around the world.	/m/02vm_q5	Dancing_Turtle_Records	0	22	/business/business_operation,/business/employer,/internet/social_network_user,/music/record_label,/organization/organization
Major Records released in 5 April 2007 in Europe a special edition of the album, including a bonus disc with remixes and B-sides. So Sweet Records did the same in 5 November 2007 in the United Kingdom and the United States, with a different bonus disc.	Major Records released in 5 April 2007 in Europe a special edition of the album, including a bonus disc with remixes and B-sides.	/m/02wbmqs	Major_Records	0	13	/business/business_operation,/business/employer,/music/record_label,/organization/organization
In 2006, X-Perience got a new contract, this time with Major Records in Hamburg. They released their comeback single "Return to Paradise" and the fourth album Lost in Paradise, including new versions of the first three X-Perience hits, mixed by José Alvarez-Brill. The album also included a duet with Midge Ure (Ultravox, Visage) called Personal Heaven, which was released as another single.	In 2006, X-Perience got a new contract, this time with Major Records in Hamburg.	/m/02wbmqs	Major_Records	55	68	/business/business_operation,/business/employer,/music/record_label,/organization/organization
In 2007 Roi signed a 2 album deal with Hamburg based Major Records Medien GmbH, the European home of Nitzer Ebb, Ladytron and IAMX, and signed a publishing deal with Warner/Chappell Entertainment GmbH. Major released the song ‘Disbehave' from 'Product For Your Insecurity' as a single at the end of that year.	In 2007 Roi signed a 2 album deal with Hamburg based Major Records Medien GmbH, the European home of Nitzer Ebb, Ladytron and IAMX, and signed a publishing deal with Warner/Chappell Entertainment GmbH.	/m/02wbmqs	Major_Records	53	66	/business/business_operation,/business/employer,/music/record_label,/organization/organization
During the recording sessions of their second album Words Once Said, Celluloide records 6 covers of 80's wave classics turned into Celluloide's synthpop style under the name 'Naphtaline EP' which announces the improved sound of the new album to come... 2004 sees the band's second album released: 'Words Once Said', which follows the way opened with 'Naive Heart', with 12 pure synthpop clean songs. Refining their style between retro and modern, Words Once Said will also define new directions of the band's sound. After few months Celluloide signs with Boytronic's label Major Records for a re-release of Words Once Said for Germany with a very special edition including a track in German...	After few months Celluloide signs with Boytronic's label Major Records for a re-release of Words Once Said for Germany with a very special edition including a track in German...	/m/02wbmqs	Major_Records	57	70	/business/business_operation,/business/employer,/music/record_label,/organization/organization
Industrial Complex is the sixth studio album from British EBM group Nitzer Ebb. It was released by Major Records on January 22, 2010 (2010-01-22) in Europe, fifteen years after the band's last studio album. This is the band's first release after parting company with Mute Records following its 2006 retrospective, Body of Work. The Belgian edition (from Alfa Matrix) includes various bonus tracks.	It was released by Major Records on January 22, 2010 (2010-01-22) in Europe, fifteen years after the band's last studio album.	/m/02wbmqs	Major_Records	19	32	/business/business_operation,/business/employer,/music/record_label,/organization/organization
Erotic Elk is a Swedish band making electronic music. The band was founded in the beginning of 2009. Their debut album, Design With Circuitry, released by Major Records was well received:	Their debut album, Design With Circuitry, released by Major Records was well received:	/m/02wbmqs	Major_Records	54	67	/business/business_operation,/business/employer,/music/record_label,/organization/organization
Boytronic is a German music group that plays electropop. It was founded in 1983 by Holger Wobker and Peter Sawatzki in Hamburg, Germany as Kapitän Sehnsucht (Captain Desire). The original Boytronic released two synthpop albums: "The Working Model" (1983) and "The Continental" (1985). The record company, claiming rights to the band name, put together a completely different line-up in 1986. It was headed by Hayo Lewerentz (Hayo Panarinfo) (U96/Major Records) and continued to record under the Boytronic name until the mid-90's. In 2002, Boytronic was revived by Wobker from the original group and Panarinfo from the second incarnation.	It was headed by Hayo Lewerentz (Hayo Panarinfo) (U96/Major Records) and continued to record under the Boytronic name until the mid-90's.	/m/02wbmqs	Major_Records	54	67	/business/business_operation,/business/employer,/music/record_label,/organization/organization
The 1990s opened with a number of lineup changes, swiftly followed by the 1991 album Hey Cop! If I Had a Face Like Yours..., featuring Bill Collins (formerly of Fang,Special Forces, Intensified Chaos) on guitar and Matt Freeman (of Operation Ivy and Rancid) on bass. Collins wrote all the music on the album and sang three of the songs. This lineup toured the US and Europe. The acclaimed Shades of Brown album appeared in 1993, released by New Red Archives in the U.S. and We Bite in Europe. The album featured the Hip-Hop vegetarian song "Real Food, Real People, Real Bullets". MDC, now with guitarist Chris Wilder (formerly of Stikky) and bassist Erica Liss, marked the album with a tour of the former Soviet Union, making MDC the first American punk band to tour Russia. This was followed by two more European tours and several U.S. tours until 1995, where began a lull in the band's activity. The lack of new recorded material, other than a 7-inch release on Slap-a-Ham Records, and live performances after 1994, plus personal problems of band members, pointed to an informal break-up of the band.	The lack of new recorded material, other than a 7-inch release on Slap-a-Ham Records, and live performances after 1994, plus personal problems of band members, pointed to an informal break-up of the band.	/m/03ch1qq	Slap-a-Ham_Records	66	84	/business/business_operation,/business/employer,/music/record_label,/organization/organization
An important American crust punk band was Aus Rotten from Pittsburgh, Pennsylvania. Crust punk also flourished in Minneapolis, shepherded by the Profane Existence label. In this period, the ethos of crust punk became particularly codified, with vegetarianism, feminism, and sometimes straight edge being prescribed by many of the figures in the scene. The powerviolence scene associated with Slap-a-Ham Records was in close proximity to crust punk, particularly in the case of Man Is the Bastard and Dropdead. Crust was also prominent in the American South, where Prank Records and CrimethInc. acted as focal points of the scene. The most well-known representative of Southern crust was His Hero Is Gone. Prominent crust punk groups (Driller Killer, Totalitär, Skitsystem, Wolfbrigade, and Disfear) also emerged from Sweden, which had always had a strong D-beat scene. Many of these groups developed in parallel with the much more commercial Scandinavian death metal scene.	The powerviolence scene associated with Slap-a-Ham Records was in close proximity to crust punk, particularly in the case of Man Is the Bastard and Dropdead.	/m/03ch1qq	Slap-a-Ham_Records	40	58	/business/business_operation,/business/employer,/music/record_label,/organization/organization
An important American crust punk band was Aus-Rotten from Pittsburgh, Pennsylvania. Crust punk also flourished in Minneapolis, shepherded by the Profane Existence label. In this period, the ethos of crust punk became particularly codified, with vegetarianism, feminism, and sometimes straight edge being prescribed by many of the figures in the scene. The powerviolence scene associated with Slap-a-Ham Records was in close proximity to crust punk, particularly in the case of Man Is the Bastard and Dropdead. Crust was also prominent in the American South, where Prank Records and CrimethInc. acted as focal points of the scene. The most well-known representative of Southern crust was His Hero Is Gone. Many Swedish groups of the 1990s began to play a combination of D-beat with crust punk. These bands, including No Security, Driller Killer, Totalitär, Skitsystem, Wolfbrigade, and Disfear, remain some of the most well-known D-beat bands, although their sound has cleaved closely to developments in death metal.	The powerviolence scene associated with Slap-a-Ham Records was in close proximity to crust punk, particularly in the case of Man Is the Bastard and Dropdead.	/m/03ch1qq	Slap-a-Ham_Records	40	58	/business/business_operation,/business/employer,/music/record_label,/organization/organization
Drone metal was first established by Earth, a group from Seattle, formed in 1990, which has been described as "minimalist post-grunge". Earth took inspiration from the sludge metal of Melvins and the minimalist music of La Monte Young, among other sources. Stephen O'Malley's group Burning Witch, formed five years later, also in Seattle, continued in this tradition, incorporating unusual vocals and bursts of audio feedback. The group initially recorded for the prominent powerviolence label Slap-a-Ham. O'Malley's subsequent group, Sunn O))), initially formed as a tribute to Earth, is most responsible for the contemporary prominence of the drone metal style. Godflesh is also a stated influence on many groups. Boris, from Tokyo, also developed a style of drone metal, parallel with the Seattle groups, as did Corrupted, from Osaka.	The group initially recorded for the prominent powerviolence label Slap-a-Ham.	/m/03ch1qq	Slap-a-Ham_Records	67	77	/business/business_operation,/business/employer,/music/record_label,/organization/organization
In 1991, Spazz bassist and vocalist Chris Dodge, who also ran Slap-a-Ham Records, asked the band to send him a demo. Five months after that recording, in the fall of 1991, their seven song self-titled 7" was released, including a firing squad cover photo. In 1992, the band recorded a live radio show on KSPC, a split 5" with Dropdead, a contribution to Slap-a-ham's SON OF BLLLEEEAAAUUURRRRGGHHH! compilation 7", and a split 7" with Man is the Bastard. By 1993, Crossed Out, along with Man is the Bastard, No Comment and Capitalist Casualties, played 924 Gilman Street's first power violence-only show, the Fiesta Grande. After the departure of original bassist Rich Hart, Eric Wood - bassist and vocalist of Man is the Bastard - volunteered to play bass; he remained with the group until their break up. The summer that followed, Dropdead toured the U.S with the release of their split 5", playing two shows with Crossed Out. An August 1993 show with Spazz, Anal Cunt, and Dropdead, titled "Grindcore Night", on a flyer at Gilman St., led to the vocalist's comment "Fuck grindcore". "Fuck Grindcore" later became a bootleg 10" of their self-titled record. The group broke up in late 1993.	In 1991, Spazz bassist and vocalist Chris Dodge, who also ran Slap-a-Ham Records, asked the band to send him a demo.	/m/03ch1qq	Slap-a-Ham_Records	62	80	/business/business_operation,/business/employer,/music/record_label,/organization/organization
The band followed up with the All That Remains 7" E.P., released on Relapse Records. In 1994 Phobia released the Return to Desolation CD/E.P. and went on a small west coast tour with well-known hardcore punk bands, such as Capitalist Casualties. In 1997 Slap-a-Ham Records released the Enslaved 7" E.P. and went on yet another west coast tour.	In 1997 Slap-a-Ham Records released the Enslaved 7" E.P.	/m/03ch1qq	Slap-a-Ham_Records	8	26	/business/business_operation,/business/employer,/music/record_label,/organization/organization
Formed in 1994 in Oakland, California, Benümb became known within the local hardcore community as a respected grindcore band. The band went through various lineup changes during their early years. After playing together for almost a year, a split 7" with Short Hate Temper was released in mid-1995 on the Same Day label. Benümb spent the next year and a half playing shows with bands including Man is the Bastard, Spazz, Exhumed, Dystopia and Capitalist Casualties, among others. In 1997 the band recorded and released numerous 7" records, including splits with Dukes of Hazzard and Apartment 213. Their live set at the "Fiesta Grande" festival was recorded and released as part of the Fiesta Comes Alive! LP on Slap-a-Ham Records. In late 1997 the Gear In The Machine 7" was released on the Relapse 7" series, and in 1998 a live split with Suppression, pressed on a flexi-disc, accompanied issue No. 3 of the fanzine Monkeybite.	LP on Slap-a-Ham Records.	/m/03ch1qq	Slap-a-Ham_Records	6	24	/business/business_operation,/business/employer,/music/record_label,/organization/organization
Spazz vocalist and bassist Chris Dodge's record label Slap-a-Ham Records was a fixture during the rapid rise and decline of powerviolence, releasing influential records by Neanderthal, No Comment, Crossed Out, Infest, and Spazz. The label's Fiesta Grande was an annual powerviolence festival held at 924 Gilman from 1993 to 2000. Spazz drummer Max Ward's label 625 Thrashcore has started its own festival, Super Sabado Gigante, in a similar vein. While powerviolence is closely related to thrashcore (often referred to simply as "thrash"), the style is distinct from the thrash metal groups active in the same place, at the same time.	Spazz vocalist and bassist Chris Dodge's record label Slap-a-Ham Records was a fixture during the rapid rise and decline of powerviolence, releasing influential records by Neanderthal, No Comment, Crossed Out, Infest, and Spazz.	/m/03ch1qq	Slap-a-Ham_Records	54	72	/business/business_operation,/business/employer,/music/record_label,/organization/organization
He has recorded number of solo albums, and has recorded or performed with Stan Getz, Red Callender, Larry Gales, Milcho Leviev, Ira Schulman, Rod Oakes, and many others. His main musical partner in recent years (2000s) has been trombonist Rod Oakes (including early recording Live In Your Bedroom, Oakes Plays Rod, and most recently, Redux – all on III Records).	His main musical partner in recent years (2000s) has been trombonist Rod Oakes (including early recording Live In Your Bedroom, Oakes Plays Rod, and most recently, Redux – all on III Records).	/m/09bwkw	III_Records	179	190	/business/business_operation,/business/employer,/music/record_label,/organization/organization
Igor and Rod Oakes founded OGOGO in 1996, which is one of the most important organizations to perform improvised music. (The OGOGO is still going, though now it can be anywhere from solo to extra large ensemble.) Nowadays Igor has a close association with III Records.	) Nowadays Igor has a close association with III Records.	/m/09bwkw	III_Records	45	56	/business/business_operation,/business/employer,/music/record_label,/organization/organization
Members of what was to become the OGOGO performed together under various band names in the early 1990s, releasing their first album, Live In Your Bedroom, as the OGOGO in 1998 on Innova Recordings. The OGOGO on that album included trombonist Rodney Oakes and guitarist Igor Grigoriev. Igor is leading The OGOGO, an ensemble with an ever-changing lineup. Since 1998 they made a number of recordings for III Records sometimes extending their lineup to Extra Large Ensemble (known as XLOGOGO).	Since 1998 they made a number of recordings for III Records sometimes extending their lineup to Extra Large Ensemble (known as XLOGOGO).	/m/09bwkw	III_Records	48	59	/business/business_operation,/business/employer,/music/record_label,/organization/organization
On February 13 of 2009 OGOGO's newest release, Redux, , a duo of two wonderful musicians, Igor Grigoriev (guitar) and Rodney Oakes (MIDI trombone), became available on III Records.	On February 13 of 2009 OGOGO's newest release, Redux, , a duo of two wonderful musicians, Igor Grigoriev (guitar) and Rodney Oakes (MIDI trombone), became available on III Records.	/m/09bwkw	III_Records	168	179	/business/business_operation,/business/employer,/music/record_label,/organization/organization
She instead signed a deal with East West Records, a division of Elektra Entertainment Group at that time, in 1996 to create her own imprint, The Goldmind Inc., for which she would record as a solo artist. Timbaland was again recruited as her production partner, a role he would hold on most of Elliott's solo releases.	She instead signed a deal with East West Records, a division of Elektra Entertainment Group at that time, in 1996 to create her own imprint, The Goldmind Inc., for which she would record as a solo artist.	/m/09gqdl	The_Goldmind_Inc.	141	158	/business/business_operation,/business/employer,/music/record_label,/organization/organization
In 2007, Tweet departed from Missy Elliott's Goldmind camp and signed to Jheryl Busby and Mike City's record label, Umbrella Recordings, whose acts included Patti LaBelle, Carl Thomas, among other well-known R&B chart climbers. There she began recording material for her third album, formerly titled, Love, Tweet.	In 2007, Tweet departed from Missy Elliott's Goldmind camp and signed to Jheryl Busby and Mike City's record label, Umbrella Recordings, whose acts included Patti LaBelle, Carl Thomas, among other well-known R&B chart climbers.	/m/09gqdl	The_Goldmind_Inc.	45	58	/business/business_operation,/business/employer,/music/record_label,/organization/organization
Under Rhone's leadership, EastWest shot to mega success with several multiplatinum acts, such as: Simply Red, En Vogue, Pantera, Yo-Yo, Das EFX, Snow, Gerald Levert, AC/DC, Dream Theater, Missy Elliott and MC Lyte. EastWest also distributed other imprints, such as: Interscope Records, Motor Jams Records, Mecca Don Records and The Goldmind Inc.	EastWest also distributed other imprints, such as: Interscope Records, Motor Jams Records, Mecca Don Records and The Goldmind Inc.	/m/09gqdl	The_Goldmind_Inc.	113	130	/business/business_operation,/business/employer,/music/record_label,/organization/organization
Wray was born in Salinas, California on May 2, 1981, and raised in Portsmouth, Virginia. After being introduced to Missy Elliott, Wray was featured on Missy's platinum certified debut Supa Dupa Fly. When Elliott started her own label, The Goldmind, the then 17-year-old Wray was the first artist signed.	When Elliott started her own label, The Goldmind, the then 17-year-old Wray was the first artist signed.	/m/09gqdl	The_Goldmind_Inc.	36	48	/business/business_operation,/business/employer,/music/record_label,/organization/organization
In 1996, Elliott was signed to Elektra Records and was given her own record label, Goldmind. Chairmen and chief executive officer (CEO) of Elektra at the time, Sylvia Rhone encouraged Elliott to embark in a solo career. Supa Dupa Fly was recorded and produced solely by Timbaland, and was released in July 1997 through The Goldmind Inc. and Elektra Records. The album features the singles, "The Rain (Supa Dupa Fly)", "Sock It 2 Me", "Hit Em wit da Hee" and "Beep Me 911". Guest appearances on the album include Busta Rhymes, Ginuwine, Nicole and Aaliyah. The album debuted at number three on the Billboard 200 and topped the Billboard Top R&B/Hip-Hop Albums chart. It sold 1.2 million copies in the United States, where it was certified platinum by the Recording Industry Association of America.	In 1996, Elliott was signed to Elektra Records and was given her own record label, Goldmind.	/m/09gqdl	The_Goldmind_Inc.	83	91	/business/business_operation,/business/employer,/music/record_label,/organization/organization
In 1996, Elliott was signed to Elektra Records and was given her own record label, Goldmind. Chairmen and chief executive officer (CEO) of Elektra at the time, Sylvia Rhone encouraged Elliott to embark in a solo career. Supa Dupa Fly was recorded and produced solely by Timbaland, and was released in July 1997 through The Goldmind Inc. and Elektra Records. The album features the singles, "The Rain (Supa Dupa Fly)", "Sock It 2 Me", "Hit Em wit da Hee" and "Beep Me 911". Guest appearances on the album include Busta Rhymes, Ginuwine, Nicole and Aaliyah. The album debuted at number three on the Billboard 200 and topped the Billboard Top R&B/Hip-Hop Albums chart. It sold 1.2 million copies in the United States, where it was certified platinum by the Recording Industry Association of America.	Supa Dupa Fly was recorded and produced solely by Timbaland, and was released in July 1997 through The Goldmind Inc. and Elektra Records.	/m/09gqdl	The_Goldmind_Inc.	103	111	/business/business_operation,/business/employer,/music/record_label,/organization/organization
