Einaudi began using his style to compose film soundtracks in the mid-1990s. He started with two films by Michele Sordillo, Da qualche parte in città in 1994 and Acquario in 1996, for which he won the Grolla d'oro for best soundtrack. In 1998 he composed the soundtrack with Treno di panna, and that same year wrote the score for Giorni dispari by Dominick Tambasco.	Einaudi began using his style to compose film soundtracks in the mid-1990s.	/m/01lrt4w	Ludovico_Einaudi	0	7
The apple is the pomaceous fruit of the apple tree, species Malus domestica in the rose family (Rosaceae). It is one of the most widely cultivated tree fruits, and the most widely known of the many members of genus Malus that are used by humans. Apples grow on small, deciduous trees. The tree originated in Central Asia, where its wild ancestor, Malus sieversii, is still found today. Apples have been grown for thousands of years in Asia and Europe, and were brought to North America by European colonists. Apples have been present in the mythology and religions of many cultures, including Norse, Greek and Christian traditions. In 2010, the fruit's genome was decoded, leading to new understandings of disease control and selective breeding in apple production.	Apple grow on small, deciduous trees.	/m/014j1m	Apple	0	6
By the end of the 1970s, Apple had a staff of computer designers and a production line. The company introduced the Apple III in May 1980 in an attempt to compete with IBM and Microsoft in the business and corporate computing market.	By the end of the 1970s, Apple had a staff of computer designers and a production line.	/m/0k8z	Apple_Inc.	25	30
More than 1,000 people took part in multiple anti-capitalist demonstrations in Frankfurt on Friday, targeting among others the European Central Bank and banking giant Deutsche Bank, organisers and police said. Voice of Russia's source in Deutsche Bank commented on situation.	More than 1,000 people took part in multiple anti-capitalist demonstrations in Frankfurt on Friday, targeting among others the European Central Bank and banking giant Deutsche Bank, organisers and police said.	/m/02lc8s	Deutsche_Bank	167	180
Joseph Stiglitz said U.S. inequality is at the highest point in nearly a century and the gap between those with the median income and those at the top is growing.	Joseph Stiglitz said U.S. inequality is at the highest point in nearly a century and the gap between those with the median income and those at the top is growing.	/m/0g_61	Joseph_Stiglitz	0	15
The Parliament of Italy has recognized the Griko community of Reggio Calabria and Salento as an ethnic and linguistic minority, under the name of "Minoranze linguistiche Grike dell'Etnia Griko-Calabrese e Salentina" (linguistic minority of the Griko-Calabrian and Salentinian ethnicity).	The Parliament of Italy has recognized the Griko community of Reggio Calabria and Salento as an ethnic and linguistic minority.	/m/03w97w	Salento	82	89
